Tweet,HS_Gender
banci kaleng malu pe anyaan 2 nyungsep koe uniform resource locator,1
bu guru enak jablay guru sekolah dasar sih kayak nikmat pecun guru,1
cowok gantle gantle nama banci,1
kali gue gemar korea pop omong teman teman gue idol gue banci homo,1
bajing homo hati hati hadap anak anak utama kamar mandi laki laki biar uniform resource locator,1
transgender anjing uniform resource locator,1
anak pecun hobi zina haha,1
nya menteri suha o homo,1
bicara mulut sepe i banci beli kaca lihat bro,1
tunggu komando imam bejat cabul tai bir bawa ulama dasar banj sempak,1
kayak banci kaleng gatot gaduh gentleman mundur saing pilih presiden 2019 lawan jokowi,1
sinyal kontol pelihara niat sih login twitter doang susah open redtube setan,1
kayak jablay grand theft auto jemput pakai mobil,1
ih banci selotipan,1
ahok verbal keras lampias lari lelaki lunak,1
sih bejat cabul kecut sih onta iya,1
yaelah chat urus lihat mesum anggota dewan wakil rakyat diam nyata selingkuh tujuh pura pura budek cebong iq ratus otak,1
langsung tag ainya berani ya bera i banci,1
kristus anjing anjing jembut keparat picek tai pejuh siwuk kutang siwuk idiot keparat picek tai pejuh siwuk kutang siwuk idiot keparat picek tai pejuh siwuk kutang siwuk idiot keparat picek tai pejuh siwuk kutang siwuk idiot keparat picek tai pejuh siwuk k,1
banci kampung heeee,1
perjaka jual sok sok an booking tante idiot anjir,1
umat islam maksud front bela islam hati muslim nista islam bajing muslim onar kecut lari mesum islam islam gilir mesum islam onar islam,1
kontol iya hapus,1
bencong bacot cewek kayak banci amen kasih duit bacot mending cakap jelek kayak suram mentioned gue langsung kutip twit,1
perek sih doll ya,1
ajak muslim cari muhammad enak enak cocok cocok penis bangsa susah,1
eh dungu mention mention gue puter alun gue forward berita analisa kelompok manusia homo cerdas wkwk wkwk wkwk,1
homo sial bajing goblok gian amput anjing tepi jalan moga terima balas nya,1
alah kontol,1
nih ya gue cowok burung cewek cewek nada nada transgender indonesia nyanyi uniform resource locator,1
pecun kelas teri nih uniform resource locator,1
hormat lacur pakde iblis betina kerja sebar hoaks nista sih hidup,1
jijik manusia homo,1
kayak kontol,1
kno gue bilang bencong hati makan duit perintah sah ganti dasar pancasila negara khilafah bencong nama,1
cewek manusia homo,1
tentara saudi suriah isis banci lari libya uniform resource locator uniform resource locator,1
najis banget erel bencong,1
eto homo,1
wisma darul aman kerja banci politik,1
manusia homo,1
hmmm cium aroma aroma jablay bangsat iya pergi,1
mas manusia homo suka pentil mimi peri,1
perempuan kayak mending mati deh jelek sok make up a ist,1
bencong idiot it berani akun asli sebar hoaks fitnah coba lihat akun cong,1
nih utang era jokowi bencong diam sih gembel warung internet banci kaleng,1
jomlo jablay kayak perek,1
kaum bani cabul bohong makan bohong pulang donatur azab allah,1
monyet ekor banci plonga plongo,1
lihat tampang tampang banci lgbt uniform resource locator,1
sesat lurus allah subhanahu wa taala ajar bangun keluarga cocok cocok penis,1
muka cabul muka sih banci berani anonim,1
indonesia lenyap 2030 puja tolol ya tolol bencong anak nya bencong,1
dasar wkwk manusia homo,1
banci kaleng,1
ancam ancam kayak banci jancuk,1
tulis spo ifitas salah spo ivitas ahai banci kaleng kena goreng malu sih gembel warung internet,1
bangsat banci,1
balas banget ih sih pecun gerak cepat ah,1
sadar wanita indonesia muhammad bejat khadijah tinggal perempuan budak seks,1
twit bikin warganet suuzan ngentot,1
fi nih cewek burik now bangsat nyata hode burik,1
bacot pecun,1
wajah anak lihat banget ya penuh dendam benci anak anak makan hasil uang haram kayak banci rumpi maki gue makan tai istri a anak anak o makan bangkai uang haram,1
bilang otak gue belatung sarang ah eh banci isi otak hati isi belatung bangkai benci akut,1
bencong hasil selingkuh maknya perek gerwani kuda prabowo lahir sih onta bencong akun abal abal ngeooaahahahaaaaa xf,1
lipstick sapu tangan bora hati mampus malu makan cipok,1
ih kontol,1
koar koar nya gera umat eh ngebacotnya dukung politik dasar bani cabul otak 212 monas,1
ayo muslim hantam lgbt rakyat paham buang islam parmusi dorong rancang undang undang anti paham lgbt,1
ya gue kakak laki mulut lemas banget kayak banci marah mentolo gue cangkem e,1
gampang banget sih orang puji kayak hormat haha tolol,1
sih tabib cabul teriak teriak karuan sambi kocok tongkol gambar bugil pecun hoaalaaaah bayang dasar binatang uniform resource locator,1
senang hati sih cewek lepas sih mbak angkut mbak gang bang perkosa kunyuk selesai sih mbak mobil marah pergi bilang perkosa,1
banci gentleman orang,1
puisi bajing wajah setan mulut iblis manusia binatang mesum seni monyet,1
lekong,1
sih banci akun palsu bilang utang perintah era,1
jablay anjir,1
cowok kasih gue bangsat lo bejat cewek astaga,1
ate bocah kontol goblok sontoloyo kepala gatel sial anjing berengsek,1
anti kritik kontol mu bangsat orang idiot tau hate speech,1
agel perek,1
gue kenal kayak kenal dasar banci,1
perek,1
kristen lesbi ya,1
suka payudara dasar ajar tampar pamer puji berengsek,1
on the way manusia homo,1
dasar tau fiksi unduh buku gampang dasar perek harga ratus,1
nih bicara orang ingus bicara nya ngawur nya gue blok banci uniform resource locator,1
bangkai yen cabul,1
aduh bencong serang cong rumpi deh lonte laki laki dapur cong banci kalah anak duda designer ln x,1
indonesia alhamdulillah ya allah selamat anak anak thailand thai selamat manusia manusia kafir tuhan kontol,1
bodoh question ngentot puasa goblok,1
bani coli beda junjung kawan kawan haha,1
suasana hati kerja ubah nih banci,1
rahasia bong koruptor rampok laku maksiat laku bisnis maksiat kaum lgbt jilat dukun sesat dukun cabul nabila bla bla gabung bani cebong,1
partai adil sejahtera ai lacur beyek germo partai adil sejahtera sadar susilo bambang yudhoyono otak kriminalisasi lhi politik islam khianat prabowo hatta langgar pilih presiden 2014 hancur citra islam 2010 2018 partai adil sejahtera susup antek be,1
otak tara gender telanjang dasar mesum cacat,1
udik kasihan tidur,1
ajar aji ayat cocok cocok penis penggal kafir pahala biadab,1
anjing tai goblok idiot bangsat monyet babi fuck kont kangen goblok iya tau kasar banget maaf,1
cowok hobi swafoto beda nya lekong amp banci kaleng,1
lihat salah dukung mafia koruptor nista agama gerombol banci titot laku bidik arah,1
cowok berengsek ya,1
allah subhanahu wa taala benci kafir ajar cocok cocok penis istri gemar azab janji rampas,1
ahmad dhani hormat babi anjing kontol lonte tunggu nya karier mu habis,1
nama rizieq shihab status sangka konten pornografi duga dukung anies sandi,1
eh banci teriak kafir kafir suka coli muncrat teriak mulu berisik cong dasar mulut banci yahhhh,1
miris cowok be iga anjing anjing anjing anjing anjing cowok sanggup ya mulut rumpi diam kayak congor bebek film nya habis anjiiirr kesal ubun ubun tahan hati enak emosi,1
cina pasrah becek suka teriak suka ngewe squi,1
bani selangkang cabul,1
blok sih bencong anjing main unggah screenshot gue bencong tolol v laki ketemu adu jotos nyinyir unggah hasil screenshot v dasar bencong kontol,1
ah dasar jablay murah,1
ha orang kayak pecun dang aduh banget orang kayak bacot sesak napas,1
mulut banci urus dasar dasar iblis ujud manusia muncul jelang pilih kepala daerah syaraf,1
babi sipit banci pakai akun fake hina babi,1
hijrah hijrah arah parah sarana duit akhlak mabuk nikmat selangkang pecun dasar isi otak sempak susah ubah,1
bencong teriak bencong,1
bangga jongos babu jilat memek busuk jablay alexis,1
puasa sok sok cerita buka kantor ngentot fuck citra yosy bin o,1
psi kumpul perek perek perek laki laki sekretariat jenderal otak duit duit suruh pikir banget kebo,1
alas nsi banci takut malu uniform resource locator,1
anti cina komunis antek asing kapitalis rakus zionis suara enak enak ngentot ya,1
tani ahok biar puas ahok sih manusia homo,1
peeling suka orang munafik bilang kakak mw henti dunia halu nyata blued live coli ih anjing banget ya manusia homo kayak go to hell kakak kenal rugi kakak ngapain kenal orang munafik kayak,1
alah kasih pap nenen memek suka munafik deh weh upil kucing garong kasih ikan asin ya suka suka,1
adrp dasar jablay,1
tyas mirasih pecun bareng agency nya,1
jelek jelek orang nyali ya situ banci haha,1
amit amit jabang bayi dopinadoh minggato setan gembel setan banci surat putus otorisasi lini,1
alas nsi banci takut malu uniform resource locator,1
cocok cocok penis 4 istri perilaku seks simpang majelis ulama indonesia lgbt nilai perilaku seks simpang,1
muka burik bangsat ngewe,1
kayak banci kali ya,1
jablay ya,1
nih gera kontol bela chibi anjing,1
manusia homo ngewe,1
habis habis bang usir kafir cina nusantara racun akidah tukang sogok kristen lacur minum keras kafir anjing,1
cebong gila ngamuk ngamuk bela sih homo nista agama haha,1
tolol bencong bencoooooooonnnnnnggggg,1
kontol indihome,1
nya ngentot,1
riak ombudsman ombudsman banci kaleng ombudsman banci kaleng uniform resource locator,1
rupiah haneul sok mes cupu entot on retweet,1
titit anies nih wakil presiden prabowo anjing,1
ustad goblok nih tau kafir sunat umat yahudi bayi kayak nge i coli sunat muka,1
gembel sok elite ngewe sari ayu halo mas kelas kambing main gue 2001 main hotel jayaka a tematik klasik malio x2 sumo samping tutup alexis ah main cebong kelas kambing cc,1
bilang sayang tinggal gue kontol,1
tangkap jenderal banci kayak prabowo bodoh,1
banci kaleng kaleng kosong nyaring suara,1
hoi gay banci situ kafir ya nge i islam orang hijrah hijab wajib saudara iman tutup negatif dasar kaum laknatullah alaih,1
cewek x cowok kapel panggil daddy baby terima ya cowok x cowok pakai daddy baby an jijik bangsat,1
banci berani lawan norma norma masyarakat sok the lowest human being ya sih manusia kacrut,1
alquran kitab sampah aroma darah air mani tifatul,1
eh bencong fitnah fitnah ya,1
langsung main twitter sih bani bokep kemarin hobi kritik presiden kerja coli tonton bokep ya om miris xf,1
haha muka banci kecoa kafir z,1
oi anjing lacur ya laku bejat dasar anak haram wkwk,1
lihat salah dukung mafia koruptor nista agama gerombol banci titot laku bidik arah,1
sok ganteng banget sih bencong,1
haha kafir plonga plongo nih muka banci salon uniform resource locator,1
nih orang memek perek senang gue bilang emak perek ketemu ayo,1
berisik duo manusia homo,1
jiahahahhh sih bencong idiot galau keper nih sebar berita fitnah maklum sih gue bencong turun gerwani surat pemberitahuan cong fitnah makan surat pemberitahuan kerja suka mangkal emper hihi,1
iya ya monyet anjing gue gampar kesal astagfirullah azim bicara kasar maaf kali ngentot uniform resource locator,1
kampanye racist bicara nya ahok untung goblok kafir untung perkosa bunuh enak duit,1
anjing ayam kampus ya,1
udik gay,1
dasar duo homo sarap aduh pusing pala bebi,1
twitnya makan ringan gue cape gue urus banci,1
kabur main dongok tribun kosong panjat haha ah payah kontol kontol haha,1
wooyyy anjing lacur ya laku bejat dasar anak haram wkwk,1
njinggg bencong gaya pakai blok blok wa,1
persetan bocah kontol sok rad kecewa sekolah ganti nama sok mes tong biar coba sekolah kerja pacar tidur jajan sok sok an bilang harga,1
indonesia palsu tanah lacur,1
tuhan pilih gubernur lari arab ya cong nelo bencong otak idiot hina banget hidup ya cong,1
eh ngentot marah,1
oh paham cewek cadar cerita kali ya kasih tau cerita minum anjing pelihara anjing paham dasar banci asli cowok samar cewek cadar uniform resource locator,1
ciri khas cebong lekat kalah data fakta langsung otak porno 2019 ganti presiden 2019 presiden jokowi,1
oh ngewe mamak lahir hasil inses mamak ih banci sih ngewe laku anak haram kayak seram ya hater perintah ter,1
duhhh banci media sosial murid napi 2 kali bui ya rumpi banget kayak junjung cong bencong mbok ya adab kayak residivis mentang mentang guru mantan residivis 2 kali b,1
mardani presiden presiden manusia homo pe indonesia juragan,1
bencong ivan percaya aduh kakak nya rebut laki orang bangga ya iya bilang hidup jujur jujur dese hobi boboin lekong mulu saban bal,1
jalan akses tuju velodrome pakai asean games hehe bijak gubernur sungguh titit kuda,1
indah cocot partai adil sejahtera bicara ketua kayak bencong gaya bicara aduh sadizzz,1
tai isi banci ya,1
mumpung gue puasa ngentot,1
kuota searching ya monyet nyawa layang rezim orde kuota cari bokep biar otak kayak kampret bothnewyear baca buka wawas,1
atuhlah nete goblok,1
harap rizieq shihab pulang hadap hukum orang orang sawah taruh laut pecun dang berengsek jemput paksa kecuali polisi takut,1
congor baginda paham a i dialog baginda paham fulus amp ngaceng,1
dasar bencong,1
muka kontol monyet,1
sih perek,1
he kontol sok mes rupiah muka kayak memek orang tua kayak monyet agama agama kontol 35,1
sih bejat cabul kriminal oceh kriminalisasi ulama dasar munafik,1
alah kontol,1
alah bacot mulut lelaki terkadang,1
haha banci kaleng langsung nyungsep pakai akun palsu banci ya saracen waspada waspada,1
ahok kafir takut debat rakyat asli pribumi nelayan pakar reklamasi rakyat ahok kafir bencong,1
emak jual ya bajing anak lacur rupa,1
ustad ngentot ngentot pas dakwah ya kasih kutip dakwah,1
alah komplot banci,1
tolol sih cal laki,1
a is kampung gmnin udik kampung handphone anak gue cemplung gue beli pakai keringat halal hasil kangkang laki orang,1
kerja seks komersial tawar gerindra joko wi rakyat kere suruh jual kali bantu,1
jilbab akhlak pecun ncuihhh,1
bambang muka kontol hina ulama gue hajar dasar antek komunis,1
dasar manusia homo,1
teman manusia homo heran,1
hafal surah alquran masuk ayat ayat rang bunuh penggal kafir ayat cocok cocok penis,1
plagiat lagu kaum kontol,1
alamat kerja kasih biar bukti lgbt aka banci kaleng,1
bencong teriak bencong,1
bagas homo kemarin lihat profil grindr,1
auti auti autis ya banci autis seram lt,1
urus urus orang mulut nyinyir kayak banci lekong,1
cowok berengsek amp kecut orang cewek harap,1
kalem kontol,1
rokok bro gue rokok men ah banci rokok eh lihat banci rokok kali eh iya,1
gue enek urus orang tau dasar cewek alay,1
goblok rizieq tukang bikin onar wajar orang muak siang teriak takbir malam chat mesum munafik bikin orang bodoh kayak istri,1
iya pakai kendara jablay,1
wkwk gue bencong,1
cowok jaman putus suka jelek mantan bispak perek cowok kayak banci cabe cabe,1
eh perek gue hiatus tai,1
nampaknya paket sokong cina babi sokong lgbt,1
banci banget anjing mantan,1
sombong jomlo menang gue dasar manusia homo,1
iya bencong idiot surat pemberitahuan pakai foto asli,1
ya gue balas sakit jiwa ettt laki banci uniform resource locator,1
adik maling kerja maling mati maling anak haram kontol,1
gincu berani dasar banci,1
kisah nyata malin kundang 100 daftar nama kalimat ngewe wanita 1 menteri agama 2 ciputat 3 ciputat raya 4 bendi negara 5 bendi polisi 6 bendi tahan 7 surat terang catat polisi 8 sabang,1
sunat titit kalah anjing ahok hehe,1
sih banci bikin sensasi nih uniform resource locator,1
kodrat pecun dang pintar cari alas,1
manusia homo teriak manusia homo,1
kerudung sih transgender makan busuk seram laku wajah sundal bolong zaman now,1
menteri suha o homo,1
raih gue matre bayar fakta dasar banci potong fukonserawlex uniform resource locator,1
kerja seks komersial campur lepas kerudung kerja seks komersial baca twit nya fahri benci jokowi balas jokowi presiden maki maki orang fahri twit fahri penuh,1
ejek bacot ngentot nikah ajak ngewe,1
gue dengar bocah khayal mimpi basah komentar ulah anak orang kayak ayo bocah presiden hina,1
buka ekspektasi gue ya flasback bahas ngegoblokin laku pas sekolah biar have fun realitanya bahas kerja sombong anggap kerja kontol bangsat dasar adit fajar ilmiah,1
udik gay,1
pb wibowo gay ya,1
jablay ya cari perhati tulang tulang cih in ah,1
dungu ya dukung prabowo cong serang hadehhh dasar banci ya,1
bicara sih suruh sih cabul pulang banci,1
jimin link dasar manusia homo jin sueeeee gue idih ogaaaah non rebreathing mask gue suka cewek buru apussssssssssssss,1
presiden polling menang mimpi onani,1
gila coba faedah keroyok orang gara gara bikin meme bahan meme hubung keroyok boro boro anggota keluarga kenal kontol bangsat gobloooooooo,1
deh suruh sih banci pulang selesai pe anggung sp 3 tangan lantas banci,1
kafir banci ya ya ampun kafir banci sedih ya cong google deh kafir banci kayak,1
victor koar kayak bakar jenggot viktor ulang kali koar masjid jalan spe i sih banci guru viktor chat mesum bikin rusuh dunia dasar munafik,1
banci kaleng,1
bangsat sedak kentang gue wkwk tolol lendir memek anjing,1
a i pe anyaanmu tunggu 2 menit ya arti bencong gembel warung internet haha,1
akun ketua andre cebong susup homo kampret,1
gange i tentara nasional indonesia ngewe banci mending tania tentara nasional indonesia nya tania kasih memek uniform resource locator,1
allah hu barbar perintah penggal kafir bang fahri allah hu barbar ajar cocok cocok penis,1
jablay pacar gue bangsat gue ajar,1
cewek bejat banget sih cy,1
waaah sih perek gerwani gangbang babi sipit bentuk adik ya choong hancur hasil entot kuda babi sipit ngooaaahahaaa keluarga hewan,1
prabowo kecut tuduh elite goblok maling serampang jantan nama orang berani bera i banci maksud ketua ai lawan politik haha salam 2 periode,1
tau akun promosi gigolo pas lihat minat booking laki gay fix akun bencong najis ngentot,1
rupiah haneul bejat suka memek muka berondong on retweet,1
he kontol sok mes rupiah muka kayak memek orang tua kayak monyet agama agama kontol 9,1
haha gilir majikan mesum 7 sih kunyuk diam sok suci maki pikir sex muka lacur kunyuk,1
wajah anak lihat banget ya penuh dendam benci anak anak makan hasil uang haram kayak banci rumpi maki gue makan tai istri a anak anak o makan bangkai uang haram,1
songong bencong halu berita min,1
malu nama peci dasar pecun,1
omong mu rusak dasar kontol,1
banci uniform resource locator,1
banci berani balas dasar takut wkwk,1
dunia penuh munafik sok suci sepe i ahok bilang salah kabur sih cabul sih jijik jilat memek bohong kabur salah meme,1
pandai jilat pantat kuasa pandai tantang orang dasar lacur politik,1
bu sus cuil titit nyawa pikir letak kali cari pakai global positioning system google map ketemu,1
salah pangkah tai tai lgbt liberal raja ampu kafir harbi,1
manusia homo,1
banci banci,1
orang bodoh logika dangkal situ pintar menteri energi sumber daya mineral coba ajak debat sumber baca internet koar koar olah pintar bani cabul kibul kerja berisik,1
dewan wakil rakyat dewan wakil rakyat daerah jancuk anjing anjing babi kontol jembut bajing bangsat tempek gendeng taeeekkk banci,1
muka muka pecun nih,1
sok polos genit kayak banci,1
transgender iya biar tenar,1
kacau palsu sok cantik munafik bohong publik sensasi bencong uniform resource locator,1
jual memek media sosial dasar pecun,1
ambil tete mama ambil gue nete sapi,1
aduh ngentot ngentot,1
pikir 2019 ganti presiden deh ganti kelamin normal bacot,1
like the game itself is open to everything fuck markus ngewe simon instead sure here is the canon in game cerita orang bikin be iga markus pol serah nbut as bule,1
berani foto cundang antek antek kompeni tonton bokep mulu ditwitter hancur indonesia dasar otak mesum,1
sarap tega banget sih laku anak surat pemberitahuan hewan gue suami gue ambil anak gue lapor polisi amp gue cerai langsung cih najis perempuan kayak,1
agama islam kristen yahudi agama seks perempuan agama kerja ekstra keras manusia tara,1
lengkap tim anies sandi cabul makar,1
langsung tag ainya berani ya bera i banci,1
lu banci ku cewek takut serang cewek sembunyi wajah mu,1
ahmad dhani hormat babi anjing kontol lonte tunggu nya karier mu habis,1
jomlo jablay kebelet pacar jomlo jablay kebelet pacar,1
ih dasar manusia homo,1
ya tau keluarga onta dungu mak perek gerwani kuda prabowo ngeeooahahahaaaaaaa,1
sih mantan pacar sok sok bikin thread tipu daya laki laki malu titit,1
rizieq shihab front bela islam jancuk anjing kontol tempek anjing babi bajing bangsat lonte balon banci bencong tai cabul kecut cok teroris bubar organisasi masyarakat front bela islam hizbut tahrir indonesia makar,1
cowok usaha lacak perhati gue lantas remeh perhati gue kasih khusus basic cowok bego,0
telat tau edan sarap gue gaul cigax jifla cal licew,0
41 kadang pikir percaya tuhan jatuh kali kali kadang tuhan tinggal orang tua rencana pisah kakak pilih kristen anak ter,0
ku tau mata sipit lihat,0
kaum cebong kafir lihat dongok dungu haha,0
ya bani taplak kawan kawan,0
deklarasi pilih kepala daerah 2018 aman anti hoaks warga dukuh sari jabon,0
gue selesai re watch aldnoah zero kampret 2 karakter utama cowok kena friendzone bro xd uniform resource locator,0
admin belanja po nak makan ais kepal milo ais kepal horlicks cendol toping kau kau doket gerai rozak me uaku taipan 2 kembar baby amp romantika bank islam senawang,0
enak ngewe,0
gue jari gue ukur nyali bacot,0
ajar ekonomi mesti jago privatisasi hati orang aduh ironi,0
aktor huru hara 98 prabowo si lengser perintah jokowi nyata,0
lawan bicara gue intelek kayak otak kencing onta gue hadis nabi sahih kafir kayak tolak ahlun nar,0
pikir ampas banget ya,0
ari bek rapi monyet,0
alga mnr bom,0
anjing ya gue jarang ambek takut wkwk gue budak cinta,0
noob peluang sakit nya gede sih,0
joko widodo nilai presiden lemah sejarah indonesia jokowi milik modal dukung politik ketidakmampuan perintah hadap situasi ekonomi,0
ajar camat bilah hilir deklarasi anti hoaks amp pilih kepala daerah 2018 damai,0
bandara udara internasional ajati bangun gubernur ahmad heryawan anggar belanja negara perintah pusat insya allah operasi,0
gubernur presiden rakyat ya,0
sih kerja delay mulu setan,0
pintu sorga pintu sorga asli pintu hati modus banget,0
partai komunis indonesia muncul jelang pilih kepala daerah pilih presiden goreng gosong,0
nenek nenek heran cebong bohong,0
islam nusantara produk jil pasar gencar antek jil jil anti arab pro asing almarhum kh hasyim muzadi,0
habis sahur jam 10 si bayi nete kali lemas,0
kak emak suka sipit wkwk,0
laku homo jaman now ngentot live blued gay video gvid lokal hangat uniform resource locator,0
kak gue orang jawa maaf ya gue orang palembang kakak deh ajar aksara jawa kelak ajar budaya palembang,0
pegawai guardian training kayak mentang mentang gue kayak gembel kaos flat shoes dijutekin bangsat malas beli kabur gue matahari,0
para bajing luka lady terima ganjar ratus kali lipat sanji selamat ulang laut jkt48,0
aja tolak berita hoaks sukses pilih kepala daerah wilayah kota,0
presiden ri jokowi kerja nya tulus ikhlas rakyat jokowi,0
edan tuju fabiano,0
al alquran ya bang mulut kayak orang kafir bejat hina farhat abbas law,0
lihat beda wibawa wibawa gubernur indonesia masya allah,0
anjir kali lihat orang bego debat pilih kepala daerah kerja serang karakter kecewa on empok silvy and agus debat final pilih kepala daerah jakarta,0
gubernur zaman now gus ipul puti 2 ganjar yasin 1 djarot sihar 2 hasan anton 2 koster ace 1 nurdin sudirman 3 karolin gidot 2 keanekaragaman budaya suku agama sungguh kaya djarot hadap pese a rakercabsu,0
iya islam lokalisasi kristen mas nusantara mas lihat gereja bandung pakai gamelan khotbah pakai bahas sunda jawa huria kristen batak protestan nusantara,0
cipta situasi aman tertib masyarakat jelang pilih kepala daerah 2018 kepala polisi sektor konang silaturahmi tokoh masyarakat,0
positif nse positif respon masyarakat hadap cangkul impor garam impor beras impor jagung impor tenaga kerja impor esemka impor nurl,0
sembahyang adopsi tradisi lokal kerja hindu istilah sembahyang pun lahir tradisi ritus menyembahhyang tunggal shalat sembah all,0
didik bodoh larang bawa agama biar orang islam bayar ahok sadar pilih ahok gila,0
ahok the best abai kaum kampret otak micin,0
sih otak tempurung laden lawan dungu makan hehe,0
awaasss berita saudara gerung susah cari kosakata bocor picing mata bibir monyong samping suara ky nhn kentut politik kotor zaman b pulang ky nhn ngeden dungu,0
pinokio umur 3 2019 ganti presiden,0
cerita silat lae kho merah muda oh indonesia liang ie shen tulis cina,0
benci umat islam,0
provokasi mayat politisasi agama kalah pilih kepala daerah daerah khusus ibukota cebong deskripsi kalah junjung for your information ahok pilih camat wakil etnis mayoritas,0
gue nete,0
wkwk bani lowo,0
takabur lahir kuasa rakyat ulama cendikia iblis makhluk alim amp ibadah atus ratus laknat hasud takabur orang ahli ilmu filsafat failosof mari demo sendi,0
a orang suka konser konser boros,0
makan racun ulama hukum rokok mubah,0
susilo bambang yudhoyono presiden ri 6 khofifah emil masyarakat no 1 bagus khofifah emil nomor,0
suka video uniform resource locator kisah seteru haji bolot amp malih tongtong,0
budaya kafir sungguh islam indah,0
hem hem diam bisu coba rumput goyang,0
setan bisik was was lindung allah qs al a raf 200 fussilat 36,0
ateis sibuk agama orang,0
lengser jokowi bangsat,0
selamat kakak 2019 ganti presiden 2019 presiden,0
iya cocot,0
budaya indonesia,0
ajar salat a orang asing pecah belah islam,0
x bicara bangkai,0
percaya negara jajah ranah bubar sistem sistem beraja negara negara republik komunis negara negara jaja,0
nikmat bijak usul partai komunis indonesia iya,0
umpama orang cina usir paksa indonesia,0
bunda ngentot yuk,0
cina babi cina maling usir cina hypertext transfer protocol over secure socket layer t co 9y4hiwhjp2,0
karno anti asing beliau jawa coba deh adakan konsensus jawa anti asing pro asing kebo ohannya keliru tutup akun,0
proyek korupsi rezim susilo bambang yudhoyono uniform resource locator,0
wajar lihat tingkah petinggi negeri suka campur bahas indonesia bahas asing kali bicara,0
ab pribadi senang kompetisi positif,0
kitab suci agama bilang om dadak kalap,0
suka tutup mata tutup lihat te utup gara gara sipit,0
muslim nista kitab suci alquran an alquran an suku detik makna faktual umat islam makna sirat fiksi,0
eh kasar kampang,0
bentar gue rilis album the onta si wkwk,0
cebong bang,0
najis banget gue mentwit barusan he,0
awas bintit intip titit kucing,0
bawel bawa asa bolot bodor wkwk ya deh,0
