Tweet,HS_Other
kalah kuasa media cukong sembako pilih kepala daerah jaka a menang daerah tinggal sih raja hutang partai politik korup komisi berantas korupsi cukong koruptor bantu likuiditas bank indonesia rupiah 600 triliun bandar narkoba tenaga kerja asing cabut subsidi rakyat banc,1
pintar pintar nih rezim serah kerja anak tk pintar main mobile legend bo ongin congor,1
kepung kantor jaka a,1
bunuh munir era ya kakak bin nya ya pilih presiden 2014 tim sukses jokowi,1
cebong nge i,1
beda nya adid aidit aih dasar jongos jokowi,1
bayang potong adegan kesal isi lapor kacau kayak edit gue ejek gue bajak gebetannya biar sih kunyuk uniform resource locator,1
iya ahok pimpin nista agama penjara hypertext transfer protocol over secure socket layer t co yhho40qwxs,1
masak wakil rakyat contoh rakyat bayar tagih listrik listrik bayar salah jokowi tingkat ekonomi lesu amp fadli zon bayar listrik,1
setya novanto sangka hakim takut siram air keras mati dadak sepe i amerika uniform resource locator,1
perintah bastian lengser jokowi halang halang aksi bela islam,1
bodoh bego,1
cisol modar,1
duduk dewan wakil rakyat mantan menteri komunikasi informasi posting hoaks hadehhh doa jokowi endut gagal paham,1
bilang teman beli tiket mending belikan nih bensin gue dongok nih motor isi pakai air,1
cebong tolol klimaks berita hoaks,1
horeeee salah cebong paman kabar om,1
bacot sih cebong bangsat,1
banting gadget eeee shopeenya kacrut,1
negara jerat utang bijak boros 2019 ganti presiden 2019 presiden perintah anggar rupiah 300 gaji dosen asing,1
bani kampret ya nafsu kuasa korupsi jemaah sepe i kader partai adil sejahtera gubernur sumatra utara,1
inti partai adil sejahtera mesti salah salah otak cebong 2019 ganti presiden,1
eh bangsat nih jaring keparat kerja sih kerja bangsat mahal doang fasilitas kayak anjing babi,1
helikopter isi warga negara cina jatuh morowali sulawesi 2019 euy sabar 2019 ganti presiden,1
bego pakai tag gue,1
presiden cebong jokowi,1
iman tipu hukum halal demo kaum bani micin,1
sih bani taplak kalimantan barat terima kalah cundang perang ya nih calon gubernur porno dukung,1
pilih cebong otak intelligence quotient 200 kolam,1
rujuk sempak deh ruang gerak radikalisme teror batas bilang anti islam otak kotor onta,1
bangsa bajing anjing babi goblok,1
sentul kawasan prabowo habis jatah ya asyik,1
mabuk kencing onta ya brow,1
omong berak kasihan,1
haha gue saran show topeng monyet keliling kampung dongok monyet,1
praktik monopoli praktik nepotisme hubung kerabat gubernur daerah khusus ibukota ahok lawyer salah merek,1
buah serang perang twit kubu tel orang kader golkar kenal konsultan politik anies sandi,1
ya simpul dungu bingung iya makhluk kayak cebong urat malu otak mampat dungu ketulungan kasihan turun,1
biadab perempuan iblis,1
senang lihat bela ahok nista alquran milik ghirah agama be obat sesat bela nista agama,1
kenal glamor anjing home tai agency anjlok nya bacot kaca,1
jilat muslim agama hina amp nista sih ahok cangkem diam ahok kenang kaum jilat kayak,1
hebat curut belah machiaveli,1
fahri hamzah usir dewan wakil rakyat,1
harap panji politikus haus kuasa anies sandi no,1
susilo bambang yudhoyono 2 pura pura sakit,1
nih sih congor onta bego goblok ya suara congor onta luuu corong polisi republik indonesia njaaaaaaaaaancuuuuuuuuuuk,1
maju anjing nih gaya ah orang reply gung gung gung gunggg,1
syukur atuh pamer twitter goblok,1
taplak meja bani taplak inus,1
komentator dungu ya bro dungu nya otak haha,1
alay tai kayak bocah sekolah dasar wkwk,1
ustaz bawa politik dungu,1
jongos jongos nya jokowi kayak cacing panas wkwk,1
santai mas kualitas gubernur amp wakil gubernur modal saracen ya kayak sampah,1
heran dukung jokowi polemik film gera 30 september partai komunis indonesia aneh lari jalan mundur,1
waspada letnan jenderal purna suryo prabowo situasi situasi jelang gera 30 september partai komunis indonesia uniform resource locator,1
wkwk tolol,1
muuuaaak lihat muka sih tk kepret rr go publik,1
dungu lio evakuasi korban becus salah orang logika cebong goblok bangga,1
massa kerumun malam sengaja provokasi rusuh ciduk lempar tuding perintah pro komunis ah basi,1
bera i dukung orang orang buang sampah sembarang nih orang proteksi laut rakyat indonesia ijazah nya beli,1
mahasiswa teriak teriak anti soeha o orde dukung jilat pantat sisa sisa antek soeha o,1
prediksi jatuh orang orang warga cina 2019 ganti presiden,1
negeri sontoloyo status hukum nya,1
28 anak mc donalds anjir bobrok idiot kampung malu malu marah sayang bikin ku tertawa wkwk,1
dit abang kasih rahasia bang bim main kak chaca adit eh dit serius dengar abang gue izin maincraft deh tante jani bang bima berisik banget dasar bocah kampret uniform resource locator,1
lo cebong ya,1
tagar 2019 ganti presiden lantang sang presiden kacung diam bela presiden teriak 2019 ganti presiden kemarin kemarin be eriak anak,1
komisi berantas korupsi bubar,1
kait jokowi ahok johan budi jokowi anjing ahok babi ya beda otak,1
munafik sok malu,1
buah citra luwar ya uniform resource locator,1
dungu pinjam andal profesor junjung coba salah kritik rocky gerung kritik lo ya nyinyir sindir mutu coba presiden sih prabowo sikap,1
jijik kampang main twit,1
bacot jakarta,1
bong presiden indonesia ancam bunuh bego nd ejek kacung bong kacung 2 periode gue warga kolam gerah presiden hina parah bong dukung palsu xf,1
2016 ratus ribu silaturahim tinggal kabur perih kena gas air mata oh pilih presiden 2019 2019 ganti presiden,1
ooo ganti libur lebaran 13 21 ubah 11 20 pasca lebaran nya rang senin tanggal 18 2 jalan macet tanggal 20 bego h 2 tumpuk presiden bego,1
tuju ar fokus 2019 ganti presiden poros pecah suara play station kadal,1
sih ahok prestasi nol bicara tai ahok rahasia busuk rezim,1
orang goblok pelihara sih anjing,1
kecebong ya presiden hina ancam diam mental kacung,1
menteri didik budaya orang pintar suggest film bagus tonton 2019 ganti presiden 2019 ganti presiden,1
ah cebong,1
,1
pilih cebong huni dunia gaib ustaz komen jorok,1
bera i rejim jokowi ganti ah,1
responden responden goblok goblok paham wa awan berita goblok anies sandy pimpin mudah,1
saran gue mundur jalan,1
lengser rezim jokowi cepat negara hancur amburadul,1
tolol lihat tolol malu wkwk,1
jijik kunyuk mt gue balas sok suci cih wooseok jung,1
retweeted warga negara indonesia korea 2019 ganti presiden bahana gera 2019 ganti presiden dunia,1
warga moskow demo turun jokowi negara nya save ustaz alfian,1
gubernur bayar tukang konsep tukang ketik payah deh 2019 ganti presiden 2019 ganti presiden,1
kalah salah wasit pakai isu hoaks ulama 212 saracen isu sara isu partai komunis indonesia isu antek asing goreng sampa hangus elektabilitasnya salah rakyat goblok iya prabowo km,1
tipu jokowi,1
saracen jahat rencana menteri negeri batal menang pasang anies sandi jasa saracen,1
cocok prabowo myanmar kuda,1
keren mas survei bo rangkap koordinator cebong ya ntl nya dukung bani cebong nmantrraaaf,1
gatot antek asing nyata,1
adi gaya kayak beruk supir tembak metromini masuk dewan wakil rakyat kampung,1
suara narasi bela partai komunis indonesia,1
ahok djarot gagal banjir orang kena banjir sibuk sidang nista agama,1
cebong nge i,1
cebong goblok intelligence quotient rendah,1
ahok jeruji demo rumah tahan demo jokowi amnesti grasi kasih lengser jokowi salam,1
kali undang sih adi narasumber kampung,1
rakyat jawa barat cerdas inshaaallah dukung calon ai ai bela ahok nista agama uniform resource locator,1
bodoh cerita cinta sepe imu nih tolol,1
jijik anak dukung prabowo pendeta setan,1
asu soh orang orang kayak nih bani micin,1
biang gaduh partai adil sejahtera sih percaya partai adil sejahtera kayak beliau profesor tulis sok pintar sok kontra profesor beliau tuntut ilmu keliling dunia orang goblok goblok ya,1
dangkal otak benci suha o partai komunis indonesia,1
idola harun yahya zakir felix siauw cita cita kuasa dunia kalah yahudi rahmat alam semesta kali iya bumi 13,1
susilo bambang yudhoyono presiden gemuk ya restoran 8 juta ya jaman jokowi 800,1
kunyuk nya berani pulang cecunguk cecunguk setia tunggu haha asli tertawa,1
woyyyy bangsulll peang goblok anjirrrrr blok gueeee cukkkkk,1
syaitan iblis ganggu suara azan hati nyata bu suka nama,1
hutang bangun korupsi cebong nge i ya pret,1
polisi republik indonesia tangkap prabowo hina presiden media sosial uniform resource locator hukum hina jokowi megawati,1
buka lihat bohong bohong jokowi laku hadap rakyat orang tipu sepe i pimpin,1
36 dasar fakta sejarah jokowi mundur jatuh musuh umat islam,1
wkwk cebong dungu bicara cebong onta cangkemmu,1
zalim kroni kroni megawati menang zalim kroni kroni daur ulang sejarah,1
salah pilih gubernur usung isu sara,1
amien tuduh prabowo dalang buah rusuh,1
kaum bani kampret sumbu pendek hidup bumi datar,1
nakal polisi kuat animo umat islam lengser jokowi 2019,1
negara genting defisit 3 jokowi lengser rakyat jokowi lengser retweet,1
tinggal anies copot jabat gubernur daerah khusus ibukota lantar kunjung,1
meh cocok sube wa off telepon angkat dasar berengsek,1
huhu kim bum plot twist banget sumpah rela monyet biar monyet pindah on eh tau monyet berani tau,1
tangkap ustaz bajing uniform resource locator,1
setan dungu nih burittt,1
kontras radikal intoleran,1
indosat celeng jancuk bikin bintang gue turun babi bajing,1
komunis melulu ditii bahas bantai berontak antek teroris nyata,1
save komisi berantas korupsi tolak rekomendasi amp bubar panitia khusus angket komisi berantas korupsi tanda tangan petisi uniform resource locator via,1
sih nih dosen azan break cerocos mulu kunyuk,1
bual nih jokowi bicara mulu uniform resource locator,1
mending presiden kerja nyinyir kaum gunting pita jujunganmu presiden bangun infrastruktur utang utang rakyat mending jokowi ter,1
najis om om inggu nyata,1
cebong tolol lari nyata,1
eh dongok nama tackle injured debut 20 17 main nya kasar cidera wkwk heran otak,1
preman kampung monyong putih kasih panggung rusak acara enek lihat,1
rezim buruk semenjak indonesia merdeka,1
tau bego ajar maki goblok goblok,1
presiden boros foya foya rakyat derita jokowi presiden pilih taipan cc 2019 ganti presiden,1
sakit panik alami kaum begundal kampret bongkrek prabowo presiden panik sp inya jokowi periode,1
tenaga kerja asing hina bos indonesia jajah lemah x perintah mu 2019 ganti presiden 2019 ganti presiden 2019 ganti presiden,1
komisi berantas korupsi tangkap koruptor komisi berantas korupsi gagal bubar serah polisi jaksa,1
partai demokrasi indonesia juang gencar serang komisi berantas korupsi bubar partai demokrasi indonesia juang dukung jokowi jokowi jokowi,1
ganti nama biar cocok mulut sampan onta kencing,1
prabowo lucu lawak novel fiksi ghost fleet lucu zul bego,1
gara gara presiden plonga plongo ya kiai,1
emosi gue loey hyung anjir gue pikir keras maksud acara peranjat bego bilang mimpi anjir emosi pangeran,1
matanajwadebatjaka a urus bacot anis nya juara makan bacot jaka a haha pasang calon aneh gede bacot doang,1
lagu ari lasso silit,1
nama kecebong anak kodok nya presiden aduh presiden plonga plongo,1
ruhut gila tun,1
haha beda sanjung sih babi jijik eh habib rizieq wkwk,1
cocot comberan tai,1
tertawa rupiah lemah warganet berita metro televisi,1
music network bangsat,1
jablay modal usaha,1
mentil mentil goblok tolol bin bahlul onta kampret,1
salah turun nya cebong kampret definisi komplot sebar hoaks koar koar mencret,1
be ahun2 ejek cebong jokowi kodok partai komunis indonesia kafir dongok santai panik ya sih panggil kampret,1
empu jemaah 1 6 triliun antek jokowi,1
lihat banget bego nya empok silvy and agus debat final pilih kepala daerah jakarta,1
galakin pribumi negeri teriak usang asing gongseng gilir hadap hadap langsung usang asing asing gongseng loyo,1
lihat tas istri jokowi kampung p,1
sumber waras trans jaka a jokowi diam sih kutil babi ahok ganyang,1
aduh sibuk iya celeng,1
tolong polisi republik indonesia periksa anies sandi libat saracen batal angkat sesuai hukum laku,1
untung ahok nyungsep,1
bego rizieq korban pe undang undang md3 dasar dungu kaum sumbu pendek,1
bajing silvy debat final pilih kepala daerah jakarta,1
haha bangsaaat moral begundal bajing abal abal uniform resource locator,1
gerombol butuh manusia tolol,1
saracen muslim cyber army panasbung cuci otak rinso isis grup onta habis akal otak dungu rakyat tipu,1
laden ekor cebong kelayaban tuju,1
ganti kotak kosong dil pilih 2019 ganti presiden,1
dukung napi ahok jokowi akal partai adil sejahtera kasihan umat cebong,1
tolol,1
ahok tumbang fakta bilang fitnah debat final pilih kepala daerah jakarta,1
sih ahok nobat babi keprek,1
hai kunyuk paham ya prabowo subianto calon presiden salah presiden play station pas calon presiden abadi uniform resource locator,1
udik bego haha,1
benci perangkat digital zaman susilo bambang yudhoyono susilo bambang yudhoyono klarifikasi info sesat main tangkap,1
bonek jancuk super er suci indonesia maling goreng jarah warung bonek jancuk maaf racist kuat tahan,1
hajar jokowi,1
super gubernur indonesia bangga beda kelas gubernur reklamasi bangga bangga cukong 2019 ganti presiden 2019 presiden periode,1
yaaaelaaaaaa manusia babi dasar,1
ustad tukang fitnah tuduh jokowi partai komunis indonesia tangkap,1
anies sandi produk saracen uniform resource locator,1
taman rezim 2019 rakyat muak 2019 ganti presiden,1
iya kalah lawan bani taplak wkwk,1
takut prabowo laku sukses jokowi takut prabowo,1
nyata alas bakar 7 sekolah dasar palangkaraya perhati amp proyek uniform resource locator,1
gubernur pilih hancur lihat ahok no 1,1
dasar antek asing,1
berat wakil setya novanto dewan wakil rakyat ri pecat setya novanto dewan wakil rakyat ri,1
tenaga kerja indonesia hongkong takut tenaga kerja indonesia dipengaruhi ustaz ustaz 212 jelang pilih presiden suara suara ln aman uniform resource locator,1
jaga sehat pikir logika 2019 ganti presiden,1
bicara ahmad dhani monyet babi anjing,1
front bela islam gelar jihad konstitusional lengser jokowi uniform resource locator bijak indonesia mohabbatein,1
laku sih bani onta ekstrak tinja ngoaaahahaaaaa salam partai adil sejahtera jahat kelamin syariat,1
pepatah cocok jongos nyaring ibul saking sibuk kerja citra dolar roket sih tablo plonga dongok,1
nyata tulis twit cebong kelas kakap puluh ribu sayang dongok sial haram jadah men fitnah dasar bangsat,1
masuk katagori baris dajjal iblis sih bu suka,1
biar biar tai nya kena ya suka ahok biar kena tai nya,1
cinta milik orang cinta wkwk kasihan banget suka bilang kayak cinta milik bego,1
istana asai komunis rakyat lengser jokowi jokowi diktator rakyat tentara nasional indonesia uniform resource locator,1
prabowo kuli indonesia kalah saing uniform resource locator,1
bangkai nasib uzur,1
bangsaaat tolol anjing bangsat anjing tolol beloon bego ajggggggggg alay anjing bangsat jablay,1
suara bani kampret mati kenyang,1
ai sontoloyo,1
,1
berengsek anjing ayo ah gila uniform resource locator,1
cc nafsu tenaga uniform resource locator,1
40 jokowi mundur gelar negarawan mustahil be ahan lihat,1
ayat bossku maju anjing nih sedap sopan ajar,1
anjing ahmad babi ahmad dhani,1
dewan wakil rakyat tekan jokowi jokowi tolak dewan wakil rakyat bikin hak angket turun jokowi,1
mubalig pimpin mesjid andal rakyat umat islam giring otak suka kacung cukong biar rakyat umat islam rencana 2019 ganti pra,1
kasih tau sih ah cocot,1
tunggu reaksi sih denny siregar cita cita penjara tinggal kenang dasar dungu,1
mantan menteri jaga wibawa turun berita hoaks ribut asli habis salah beloon,1
bejat spoiler infinity war,1
jaman bahan bakar minyak rakyat susah gara gara jokowi,1
ajar rayu jokowi menteri barangkali,1
lupa otak sambung,1
sakit sembuh gerombol kampret bongkrek sakit panik balas dendam akibat kalah pilih presiden 2014 uniform resource locator,1
goblok orang beda cong uniform resource locator,1
berani indonesia republik rakyat cina,1
nyinyir bani kampret,1
massa provokasi be eriak ganyang partai komunis indonesia,1
anjing gonggong anies jalan,1
tommy kena pasal lap korupsi bunuh hakim agung diskon era susilo bambang yudhoyono uniform resource locator,1
cebong tolol be epi,1
gue lihat sih anies ya gue banding ahok mudah bilang mampus bajing berengsek tai paham nenek orang hadap publik rapat internal gue sih mending sih anies ya,1
salah iblis betina gentayang duku calon legislatif gagal nsi tipu ijazah palsu nskg ber,1
prabowo presiden istri indonesia hancur,1
haha lihat lahir ahli cebong 1 tukang tipu cebong goblok ketulungan plonga plongo akibat optimisme 2019 ganti presiden plonga plongo dunning,1
pilih presiden muslim singapura singapura negara kafir,1
anjing jokowi presiden urus daerah khusus ibukota mudah,1
diam tai anaconda,1
musuh sak modar nyata cocotmu hilang konco 1 bajing koyo koe ra rugi,1
dukung 2 periode orang ya 2019 ganti presiden solo 2019 jokowi ganti,1
hambalang nya gara gara susilo bambang yudhoyono anak buah masuk bui jokowi,1
diretweet sompret,1
lengkap kubu anies sandi tukang cabul,1
survei haha responden cebong kodok kampret x ya,1
percaya induk nista tahan bela uniform resource locator,1
negara demokrasi ya bubar komisi berantas korupsi,1
laku jual negara goblok bangun kaki orang kaki bayar hutang utang bos eeeh bego kaya,1
sih tertawa mulu bangsat,1
gaduh panggil cebong butuh manusia munafik,1
kampret banget kuat beli telur tebar hoaks kampret kuat ya koruptor selangkang iya coba lihat pakai mata otak gubernur koruptor cewek pret kampret telur kampret murah ceria,1
mulia anggur perhati banget rakyat rakyat cina 2019 nyalon pilih presiden pilih 2019 ganti presiden,1
tipu pilih presiden 2014 buzzer cebong dosa tipu,1
manusia perlente gaya meleteh kayak jambu mente kau manusia das omong bau terasi laku sisi kau manusia sombong suka gonggong bokong bokong kau manusia biadab ntk adab kau manusia bejat ntk,1
calon rejim suka tabrak atur hukum,1
gue harap banget kemarin mati harap setya novanto mati pas sakit kemarin setya novanto,1
prabowo anak berontak,1
fitnah fitnah suka dasar onta,1
dajjal cabul tenaga kerja indonesia uniform resource locator,1
prabowo dalang rusuh mei 98 mustahil presiden papar lengkap uniform resource locator,1
bego ya kampret potensi rugi cebok mata cing onta,1
prabowo maju motor dorong,1
congor ya tolong,1
rebut saham pegang saham tabok pakai duit hasil utang dasar bani kadal kadal selesai selesai,1
nyinyir biar ajak gabung presiden kali,1
cebong standar dungu ragu bukti bilang orang bego aduh,1
orang tolol balas base akun nya kunci,1
selamat kampung selamat unahe junjung ya e kucluk cebong cepek lu,1
terima kasih saudara umat muslim lelah juang hirau munafik buzzer tebar fitnah,1
organisasi masyarakat hancur negara republik indonesia wajib bubar partai komunis indonesia,1
siyaaaaap tolong kait kait imbal jasa jamin anies sandi kait kait hubung ahok jokowi,1
mangkrak kayak susilo bambang yudhoyono uniform resource locator,1
jokowi mundur,1
7 sekolah bakar kader nya prabowo tanggung,1
jaman mas jajah merdeka kerja asing korea utara main twitter pakai produk asing tanggung anti asing,1
diam gebuk dewan wakil rakyat,1
idih najis tujuh turun,1
hutang nya bangga in bukti rezim gagal 2019 ganti presiden,1
ya kacrut jaring taekkkkkk,1
nama pancing konflik horizontal polisi biar lengser jokowi indonesia hancur,1
gaya beruk preman kampung mantan supir tembak metromini masuk dewan wakil rakyat kampung debat ajak rantam,1
rezim laknat sih jokowi kodok 2019 ganti presiden 2019 ganti presiden 2019 jokowi,1
sibuk jilat bokong jokowi ambil ilham sepe i subhanallah,1
sih janda sebar hoaks gagah culun muncul gaya gagah simpul janda culun,1
tumbang jokowi radikal lengser jokowi,1
sah survei mayoritas warga jokowi presiden duit jalan sembako chopper 2019 ganti presiden,1
expo dul sebar ahok hongkong sapa tau ahok gubernur hongkong haha uniform resource locator,1
ekonomi merosot utang bengkak badan usaha milik negara jual jokowi mundur chirpstory uniform resource locator,1
hati hati pakai foto aung suu kyin jabat indonesia lapor polisi aiparno uniform resource locator,1
anak setan,1
ya tuhan banget cerita inti agens berengsek,1
partai komunis indonesia adakan prabowo calon presiden pilih prabowo bilang partai komunis indonesia gue pilih jokowi bilang emx gue pikir,1
tambang asing rampok sda indonesia sepe i freepo legal ya,1
bantu rohingya prabowo citra bicara tok kayak prabowo ya,1
orang marah tipu janji palsu jokowi lapor polisi nih dasar gila,1
bukti biarpun cebong otak pintar kerja kerja kerja kayak kamprettt cocot mulut otak pakai layar shot cakap bukti si,1
putar goblok bikin emosi ya,1
keparat,1
berisik tai ngentot diam jempol,1
komplit banjir tenaga kerja asing tenaga kerja asing jokowi restu warga negara asing duduk jabat direksi badan usaha milik negara parah negeri pilih 2019 ganti presiden 2019 ganti presiden,1
mundur mas tolol,1
kesini bangsat,1
ahok gubernur preman tn abang,1
cebong sampah masyarakat,1
bantu muslim rohingya bilang bilang citra tau,1
rawat bangsa masker cap sara alas anies sandi,1
cebong otak asa korban tau nyinyir,1
dagang aneh nyata nya harga puluh ribu kilogram nya nasional idul fitri lebaran puluh ribu aneh nya beras murah rezim aneh,1
bobrok birokrasi anies sandi jabat uniform resource locator via,1
maklum ai komunis sejahtera,1
berengsek tri aplikasi bima tri hapus sih,1
tuding duga korupsi susilo bambang yudhoyono dorong jaksa usut himbau komisi berantas korupsi usut duga korupsi jokowi solo raya,1
jokowi sepe i karno lengser paham,1
bagus dewan wakil rakyat bubar,1
iya kampang,1
rusak jadwal teknisi rumah pagi sore tunggu kacrut,1
by the way sih ratu tiru afi hinayah undang jokowi istana posting tiru iya ancam bunuh ya allah,1
tuju banget coba ahok gubernur daerah khusus ibukota tamat nih rumah sakit,1
bedebah teror psikologis pilih jokowi,1
ijazah mu sih cek beda juang rakyat semesta semesta,1
66 najis banget gue kepruk ya gubernur,1
orang indonesia bego,1
tim sukses jokowi jatah pe amina rugi uniform resource locator,1
kelas pilih jokowi lawan prabowo ham hancur ya indonesia,1
silit ardhog,1
rezim anti islam fadli zon anti negara republik indonesia coba bentur umat islam negara amp aparat,1
ganti mudah mudah ekonomi sulit,1
lengser gebuk bukti dukung radikalisme,1
dasar lelaki kardus lelaki karpet lelaki kencrot lelaki bangkrut lelaki mencret lelaki kernet lelaki bangsaaaaaaaatttt,1
eh positif guys tekan kaum 212 bela agama kitab suci fiksi fiksi isi norma hidup,1
telkomsel kacrut nih puluh menit wa telepon cihui,1
dukung ahok tangkap zaman jokowi,1
sok inggris anjir repot fi nya cerita panjaaangg inti cuek cuek najis nyata isi apes orang desc nya ya orang ekspres tebak sebal,1
mustahil polisi berani tangkap kubu mustahil bin mustahil kepala polisi republik indonesia politic id,1
partai komunis indonesia sila rekonsiliasi cebong dungu kolam,1
26 48 65 98 komunis hasil kuasa penuh rezim,1
bismillahirrahmanirrahim niat rida amp ikhlas janji jokowi kalah pilih presiden 2019 sujud syukur alun alun majalengka amp kibar bendera merah putih panyaweuyan moga umur tunai j,1
17 tanah rakyat kembang modus korupsi ahok gubernur jaka a asumsi rp5 juta m2 rupiah 85 triliun,1
nama indra j piliang status periksa narkotika duga dukung anies sandi,1
eh cebong jaga congor bicara salah bong 2019 presiden 2019 presiden 2019 ganti presiden 2019 ganti presiden 2019 ganti presiden,1
gue berangkat remaja lagu lagu cebong dungu kenyang tulalit,1
eh onta tolol kasihan orang tua lahir ekor binatang sepe i mu dasar kaum bumi datar partai adil sejahtera laknat,1
rezim keren orde bikin kontrak bikin sengsara rakyat presiden bikin freepo saham gede jokowi nyinyir bera i antek asing indonesiakuasaifreepo joko,1
sirik nih onta,1
ah kampret cebong,1
rezim cebong lihat realita rakyat,1
nyata gue salah sangka dasar tipu bejat laknat sunat,1
median mayoritas rakyat jokowi presiden 2019 ganti presiden,1
sih universitas turun mulu cacat banget kesal gue,1
prabowo subianto prabowo subianto rupa anak biologis soemitro djojohadikoesoemo penghianat bangsa uniform resource locator,1
sesuai tap majelis musyawarat rakyat pecat jokowi diam jokowi langgar tap majelis musyawarat rakyat layak lengser majelis musyawarat rakyat takut 98 ulang,1
cocot kintil,1
diam anjing daniel edan ya,1
persib kunyuk,1
cupu,1
ya tabok orang,1
komisi berantas korupsi lembaga negara berantas korupsi lemah lemah dewan wakil rakyat uniform resource locator,1
culun kayak pawai tujuh bas,1
stres ahoker tai,1
harga turun 180 derajat otak campur nanah kencing onta sadar woi 2019 ganti telor,1
maju anjing nih orang tshi beli haha,1
jabar wakil gubernur konsisten meika agate,1
2019 ganti presiden suka umbar janji lengser,1
hindar partai politik lindung preman nista agama koruptor bohong jual aset negara impor kuli asing suka utang,1
anjir paypal anjing banget kena fee nya,1
keluarga halilintar hem km tau udik,1
pokok teroris jancuk,1
lapor posko juang rakyat dukung lapor rawan juang demokrasi organisasi sayap partai demokrasi indonesia juang,1
lelah hayati gedung teriak jokowi bela komunis antek orde gedung mentwit jokowi represif medioker ham kayak orde,1
model ceramah nya kayak jancuk silit celeng gus gus,1
cebong ya bau amis,1
asma dewi ciduk alumni 212 dukung anies sandi loyalis prabowo,1
fakta pilih kepala daerah daerah khusus ibukota imbal jasa jamin dukung anises sandi 2014 narkoba iya candu 1 dukung anies sandi,1
haha apes menteri media sosial cocok cocot buka kerja apes,1
pret kampret dukung 2019 ganti presiden presiden sapa rocky gerung kafir kah,1
iya akun hutang negara pimpin kalah gunung sahari,1
empok silvy nyinyir melulu pe anyaan nya sayang sesat maklum sih dese mak mak devat final daerah khusus ibukota debat final pilih kepala daerah jakarta,1
hati hati bani onta nyinyir bilang ahok sih kafir citra wkwk hati hati bani onta cari taktik nyinyir,1
telusur cepat pe emuan hatta ali setya novanto pecat hakim sepi main mata,1
indonesia mundur jokowi kroni kroni kelola isu uniform resource locator,1
anjing najis banget mino jelek,1
hidup cebong produksi makan hoaks,1
