Tweet,HS_Other
rang negeri budaya yuk unjung purwoke o mumpung even rakyat purwoke o ekstra vaganza banyumas,0
presiden dana taktis rakyat program program perintah program bangun infrastruktur kip kartu indonesia sehat ifikat tanah hutan sosial bahan bakar minyak 1 harga padat karya,0
amin ya allah tim latih ular rawa rawa sungai gede musuh buaya wkwk,0
gerombol kadal jidat gosong suka ribut gerombol salah pura pura budek dasar gerombol cingkrang uniform resource locator,0
gentar takut hadap kafir,0
kafir kristen ulah,0
tau bau bau cir sipit buluk,0
kayak pegang mucikari,0
guru tk darma wanita desa plumbon porong deklarasi anti hoaks benci isu sarah dukung pilih kepala daerah damai,0
anjir seram main,0
kayak bank te entu bilang jual uang asing tukar rupiah,0
hati hati berita pilih kepala daerah bau hoaks madiun madiun today 100thmadiun kotak karismatik madiun tolak cukai ilegal kunjung,0
mantap direct message baris serba bang,0
nyata lebah suka bunga makan bangkai gue penasaran madu nya kayak,0
dongok bilang hacker haha,0
bangsat gue selam 1,0
pancing pancing urus nista bicara paham fiksi kitab suci,0
sinyal kontol pelihara niat sih login twitter doang susah open redtube setan,0
mata kafir wkwk,0
facebook anjir lupa,0
sih bilang alah kontol,0
tatap alih arah enggan tatap pria curiga pe kali gaduh suasana angie temu orang pria asing tidur sofa sepe i,0
lahir kembang gera komunis indonesia pisah buah organisasi nama indische sociaal democratische vereeniging,0
shaheizy wajah baharu calpis,0
ya serah balas fokus kerja kerja tugas proyek seni budaya 2 langsung kumpul presentasi syukur nilai muas proyek,0
bro,0
monyet turun mukim warga cibadak sukabumi uniform resource locator,0
giveaway taplak meja menang the rich chenle,0
wkwk bodoh bang,0
menteri lingkung hidup hutan upaya perata ekonomi tora kawasan hutan hutan sosial tribun medan,0
mahfud md allah subhanahu wa taala berang bangsa ajak buang islam,0
warga badui selesai tradisi seba pendopo perintah kabupaten lebak be emu gubernur banten wahidin halim sabtu 21 4 seba baduy 2018,0
mas sudut salah agama t entu bahaya rocky cerdik susun kalimat amp inti kasih tau pnge ian fiksi ayo mas nya i,0
dukung calon presiden gagal pindah on sibuk urus asing bawa kabur uang rupiah 35 t sadar asing kabur bawa uang dukung pribumi anjing mustahil asing pribumi diam sogok mental kacung uniform resource locator,0
rabun budek gue tulis bicara,0
bismillah tahan sepo kutuk,0
update status bikin tugas tugas selesai ya jancuk jembut,0
muslim jabat negara be indak bangsa negara,0
12 ikan sembuh sakit selamat bagus laik jual pisah seleksi ikan cacat permanen pelihara sehat ikan ncc,0
a inya pribumi sadar lihat kecuali cina komunis misionaris abai twit usir cina indonesia,0
ya cina kenal wisata haram indonesia haha,0
sahabat salah lovren bukti beda suku agama ras halang bina hubung umat manusia beda warna jalin pe emanan terima kasih lovren salah favorit best friend forever bro,0
lae turun turun ideologi partai komunis indonesia lekat jiwa,0
kesal rokok motor iya kadang pengap tutup macet,0
halo warga jaka a wakil kepala dinas tanam modal layan padu pintu provinsi daerah khusus ibukota jaka a denny wahyu haryanto wakil wakil gubernur provinsi daerah khusus ibukota jaka a buka acara 2018 junior chamber international jci indonesia nasional event setiamelayanijaka a,0
2 kuat jaring gubernur tekan kuasa state of the a knowledge a bahasa rantau indonesia,0
pandang tuan guru bajang hadap agama politik,0
susilo bambang yudhoyono presiden ri 6 khofifah emil masyarakat no 1 bagus,0
bokep cewek bispak bandung ngentot crot unduh full uniform resource locator uniform resource locator,0
kayak jablay grand theft auto jemput pakai mobil,0
lihat memek tante,0
kerja musuh dakwah islam bubar hati rakyat hak lengser jokowi kodok tukang citra,0
tidak salah orang khalifah rasyidin kami rang orang kafir kalau orang orang munafik tidak orang munafik,0
suka nete uji nasional maklum,0
ya kali tentara nasional indonesia suruh urus sampah plastik,0
khawatir manuver politik bijak laku rezim moga negara republik indonesia cinta amin,0
madi arya lapor rocky gerung polisi serius kitab suci fiksi rocky nyata salah hina tunggu anut agama a anggap kitab suci,0
bajing tengik,0
pakai buruh cina rakyat anggur dasar rejim kodok,0
rupiah haneul cute pacar perek on retweet,0
bilang anti asing asing tau wkwk,0
suriah sekolah radikal rakit bom pulang indonesia ya aman,0
kadang hidup kayak tai kadang berak orang beres tainya tangan iya,0
ih banci selotipan,0
gubernur zaman now gus ipul puti 2 ganjar yasin 1 djarot sihar 2 hasan anton 2 koster ace 1 nurdin sudirman 3 karolin gidot 2 keanekaragaman budaya suku agama sungguh kaya djarot hadap pese a rakercabsu,0
tantang buka dada eh setan habis kamus lawan kenegarawanan joko widodo presiden ri 7 stresssssss nih hati hati kena strok serang jantung rakyat indonesia hilang badut badut politik merdeka,0
2 orang orang yahudi nasrani al kitab taurat injil kenal muhammad,0
bubar hati amp front bela islam uniform resource locator,0
ahok verbal keras lampias lari lelaki lunak,0
teman teman kantor langgan cadar langsung bilang awas bom hela nafas,0
pantat nih tusuk tusuk open bo wa 08157686707 gay berondong massage boy gayjaka a gay yogyakarta gay tangger,0
ancam bunuh presiden republik indonesia mas mesti lapor tegak hukum be indak ancam bunuh kepala negara,0
kayak orang nyosor nete,0
ngewe,0
jebur cebur,0
partai adil sejahtera ulang balai kota rr bicara calon presiden balai kota ganti nama balai politik,0
bijak barang konsumen laku barang rusak cacat produksi konsumen puas produk hitung 7 tanggal beli haus mini quiz hazid kunyuk,0
kisah hidup muhammad lengkap unduh,0
jajah bumi indonesia hapus jajah ekonomi budaya hasil bumi cina basmi negara republik indonesia usir,0
we pipis onta cecer mari bau pesing,0
teriak lantang pm h pro asing pas tawar bantu asing bikin posko inti kompor keluarga korban pm h bilang 15 3,0
mari juang jokowi lantik 2019 gentar takut mata benang leher ujung tombak perut surut langkah bisu suara,0
kayak monyet,0
,0
cuba tegak anime nih karakai jozu no takagi san nak feeling feeling cinta monyet zaman sekolah throwback habis 9 10 uniform resource locator,0
seru pesta budaya derau kuta kakak anegara,0
kontak retweet ya banget kenal tante jilboobs sange nini nama tante dea o,0
debat publik ajang bukti pintar ruang akademik pamer indah orang kuat lemah egosentris nama kuat tahan l,0
muslim hina iblis betina nista syariat,0
baby kafir buddha teroris myanmar,0
indonesia merdeka indonesia jajah orang cina takbir allahu akbar uniform resource locator,0
politik hanta yudha pasang calon no 2 nya jawa jawa gayeng 2019 jokowi,0
follow beli katolik akun prof wawas bangsa terima kasih,0
sih bejat cabul kecut sih onta iya,0
gue dongok,0
ih masak sampah,0
aspirasi lina sumedang calon gubernur jabar berantas rebut laki orang resah hidup warga desa,0
yaelah chat urus lihat mesum anggota dewan wakil rakyat diam nyata selingkuh tujuh pura pura budek cebong iq ratus otak,0
takut cina i dap bimbang paham bawa,0
cermin pecah kaca,0
langsung tag ainya berani ya bera i banci,0
awwww comel nya asing warna,0
islam manusia idealis realistis hidup lupa ajak kerja keras ajak istirahat,0
kristus anjing anjing jembut keparat picek tai pejuh siwuk kutang siwuk idiot keparat picek tai pejuh siwuk kutang siwuk idiot keparat picek tai pejuh siwuk kutang siwuk idiot keparat picek tai pejuh siwuk kutang siwuk idiot keparat picek tai pejuh siwuk k,0
agama katolik katolik nusantara agama kristen protestan kristen protestan nusantara agama hindu hindu nusantara agama buddha buddha nusantara,0
3 bas teknologi digital presiden sistem jalan langsung ramah ratas,0
agama kristen golong darah b nasal san fernando valley,0
buddha bunuh muslim myanmar,0
yahudi bangkai jerman ibadah,0
cina,0
hoaks kodok biawak roket sekop bangsat karbitan munafik 2019 ganti presiden 2019 presiden 2019 tenggelam jokowi sungai siak,0
10 presiden jokowi harap skema kerja laku bangun bangun,0
pilih langsung biar pilih presiden dewan wakil rakyat calon presiden biar kayak kucing karung bikin mekanisme oke calon presiden gubernur prestasi maju calon presiden gubernur,0
nama agama munafik,0
cium bau bau pecun uniform resource locator,0
henti konsumen wisata haji rumah tipu produsen wisata jiarah indonesia,0
buru nazi simon wiesenthal pegang foto foto gambar mantan kepala gestapo laki laki rauf buah van kamar gas gerak eksekusi orang orang yahudi,0
sih royson jokowi kacung gue alas fundamental rezim sepe i sengaja masuk debt trap komunis cina north sumatera offshore wajib 2019 ganti presiden,0
wkwk mampus pepet uji ah,0
gubernur jaman now ya anti hoaks sebar isu ganjar yasin menang ganjar yasin 1 ganjar yasin,0
azan televisi panggil manggil allah subhanahu wa taala dungu biadab henti acara catut nama tuhan,0
baju yahudi top 4 bas geng jubah putih kopiah minyak atar janggut dahi belekok bak ahli syurga nih out of place mohon rajam,0
gue ge marah auto daftar hitam hidup gue sampah daur ulang,0
anjir bekas silit,0
amin moga be iga tampil sumbang medali sumatra selatan,0
,0
gubernur zaman now gus ipul puti 2 ganjar yasin 1 djarot sihar 2 hasan anton 2 koster ace 1 nurdin sudirman 3 karolin gidot 2 keanekaragaman budaya suku agama sungguh kaya djarot hadap pese a rakercabsu,0
bingkai bangkai ajar hidup,0
edan menang lihat ya ampun kakak r gue banget,0
perempuan kayak mending mati deh jelek sok make up a ist,0
jual gue kayak jablay,0
bijak tugas jajar kereta listrik doang tumpang doang suruh orang menge i menge i butuh orang bangkai,0
titit nya sambung pakai accessoris,0
mata gue pas sipit aneh banget,0
banci gigih natural killer uniform resource locator,0
waspada cina komunis indonesia,0
banci kampung heeee,0
gembel ganteng kasihan cinta asyik asyik hebat,0
deklarasi pilih kepala daerah 2018 aman anti hoaks toga jemirahan jabon,0
setia usaha agung pas datuk takiyuddin hasan sahkan cuba pinda lembaga i sepe i presiden i,0
najis,0
sastra e karl mark pentol komunis rusia,0
otak kayak bool deh mes makan silit,0
cina hak larang,0
hebat bicara cinta pegang alquran pegang hidup alquran bicara cinta perang bunuh penggal,0
jomlo jablay,0
perjaka jual sok sok an booking tante idiot anjir,0
rev 1 pilih ulama kafir munafik,0
jaga bersih lingkung orang orang melek wajib buang sampah bicara tugas bersih,0
sejuk gila kantor kulit buaya,0
ooo kena imbang nakal kucing anjing abang dark side bright side chill sosial kalai lengkap haha k bang selamat maju jaya terima kasih,0
gampang kak buka handphone buka browser ketik budaya palembang sila nikmat ajar gratis,0
gerombol onta bela umat mata politik praktis tuan guru bajang demokratis umat pikir modern salut tuan guru bajang,0
goyang jilboobs mantap nih hyper kontol squi tonton live nya besok,0
islam indonesia islam nusantara islam modifikasi rupa masuk budaya indonesia agam islam nusantara islam toleran,0
presiden aspek indonesia mbak anti investasi asing ubah invasi asing wajib warga negara lawan,0
09 15 indonesia barat kepala unit bina masyarakat inspektur polisi mt hutasoit laksana sambang pesan pesan aman tertib masyarakat pilih gubernur pilih kepala daerah 2018 karyawan bank rakyat indonesia ranting muara damenra silit kawan kawan desa hutanagodang camat muara kabupaten tap utara,0
kalimantan tuju batu bara nya keruk listrik megap megap,0
fardu kifayah hukum wajib ajar islam pilih presiden utus kalang santri sokong ulama maju pimpin negeri,0
nahdliyin setop hina hadap maruf amin,0
risa pulang latih khusus iris hazel milik tangkap siluet orang gadis gadis asing risa temu gadis radio tinggal kerja r,0
haha orang gila bicara cak micin biar otak encer cong omong ngawur muslim muslim silit tau babi,0
muhammadiyah inggris jalin kerja kendali ekstrem,0
neraka kena bom surga orang muka bumi masuk goku,0
bot ih liebe ih a inya bot kasih ipad barusan cemplung jamban kuda,0
bodoh anjir bodoh tertawa gue tertawa astagfirullah humor banget uniform resource locator,0
mata picek cuk norak lihat prestasi jokowi nguoblokkk tolol,0
coba dedengkot jin terang ulama saudi rilis publik akidah jin contoh jin anggap kafir peluk kristen hindu buddha peluang masuk surga fatwa saudi jin adal,0
sepe i hujan lebat langit gelap gelita guruh a kilat sumbat jari telinga dengar suara petir ranah takut mati masakan lepas allah me,0
cerdas konseptual,0
nama yoon gi putus iring sergap mata asa antuk gigit bibir ragu gapai gelas minum wine tinggal,0
bismillah melayu raya tanah melayu nama dengar kaji jajah tanah melayu thread kupas serba bani jawi,0
nak kawin nih kena simpan duit ilmu agama kena benda kena senang cerita,0
aduh lucu banget adik kelas gue pas lapor bang field trip taman safari heran 1 nama teman arisan keluarga bawa 1 sekolah tai arisan,0
main anjing,0
hebat arif suku badui hutan jaga budaya nafas hidup hidup jaga imbang alam,0
ya iya gilir ramai bela pas idol mati sedih doang serbu gila gila sarap ya maaf,0
umat islam maksud front bela islam hati muslim nista islam bajing muslim onar kecut lari mesum islam islam gilir mesum islam onar islam,0
warga semarang prihatin kontroversi puisi gus mus,0
tuju dewan wakil rakyat menteri jabat negara wajib potong 50 masuk presiden pegawai negeri sipil potong pegawai swasta potong,0
nih akun hasil bodoh kaum 212 bikin kaum kaum biar jokowi anti islam wkwk,0
turun cina sipit,0
takut banci uniform resource locator,0
lindung masyarakat wilayah tawangsari bulu amp lihat terima bekal pam pilih kepala daerah serentak,0
bolot,0
nyata bangkai,0
nama absurd first impression bikin enak imajinasi ganteng etik pas coba ngewe direct message enak banget harap direct message nyata,0
admin presiden pm,0
stw singaraja suka kontol uniform resource locator,0
kafir haram pimpin monyet,0
shio baekhyun monyet,0
ceruk pasar pasar pasar butuh contoh asuransi pensiun tentara us orang pensiun tentara pensiun tentara asuransi alat butuh orang cacat orang cacat ta,0
laku dosa ya anis sandi bully rendah orang jahat licik bully rendah dunia kejam kawan,0
om om ajar agama buddha hindu coba ajar ya buka mulut,0
alam kerja time cina best kerja melayu haha,0
kuat jijik ku cepat asa kejar kejar ya napas sungkan wkwk,0
hehe nyata pasar global batas lokal asing asing jujur,0
marah orang rupiah panggil sipit hoshi suka mata sepele ah fisik pakai definisi hoshi milik mata sipit deh,0
rawan join buah gera arus rindu pimpin nasional nasionalis islam moderat cak imin the next wakil presiden join 2019,0
onta nsd,0
umpan pakai biar mancing buaya,0
komunis abad partai komunis indonesia kecoak makan kecoak,0
retweeted ikko pribumi tiru horas horas horas kapal feri presiden unjung pulau samosir rangkai kunjung kerja presiden sambut upacara adat samosir pekik horas horas horas,0
mata lu picek ya janji jokowi tagih susilo bambang yudhoyono mata picek blok,0
indonesia be ahan kuat ekonomi politik hun pilih kerja simpan beda agama,0
50 freepo kuasa asing perintah jokowi a jonan menteri energi sumber daya mineral freepo ambil alih saham jonan jos,0
as clara anak pintar dongok kocak cantik idot tau malu urat malu putus butt muka nya imut banget,0
menteri agama riset guru agama islam negeri orientasi publikasi a ikel scopus jenis tantang umat islam guru agama islam negeri pangkal data rujuk bangun database ulama nusantara,0
me nusantara a i nasionalisasi aset asai asing laku pimpin sungguh nasionalis patriotik nusantara versi proxy be uju lemah tahan nusantara nasional bangsa,0
foto profil nya pesawat bilang cinta produk asing sederhana ukur parah tingkat munafik mu langsung terjun pesawat biar sesuai,0
remuk rengginang cocot ah,0
,0
acara mutu ulah mantan aktivis nih organisasi masyarakat mahasiswa gembong partai komunis indonesia musuh bebuyutan himpun mahasiswa islam,0
ayo pilih alin alin bawel banget omong lihat banci jalan omong,0
adopsi perintah pusat nih,0
prof prof bilang forum buka kacau biar prof muka agama ulama melur,0
haha jancuk,0
untung kunti,0
kaisoo couple hangat bandara tanggal 1 maret kemarin kalah hunhan korea cina cina korea kau suka banget o kaisoo fact,0
orang asing obrol bosan tunggu transit teman,0
mata picek mata lihat belah,0
maaf twitter pe kali orang bego,0
catat buka lupa alam pilih kepala daerah daerah khusus ibukota jaka a 2017 usung ai gerindra hasil tumbang tahan usung koalisi motor,0
kenal pribadi perempuan pilih kepala daerah bondowoso radar jember,0
mayoritas buddha pendeta demo googling video demo thailand biar tau,0
komunis main,0
suka kesal orang pas gue confess gue gilir gue jomlo tau bicara silit,0
balas usir buddha ajar etnis muslim rohingya singkir data sensus duduk myanmar,0
allah panggil orang allah rindu baitullah,0
kontol iya hapus,0
obat monyet kedih uniform resource locator,0
bingung toleransi bikin gue pikir alas katolik paus wakil kristus,0
tertawa kunti,0
ustaz partai adil sejahtera yudi widiana tilap duit bahasa agama juz amp liqo felix kwetiau amp alumni 212 diam amp pura pura budek gilir bu,0
amin moga istikamah khawatir cibir orang anggap uji orang orang dulunya suram kafir taubat tokoh juang agama islam,0
video call gubernur dinas istanbul turki video call lapor pe hibur malam karaoke sense amp diskotik eksotik tutup hormat keras bantu ole,0
soekarno konotasi rejim anti demokrasi ndg embel embel presiden umur hidup,0
hajar ganyang partai komunis indonesia uniform resource locator,0
bangkai kg tidur siang,0
amin moga jokowi presiden,0
meni simpang lgbt nikah hidup berkah dunia rusak zina gera stop kawin,0
daya ekonomi pesantren ulama jawa barat dukung jokowi pilih presiden 2019 jokowi 2019,0
semangat kantor staf presiden publikasi giat presiden rakyat tau presiden kerja keras bangun bangsa kerja kerja kerja,0
cocot,0
tuju dukung presiden upaya kuasa asing ekspor mentah ganti kontrak rugi indonesia,0
kristen nusantara contoh huria kristen batak protestan huria kristen batak protestan gereja kristen jawa gereja kristen jawa gereja pasundan gereja manado gereja malu gereja papua ciri khas sesuai tradisi suku,0
masyarakat tionghoa pancasialis orang jawa ekspos contoh nyata kwik ekonom ustaz felix siauw,0
freepo diam negosiasi kalah,0
allah subhanahu wa taala sembah dungu biadab ya,0
baca cerdas biar cap goblok v just kidding maaf balas orang intelligence quotient menge i tulis v,0
calon gubernur jawa nomor urut 1 mempe anyak program unggul rival kait buka lapang kerja 5 juta 5 ganjar situasi ekonomi buka lapang,0
burik iya burik panuan kutu jamur ha rang ajar,0
we jancuk ajar,0
amin rais himbau masyarakat salah pilih pimpin,0
jaman gue negeri kamis pakai baju kotak kotak kayak seragam sekolah kristen jumat nya wajib pakai celana doang pakai baju koko ya,0
rizal ramli mayoritas masyarakat jokowi klik rmol calon presiden rakyat,0
orang anggap munafik pura,0
kristen prinsip enkulturasi agama katolik indonesia kristen indonesia asing islam kental arab,0
prabowo suka kampanye negatif kampung geli,0
presiden jokowi gubernur anton program selaras jalan hasan,0
the lie tju siswi kelas 1b katolik santo petrus 1984 istri ronaldo pardede siswa kelas 1a katolik santo petrus 1984,0
bencong bacot cewek kayak banci amen kasih duit bacot mending cakap jelek kayak suram mentioned gue langsung kutip twit,0
cina cina usir ya rusak sih kerja,0
ayo bangsa indonesia sih etnis cina ahok,0
tolong lihat bok ya panggil pas papas buta budek tunggu,0
enak banget ya om bom susilo bambang yudhoyono debat sangka tinggal,0
kafir alquran situ sehat,0
dungu islam alquran ajar amoral ansor agama islam posisi moral,0
owner seo tai adminnya hiring sayang 3 s,0
oke sip otak bolot gue bingung,0
perek sih doll ya,0
tolol aji agama islam sp i orang aji orang,0
new post festival pesona tambora angkat eksotisme alam budaya dompu bima,0
bang laku kristen istri muslim strategi te entu,0
presiden joko widodo jokowi buka kongres 29 himpun mahasiswa katolik republik indonesia himpun mahasiswa katolik republik indonesia pesan konteks politik 2018 jaga kondisi kontestasi politik isi adu program gagas ra,0
cina kafir bangsat dasar komunis,0
kangen edan,0
oh mami kontol jari pusat 3 ngentot mami mami capai,0
kuliah maroko bilang anies super gubernur jaga asa enak bilang layak presiden,0
jodoh presiden pengantin wanita tajikistan sedih,0
resmi berkat gereja katolik hati kudus yesus batu gantung ambon,0
7 lihat wkwk gue tot setan,0
ustaz subki al bughury si sos i dukung pilih kepala daerah damai kabupaten sinjai hoaks benci isu sara,0
retweet sensasi ngentot cewek cantik hijab 1 blowjob kontol hijab ngentot orang hijab sepong kontol,0
detikcom buru buru tolak wacana pilih kepala daerah dewan wakil rakyat daerah pilih pilih 2019,0
front bela islam nyata darul islam nyata isis propaganda politik,0
mohon maaf pilih presiden pilih jokowi like prabowo,0
berani sepe inya minoritas tau pasrah balas milik tuhan allah,0
bu pustaka orang bisu ya bu ha nak diam diam suara,0
kerja tugas prakarya seni budaya 3,0
kolam buaya oke,0
yu mari songsong presiden 2019,0
gue bani ngepost milik orang nik,0
busuk mawati agama islam takut gejala gila nih nenek,0
salah obyek vital aman lemah gedung dewan wakil rakyat moga sah undang undang anti terorisme dewan wakil rakyat sasar bom bunuh amin doa kabul,0
jalan platform ya facebook jalan bom gede,0
orang katolik coba,0
bera i cacat,0
haha roti buaya nikah,0
me every night naaaaa anjing gue malu bangsat hilang aaaaaaaaa sih gue jijik banget aaaaaaaaa sih gue danta aaaaaaaaaaa hilang aaaaaaaaaaaaaaa,0
kalong nya puji butut nya butut goblok goblok,0
sabar gue adek adek kunyuk bau kayak sempak kuda,0
asalamualaikum alaykum tolong harap bantu korbanphkfreepo,0
jenderal propaganda perang propaganda jual utama partai komunis indonesia cina,0
ngentot,0
pesan presiden joko widodo negara indonesia kuat ulama umara iring lengkap kait pesan presiden simak video jokowi silaturahmi ulama jokowi cinta ulama jokowi,0
bak orang indonesia pelabur wujud peluang kerja pelabur jajah ekonomi kesal ubah selagi,0
hindu nusantara buddha nusantara konghucu nusantara kristen nusantara salah coba argumen prof minum kopi amp ketawa ketawa,0
orang didik pikir ekonomi syariat ah ekonomi bangun ekstremis,0
buzzer idiot,0
dengar suara bom guntur geledek petir gunung letus dengar suara tangis sodomi,0
calon gubernur jabar bicara toleransi muzakarah ikat cendekiawan muslim indonesia jabar,0
kisah emis yahudi buta,0
laksana presiden jokowi promosi asi games 2018 gencar ratas presiden promosi asi games gencar,0
kreativitas masyarakat desa daya tiada batas tingkat ekonomi a hidup roda ekonomi mikro desa salam daya desa sengon prambanan bahagia,0
partai komunis indonesia ramai ramai antek komunis opini nyata abur bangkit partai komunis indonesia,0
isu tuan guru bajang zainul majdi isu kuat ekonomi umat sejahtera rakyat budaya pancasila,0
gelap 5 gelap ranah malam gelap mata ranah buta gelap otak tiada ilmu gelap hati tiada agama gelap hidup tiada kerja,0
revisi hukum pidana masuk klausul kena kerja seks komersial sukarela butuh indonesia gencar promosi surga wisata internasional nyata pagar uniform resource locator,0
rpgpedia gubernur jaman now rakyat pilih nomor 1 ganjar yasin kandang banteng salam teman role playing game nama rudy teman ruddy,0
woi bolot,0
keanekaragaman budaya suku agama sungguh kaya djarot hadap pese a rapat kerja cabang khusus partai demokrasi indonesia juang kota gunung sitoli gubernur zaman now djarot sihar 2 sumatra utara pilih jos djarot sihar menang gunung sitoli partai demokrasi indonesia juang,0
pasar temu tukang jual pisang maki abang gara gara dukung lgbt aduh,0
tipe bela andal cebong muas syahwat,0
ajak muslim cari muhammad enak enak cocok cocok penis bangsa susah,0
eh dungu mention mention gue puter alun gue forward berita analisa kelompok manusia homo cerdas wkwk wkwk wkwk,0
moga masuk orang orang wajah seri seri jumat berkah wajah wajah orang orang mukmin seri seri al qiyamah 22 wajah wajah orang kafir,0
usir pasang asing cina selamat hutan,0
huh orang cadang nak tutup tahfiz bondong bondong manusia melayu kutuk habis habis agama islam tengok rupa lalak yahudi live kat media sosial langit kat zouk sola,0
aliano calon presiden 2019 indonesia bebas hutang indonesia bubar pas kiamat umrah gratis 1 orang,0
swasta katolik iya tk swasta katolik ketemu teman 12 pikir ya 1 2 situ,0
muncul antek antek partai komunis indonesia berani muncul terang terang mudah mudah perintah tinggal diam uniform resource locator,0
su pin siswi kelas 1c katolik santo petrus 1984 istri ronaldo pardede siswa kelas 1a katolik santo petrus 1984,0
kualitas bayar 31 mar gratis mending pakai antena tonton indon ar uniform resource locator,0
1 kandung ekstrak lidah buaya n2 kandung alkohol n3 milik manis n4 reaksi hadap obat n5 aman anak anak amp bayi n6 kemas finger off sentuh luka n7 perih l,0
islam indonesia dialog budaya alas dasar islam mudah kembang islam budaya dipe entangkan,0
onta ya,0
khawatir dek tsamara henti mentwit takut antusiasme rakyat merosot lihat kader ai spe i pe anyaan rakyat te arik lihat psi trust hil,0
asa walubi umat buddha indonesia usir bantai,0
beda kristen agama percaya yesus juru selamat tuhan mk terima roh kudus tolong hibur kuat,0
presiden soeha o resmi museum taman mini indonesia indah,0
percaya akun wa 081381413774 nya percaya video camera sex bukti video call detik pas suruh transfer alas nya ni muka nya kayak monyet uniform resource locator,0
presiden jokowi lembut launching bandara ajati 24 mei,0
pojok polisi selidik presiden partai adil sejahtera unsur pidana,0
kristen teman gereja kristen jawi wetan terap hidup beda kristen indonesia daerah kultur budaya nusantara agam kolaborasi agama k,0
umat islam bodoh pakai fiksi alas salman rusdhi the satanic verse bodoh sepe i fiksi imajiner angan angan tuju bela nara,0
homo sial bajing goblok gian amput anjing tepi jalan moga terima balas nya,0
ajak anak anak ledak bom muncul orang paham islam tindak keji aman abdurrahman,0
pacar bowie cece sih banci salon banci tampil uniform resource locator,0
alah kontol,0
kocok memek sayang,0
