Tweet,HS_Other
aneh konsultan asing pakai mulus korupsi jabat perintah badan usaha milik negara konsesi libat deutchbank rothschild konsultan asing,0
monyet komunis tolol,0
rupiah haneul jual memek lini on retweet,0
senang hati sih cewek lepas sih mbak angkut mbak gang bang perkosa kunyuk selesai sih mbak mobil marah pergi bilang perkosa,0
paham pimpin joko widodo rendah hati ajak mari dukung jokowi 2 periode percaya indonesia kerja kerja kerja layan rakyat 2019 si 2024 ber,0
nampaknya istilah tki rental tki formalin pekerja migran rumah tangga outsourcing status duduk hukum,0
guru sekolah juru kota sukses pilih kepala daerah tolak berita hoaks,0
12 sambut presiden apresiasi be emu kader gera mahasiswa islam indonesia milik semangat pemuda muslim tanah air jokowi ajak masyarakat optimis,0
bukti kampus rakyat kampus mu ngkin pikir jamban,0
cinta buta tuli,0
sapa jual asing pangeran sodor keluarga jual kaya bumi indonesia amerika kolaborasi antek asing ya om,0
haha sis main sarah nih agenda yahudi,0
pe anyaan bodoh dongok om rg,0
cont keras ujung bunuh asing si rene kali tarik laku keras korban si rene sekal lirik arah lucas tukar pikir tatap l,0
cari dukung mr presiden asing,0
babi,0
penjara nista agama turun uniform resource locator,0
teman kakak gue jurus sastra rusia nih komunis ya,0
xl gembel banget,0
geblek iya,0
nak cabut jantung budak budak zaman main mercun nih bunyi bom,0
mas tolong kitab suci agama fiksi,0
teroris kafir buddha myanmar,0
cina agresif ambil alih saham saham usaha tambang dunia cina ambil alih saham tambang milik freepo negara cina taruh minat milik newmont freepo kuat rantai supply i,0
ngewe,0
cacat,0
bravo jokowi tekan freepo hak rakyat lihat pro rakyat antek asing oknum kuasa ai jual saham freepo asing koar sok pro rakyat,0
malu hebat malu milik pasang gubernur wakil gubernur kampanye edukasi politik isu sara agama relevan,0
bungkus kayu biar banting pecah cacat haha,0
barang ku sungguh jalan hidup sempit kumpul kiamat buta qs ta 124,0
ajar anak kenal organ intim,0
bhineka tunggal ika hidup keluarga bangsa umat tuhan salam natal kupang,0
kitab suci sesuai agama anut isi kitab suci genap hidup,0
proyek bangun bendung pelosika batal presiden,0
najis,0
baris serba jaga ulama,0
gue grup whatsapp grup msgi alias minoritas sexual and gender identity ya isi gay lesbi omong ya sex politik diskriminasi faith religion,0
halo amel baca sipit hakdhsk biel00l,0
taplak meja iya uji nasional,0
banci gentleman orang,0
17 april 2018 sidang excecutive board unesco presiden unesco tuju hasil sidang komisi ketu palu 16 20 indonesia barat a inya geopark ciletuh labuh ratu sah sandang predikat ciletuh labuh ratu unesco global geopark cpu gg congratulation,0
imigran tinggal myanmar 1948 imigran cina usir indonesia atur main,0
rezim panik takut tagar 2019 ganti presiden,0
sok tau komentar sok pintar hhmmmm gue gampar bibir pakai wedges bencong,0
ketua karang taruna nama andin wakil nama sudin panggil ketua wakil singkat anjing,0
ajar catut nama tuhan nikmat jalan hidup muhammad bejat,0
antek komunis film gera 30 september partai komunis indonesia isi bohong uniform resource locator,0
hem akrab teman rl bilang bacot,0
ulah cebong kafir keparat,0
najis banget main ml kalah mulu teman nya buta map jebol push,0
ajak ngentot ganti suami km,0
murka anjir main handphone mati,0
keliru manusia tuhan tuhan layan pamer kuasa surat pemberitahuan ajar alquran,0
bajing jelang uji semester,0
bocah ajak tonton gala premiere film abdi setan kate pakde kire kibul eh tau berengsek uniform resource locator,0
puisi bajing wajah setan mulut iblis manusia binatang mesum seni monyet,0
moga 3 kandidat calon presiden calon wakil presiden 1 prabowo subianto mas agus h yudhoyono gerindra demokrat partai adil sejahtera ai bintang 2 jokowi airlangga anto partai demokrasi indonesia juang golkar nasional demokrat ppp psi 3 muha,0
8 presiden dasar lapor terima 945 ribu aparatur sipil negara 275 ribu tentara nasional indonesia 360 ribu anggota polisi republik indonesia milik rumah sifat permanen jokowi cepat sedia rumah,0
titip salam terima kasih undang nya,0
hak kritik kerja dewan wakil rakyat terbit undang undang md3,0
teroris buddha myanmar tembak perahu tumpang anak anak,0
alhamdulillah 6 kali be urut wtp moga kado positif 20 partai adil sejahtera khidmat rakyat sumbar selamat akh gubernur warga sumbar,0
lekong,0
been eyeing this site barusan coba buka ecek harga sapiens homo deus murah periplus ya let si try again some time later uniform resource locator,0
berita lucu akrobat politik laku gerus elektabilitas presiden jokowi,0
tai doi,0
seru ulama hanif,0
kaum nasrani yahudi kali om pecah belah umat muslim astagfirullah,0
sedih lagu ih menang pudak onta,0
selamat seberang biar gantung ekor buaya pe olongan b peribahasa,0
fasilitas negara calon presiden,0
bunda adri cerita alam sekolah sekolah kristen raya lebaran natal imlek teman sabang merauke alat ajar agam toleransi anak anak jalin toleransi,0
erudite bodoh gede congor,0
menge i baca selesai ambil hikmah pikir positif rational juang moral jokowi wakil presiden jusuf kalla sambut acara simposium ekonomi,0
hasil investasi panglima ekonomi mustahil rakyat sejahtera banting setir prinsip prinsip ekonomi gotong royong sepe i cantum pasal 33 undang undang dasar 45 rakyat mulut buaya,0
airlangga pribadi lupa bu khofifah alam 3 menteri sosial presiden a bantu entas miskin khofifah emil jawa timur,0
komisi berantas korupsi 10 anggota dewan wakil rakyat daerah sumatra utara uang wa a ekonomi,0
suka banget emut kontol gede,0
tolak berita hoaks sukses pilih kepala daerah damai wilayah kota,0
lihat pengeeen masuk kabinet kerja episode 2 coba hitung utang 5000 triliun anggota dewan wakil rakyat jalan jalan negeri biaya partai politik cabut ide brilian,0
jijik banget goblok,0
biang manusia homo,0
duta kwang il be ekad kembang pe ukaran budaya korea ri klik rmol korea utara,0
tonton dengar lagu banci uniform resource locator cc,0
orang buta it ya ampun,0
cina masuk salah ras indonesia beda singapura,0
sih banci akun palsu bilang utang perintah era,0
haha sneak out malam buta ha permission still consider as strict parents oke,0
081223555353 butuh orang munafik jual foredi yogyakarta,0
ya gue inti sesal pokok join bangsat biar memb nya bego kadang wkwk,0
anjing makan hak anjing makan anjing curi manusia,0
no,0
nama perintah revolusioner republik indonesia susah gampang partai komunis indonesia,0
contoh babi 1 nak merah pergi jalan sangkut nih sangkut kat jalan orang,0
bahas bangsa tuhan maha esa pancasila orang indonesia allah subhanahu wa taala benci kafir tuhan,0
lgbt diskriminasi kerja mujahid golong lgbt lesbian gay biseksual transgender malaysia hak nikmat hak warga negara uniform resource locator,0
taplak meja bahu,0
hasil wkwk oh bagus deh sarap sarap sarap,0
jablay anjir,0
setan gue nyanyi,0
,0
info sih program bantu perintah guru agama hindu cek,0
astagfirullahal azim tolong musyrik salam budaya spirit gebyar nusantara sragen yogyaka a haram agama,0
oi cebong ya dasar komunis ateis sifilis autis salib,0
universal bicara kitab suci bera i kitab suci nista kitab suci al qur an salah kitab suci agama islam ragu,0
mata gue picek pakai koma koma,0
junki bocah laki laki tekan dagu mungil ujung tumpul pensil warna warna biru muda pasang mata sipit sergap dahi kerut tanda pria pikir itu renang,0
gagal proyek elektonik kartu tanda duduk hasil 1 sekretariat jenderal menteri negeri menindaklanjuti keluh paulus tanos 2 keluh paulus tanos menteri negeri presiden susilo bambang yudhoyono menteri negeri hadap presiden,0
ra asing iya,0
laaaahhhhh jackson bilang sampah mentwit coba lihat akun kak hehe,0
cowok kasih gue bangsat lo bejat cewek astaga,0
cubit titit nya nakal,0
utang bank asing beli saham freepo bayar utang freepo sita kecap beli salah beli salah sederhana gaya utang tumpuk mu rakyat bahan pokok murah barang,0
kirim foto kontol nih sange chat sex,0
umat agama islam jaka a haram najis ahok kafir kristen,0
subhanallah amin ya rabbal alamin insya allah diijabah allah subhanahu wa taala,0
assalamualaikum bela kristen sembah bangkai yesus busuk bela kristen bodoh,0
orang orang musyrik jin sekutu sekutu allah allah cipta jin jin qs 6 100,0
benam batang kontol mu pepek ku sayang oh ah anjingggg uniform resource locator,0
bodoh mamat gue ambek bodoh mamat gue ambek uniform resource locator,0
emil dardak pimpin milenial calon wakil gubernur jawa timur,0
bilang buaya,0
tonton obrol bareng coba tonton the boy in the stripped piama kamp yahudi,0
laku psi laku indonesia rakyat psi agen komunis,0
ate bocah kontol goblok sontoloyo kepala gatel sial anjing berengsek,0
22 duduk syariat islam rendah sumber undang budaya tradisi hawa nafsu manusia perempuan mulia islam,0
gera lepas hijab saudi 2014 fatwa ulama muka saudi nyata wanita pakai jilbab pakai make up posting foto media sosial saudi tren lepas jilbab indonesia,0
suka rezim sikap sikap ancam angkat senjata indikasi rongrong merah putih indonesia milik pimpin jiwa nasionalisme,0
jaka abanjir pimpin akhlak nista agama,0
ekspor indonesia tajam maret 2018 10 24 banding februari 2018 surplus dagang 1 09 miliar dolar mudah mudah pe bangkit ekonomi indonesia,0
instagram ya ya tarik teman teman bahas bakso habis perhati bilang mas,0
ganyang partai komunis indonesia anjing uniform resource locator,0
rapat dewan wakil rakyat tidur,0
budak budak twitter zaman wajib ajar didik alquran sunnah gejala senda agama,0
throwback lagu zaman sekolah cinta monyet konon nurl,0
wusu gue bom ya mantap gue ramai doang wkwk,0
kang fakta ai dukung sih nista agama benci rakyat masuk rakyat jabar uniform resource locator,0
cacat anak anak kayak tau kondisi biar tau reaksi orang tua,0
wkwk anjing main golf uniform resource locator,0
tonton drama korea ngentot ngewe memek memek basah jilat memek toket toket mulus kontol bispak binal bokep po,0
sejarah partai komunis indonesia antek komunis sok siksa uniform resource locator,0
allaahu yubarik fiikum ya syaikhuna alfadli a inya lukman menteri republik indonesia,0
pt freepo indonesia 48 operasi papua saham asai asing bangun papua te inggal freepo raup untung hasil eksplorasi kaya alam papua freepo 51,0
berangkat kerja ngentot pacar uniform resource locator,0
jaka abanjir pimpin akhlak nista agama,0
cowok galau malam bangun mimpi basah mimpi basah ena ena banci,0
keluarga belo ku sipit,0
he gembel gue nyanyi ya ngerapnya tar lolos audisi ainment,0
cowok cowok remaja fc nya ganteng manusia homo,0
2 bebas lahan makan 2 biaya batas kuat jabar selesai bandara mayoritas dana anggar belanja daerah prestasi rakyat jabar,0
perintah negara komunis pancasila be uhan peduli amanat derita rakyat,0
zaman buang sampah sembarang,0
jepit kontol gue pakai memek,0
wakil gubernur banten ajak masyarakat riah seba badui bareng festival exsisting 18 april 2018 in rosyadi wakil gubernur banten andika hazrumy ajak masyarakat hadir riah seba badui,0
transgender calon legislatif pakistan uniform resource locator,0
km suka cari cacat nya orang manusia sempurna salam olahraga,0
hitung 2 4 kali presiden hadir keluarga ppp cinta hubung emosional kuat ppp presiden pppforjokowi munasulamappp romahurmuziy,0
sore guys sentuh jokowi indonesia bangun riau proyek jalan tol pekanbaru dumai salah 1 ruas trans sumatra jalan tol 131 km rampung 2019 yuk lihat manfaat pandang segi ekonomi protein energy malnutrition,0
pakai jurus kalajengking amuk sayang pakai jurus dongok,0
bani indomie 1 1 1,0
gue suka suka kagum binatang kelas hiu ular buaya ba ba black sheep,0
komisi berantas korupsi ri awas tahan izin cuti pilih kepala daerah kendali proyek perintah,0
langkah perintah bubar akun nyinyir kader jebol hati kali,0
media sosial kenal asing asing kenal,0
adik adik yunior be anya pe anyaan sensitif indonesia negara komunis bang peduli negara bangsa nya bukti tenaga kerja asing masuk pol,0
perilaku cina sp penghianat bangsa yoyakarta warga cina kelas pinggir sertifikat hak milik dasar cina keparat,0
ce kacamata identik culun,0
6 presiden lapor jajar kait kena detail sepe i infrastruktur transp rakyat jokowi,0
ya ampun cantik cantik,0
sepe i indonesia ubah 2019 ganti presiden,0
forever alone tahap dewa gila babi member orang nih uniform resource locator,0
logika berani jabat hukum berangan rejim sederhana pilih pimpin,0
jujur gue ngentot cowok kissing gue kali ngewe cewek gue bisexual,0
cuk bangun bubur tai ayam,0
nyata makam tanah palestina tekan perselihan umat islam kristen islam mulia as nabi islam,0
nasionalisasi freepo internasionalisasi freepo ya bang asing asing indonesia aneh uang tunggu 2021 ya 3,0
contoh hukum istilah cakup taung substansi isi muat hukum te ulis te ulis struktur tegak hukum polisi jaksa hakim advokat budaya hukum pikir amp be indak masyarakat hadap,0
istilah novel komedi mbak catat menantu sinting wkwk kocak banget baca deh mbak tipe bias karisma cowok banget,0
pilih cebong liberal tengik sekularisme gelintir antek,0
god khusus allah agama onta pikir keren god tuhan universal inggris google,0
takbir ganyang partai komunis indonesia,0
haha iya gembrot kseeeel gemas,0
gembel gembel twitter whatsapp chat whatsapp langsung blok bebencongan minggir cuihhhh cepat kena mati kayak banci banci feminim sial ganggu orang orang kasar dasar bencong tau malu,0
asing be emu pe kali minggu lift gadis salah siswa prestasi terima beasiswa keith tunggu gadis angkat wajah,0
save malang haritage selamat cagar budaya,0
paduka ulama jabar serang tinggal patah pata he he,0
diskusi om bata turun salah tokoh rongkong perhati budaya bangga,0
gue kayak teman gue kristen and i feel terima kasih for it harmful,0
bodoh ambek,0
kampret lupa ambil laundry nhhhhhhhhhhhhhhhhh,0
5 presiden ubah terap sistem online nya izin integrasi kait sederhana proses libat menteri amp daerah sesuai cepat,0
hina tukang sablon kaos,0
ideal politik modern nation state politik identitas pakai sih muslim gue ateis pilih and that si oke pilih pilih dasar pe imbangan2 akal sehat sekte,0
bodoh uniform resource locator,0
diskusi islam nusantara tarik berani komen prof kes komen budi sepang anut kristen jawa shalom,0
tanggap cuit indonesia presiden jokowi ejek antek asing amp asing kagum sikap amp berani hadap klaim republik rakyat cina laut cina selatan negara asia tenggara manut,0
anti kritik kontol mu bangsat orang idiot tau hate speech,0
kunyuk,0
ekonomi pegang gerindra hancur negara masak saran cetak uang bayar hutang hutang utang negara bilang biaya produksi cetak uang murah ekonomi comberan kecoa,0
pintar tolol tipis batas fahri pergi toko minum keras kendara sepeda beli botol,0
sore mas banci pengkol mandi,0
mata picek bukti hoaks bukti km lorot otak,0
ah kayak peduli deh pakai jaket partai adil sejahtera pakai jaket partai komunis indonesia buka hehe,0
bicara gue orang berengsek be emen orang orang biar citra bawa,0
agel perek,0
tenang dukhan muslim sehat sehat kena flu kafir amp munafik nanah telinga amp tubuh bengkak 40 modar,0
onta,0
indonesia damai usir cina indonesia,0
mayoritas etnis cina daerah khusus ibukota solid dukung nista agama islam dendam nasionalis,0
presiden jokowi tinjau proyek bandara ajati rencana operasi juni 2018 tahap 1 kapasitas terminal tampung 5 juta tumpang bandara internasional jawa barat bangun lahan luas 1 800 amp bangun,0
adil sifat universal retas batas agama ras turun adil islam kristen buddha hindu tiada beda milik agama bangsa,0
oh iya kunti maaf me ua,0
rusia komunis komunis be uhan main rusia egol,0
ulama habib bogor isra mikraj pos kota news,0
masak ajar,0
gila manusia bejat lahir batin maksiat muka syariat tuhan rusak hina duuhhhh gustiiiiiiiiiiiiiiii,0
sih kacamata bikin mata lihat wkwk gue lihat pakai kacamata sipit mata guaaaa,0
politik kafir ilmu nya paham manusia be anya rumah allah jawabannnya allah tubuh,0
raja negeri pahang peduli pasal heritage sungai lembing kayak sejarah budaya usaha nak pelihara,0
fadli zon bahas pilih kepala daerah langsung kaji pilih presiden,0
deklarasi pilih kepala daerah 2018 aman anti hoaks warga jabon,0
the end he he agama beda beda dukung susah bayang jalan terjal,0
mata sipit bibir bentuk hati uhuy,0
gue kucing hewan sayang rasul jijik ganggu ya pakai keras binatang manusia strata pintar ya banget waras nger,0
main cacat masuk teco tolol,0
lawan usir duta myanmar boikot urus buddha,0
peristiwa partai komunis indonesia 65 keluarga korban tuntut adil akibat keluarga bantai sukses ukur,0
mu melayu yahudi kak haha,0
amin ya rabbal alamin salam gie cerah bangsa amp ubah indonesia,0
gue kenal kayak kenal dasar banci,0
ri tonton brodus cina,0
ganti nama tagar banget ganti presiden ganteng ya,0
goblok pelihara,0
kadang kontol manis kadang asem ya nurl,0
negeri perak nyata sokong penuh belah bahagi hadap pimpin perdana menteri dato seri hebat negara datuk seri r si presiden rakyat,0
kenal be ahun2 pon still x berani natural killer i love suka hem kenal 2 pon kat wechat ajak angkat wow budaya kotor zaman nih jijik bodoh,0
cari titik cahaya gelap asa sulit temu nya insya allah sabar cari,0
meni bela etnis tionghoa tetes darah habis,0
topeng monyet ramayana nya nya nya nya uniform resource locator,0
gencar kampanye jelang pilih kepala daerah net jawa,0
wkwk,0
tua dongok,0
enak muncrat memek,0
nih memek sange mulu,0
he gue sipit,0
sambung kuliah maghrib khas syekh kurayyim rajih ketua ulama alquran suriah ustaz nazmi smackdown terjemah rasmi beliau lokasi masjid al muttaqin wangsa lawat,0
jahat jahat manusia suka cari salah cela orang lalat cari bangkai busuk quranhour,0
proyek smelter freepo indonesia rencana 2015 pas presiden direktur freepo indonesia jabat maroef syamsuddin,0
kenal kenal asing,0
sumber daya negara undang undang rakyat susah komplain lindung undang undang rakyat,0
tolak nu ahok turun tionghoa nasrani,0
reformasi gulir media indonesia asai non muslim moral masyarakat hancur,0
bodoh sinyal tai gue unduh,0
main taplak cadang bocah,0
perek,0
cacat anjir,0
daya wanita daerah khusus ibukota jaka a lihat telak beda warna muka warna tangan empok sylvi debat final pilih kepala daerah jakarta,0
harap sarap,0
katolik kiblat vatikan wajar gugat islam kiblat makkah arab manusia manusia gerah pancasila langgar pancasila sila 1 5,0
evi layanto siswi sekolah dasar katolik karya yosef kelas 6b 1983 istri ronaldo pardede sah,0
tim onta iya o cap kuda popo,0
wow banget pejuh mu bro masuk memek istri langsung hamil,0
bom negara nada lucu kah,0
cina babi komunis anti agama utama islam bikin ribut indonesia,0
nyimengnya cupu ya kak senior ampun,0
in case you missed it swat sfc selamat monyet proboscis uniform resource locator uniform resource locator,0
tidur cepat tidur gigit onta halo,0
aktivis kritisi bijak koreksi langkah rezim pas keliru protes,0
goblok sambung,0
kristen lesbi ya,0
gue katolik asa negeri katolik kristen buddha hindu islam haha,0
pilih kepala daerah bandung nurul arifin janji insentif marbut guru didik anak usia bandung cantik bandung harmonis bandung pilih nuruli calon wali kota bandung calon wali kota bandung 2018,0
haha gue jijik gue sindir lihat isi direct message mantan gue haha alhamdulillah pacar inrl amp bahagia fana,0
istirahat news mohon perintah masuk kait tega hukum indonesia bebas amp pulih nama warga negara indonesia vonis penjara nista agama dosen kitab suci fik,0
suka payudara dasar ajar tampar pamer puji berengsek,0
nama kayak asing nyata,0
teman maju calon legislatif dewan wakil rakyat ri daerah pilih kota bekas depok psi ayo sus semangat juang nasib rakyat sejahtera adil didik negara humanis toleran bineka,0
wkwk anjing uniform resource locator,0
orang agama sumber marah tampil agama sumber kasih bina damai sila baca buku gratis agama bawa damai,0
on the way manusia homo,0
hem kristen katolik kristen protestan bumi nusantara mas mas ibadah kitab lagu gaya jawa batak flores toraja ds,0
naila jarang interaksi eh ultra violet sih mata sipit sih wkwk,0
sukses pilih kepala daerah hoaks galeri dinas komunikasi informatika kota metro kota metro news ayo dam ram,0
pura pura bisu tika udjo on bahana fm,0
dasar tau fiksi unduh buku gampang dasar perek harga ratus,0
enak nya habis ngentot main pejuhnya uniform resource locator,0
obrol ayo cantik cina wkwk,0
kayak tau ya kak ya kak asing,0
anjir wkwk nete banget nih,0
ustaz lurus orang salah orang salah demo tau kualitas ustaz ustaz bagus ustaz be ani partai komunis indonesia mobil mewah,0
allahu akbar ketua front bela islam lapor adek armando badan reserse kriminal,0
ah alah gembel banget screenshot,0
pas audisi rambut hitam sipit tar lincah banget kayak ulet bulu ngel ngel dah,0
kakak sekolah dasar racist in batak kristen pas jawa ampun panggil gue pakai nama adat adat agama jarang kayak sih saran si,0
bajak agama intoleran reaktif agama badik tusuk lawan duniawi dadak toleran hina kawan duniawi ya agama kejar tuju tuju,0
alhamdulillah,0
semangat ngewe malas gue,0
masuk kristen diskualifikasi tenang baptis gratis bayar susu,0
bisu diam ribu bahasa hati bicara,0
wonu oppa mata sipit banget,0
anggap cewek kayak barang bos cewek hati asa situ cari bahan ngewe mending cari pecun ngewe bayar deh cewek rusak lobi ngewe anjir sampah,0
konbatnya gue pegang wkwk geblek,0
jurnalis dengar islam nusantara iseng bilang hindu nusantara kristen nusantara buddha nusantara islam agama sepe i agama embel embel,0
malu tertawa dasar idiot,0
sih burung 2030 indonesia bubar sih kerbau 2030 indonesia kuat monyet nasib negeri monyet wkkkkwkk serius banget ah rieuttt,0
pegawai bank danamon asyik emut kontol pacar video lengkap uniform resource locator bokep,0
ya,0
internasional sih nan kayak tenaga kerja indonesia naga naga sih,0
biadab ahok cina kafir rakyat asong asong gusur gusur aniaya surat pemberitahuan teroris ahok kafir biadab,0
buku jokowi undercover susilo bambang yudhoyono dukung jokowi pilih presiden 2014 rahasia kotor korupsi pegang cukong cina,0
masjid pasang spanduk 2019 ganti presiden marah masjid pakai ceramah politik tanoe non muslim dukung,0
reklamasi jaka a atur revisi atur presiden jakarta bogor depok tangerang bekas puncak cianjur,0
tenang alah kontol,0
nista agama santri hormat kasih ahok otak reparasi pilih kepala daerah nama santri kail jual belikan,0
gendut sih nder ya pikir omong orang mulu mending pelan pelan rawat gendut rawat maaah percaya percaya iya,0
kalah suha o prabowo lawan opini 1998 libat konspirasi global as cina sekutu dukung rencana csis elite katolik radikal konglomerat tionghoa jatuh suha o,0
19 pimpin masjid pimpin ajak jalan syariat islam sungguh sungguh jatuh pimpin non muslim,0
ih najis belepotan,0
wajib dengar,0
hussss admin takut demo bersilit silit alumni togel,0
ya gue sipit,0
cowok kurus kontol lumayan uniform resource locator,0
ninja kali nih tukang roti keliling cepat banget hilang kali gue rumah kejar sarap,0
siloam cina usir andai ku mati anak anak ku paham filosofi hidup harga kaki jajah,0
jujur percaya allah subhanahu wa taala perintah penggal kafir tuhan lukman,0
tidur ranah najis nyata,0
orang orang kafir dusta ayat ayat azab hina qs al hajj 57,0
ngentot yuk,0
mata pakai kacamata bangun tidur sipit,0
mercun bunyi kuat hai adek bunyi bom,0
tipu aduh,0
pagi pagi ky kontol,0
iya anjir tau wkwk iya gue suka,0
ayo ajak mas goen alih sembah allah subhanahu wa taala benci kafir bakar kemenyan,0
cari huruf hijaiyah dal anak islam jamal laeli assalamualaikum adik adik mari lihat,0
imut titit nya hidung,0
bom takjil,0
komisi berantas korupsi panggil deret mantan anggota dewan wakil rakyat kait e kartu tanda duduk,0
sipit sipit,0
papar kepala polisi resor bikin kepala polisi daerah pulau riau pilih kepala daerah tanjung pinang aman netral,0
insiden helikopter jatuh pt indonesia morowali industrial park kerja 3 000 warga negara cina,0
bunyi klik tikus suara keti keyboard musik 8 jam non stop mata perih bokong panas lengan ngilu jenuh,0
gede x cl top x bom seungri x raline gary x jihyo mustahil,0
bantu wkwk putri rima daniel sibuk urus organisasi siswa intrasekolah join kayak sibuk makelar urus anak tuyul alias gila oj sok tau banget,0
selamat pagi politisasi puisi timpa calon gubernur jawa ganjar pranowo informasi hoaks arus utama informasi terima masyarakat pilih kepala daerah ganjar yasin,0
hubung munafik kitab hina lapor polisi waspada cebong kafir islam,0
1 cerita orang cowok tinggal cina cerita pesan,0
ahok versi pakpahan terima kasih ciduk bajing uniform resource locator,0
ngeri bangsa sih partai komunis indonesia biadab bangkit tolak bubar,0
sabtu 21 4 2018 pagi masyarakat adat badui jalan tuju kantor gubernur banten kawasan pusat perintah provinsi banten kawasan pusat perintah provinsi banten curug kota serang seba baduy 2018 direct message,0
terima kasih ya allah engkau engkau buka mata hati buta cinta terima kasih tuhan engkau tolong,0
iya lihat gedek banget anjir,0
baris gus sholatu bagus pulau madura rapat menang pasang calon gubernur khofifah indar parawansa emil elistianto dardak bagus khofifah emil jawa timur,0
sarap cucu gudang,0
karir cemerlang tentara nasional indonesia perangkap rejim penuh dusta selamat lahir,0
i tulis kad raya cina ellooo,0
5 ragam seni budaya batak toba,0
serap dana desa 2015 2016 prioritas bangun infrastruktur 2017 serap dana desa prioritas cepat ekonomi desa jokowi periode,0
i penat edit cacat weh haha,0
buka twitter informasi dengar dengar benda curiga duga bom temu barel oi stay save kang wa eg enak kang cilung anak indekos amp warga barel,0
tau kenal bawa ajar deh ajar,0
sih lmao anak anak anak anak ya tengil banget tau main plas polos pusing ih jempol congor,0
antek kaki tangan komunis hati perut uniform resource locator,0
dengar hindu bal kristen jawa ya wkwk,0
jelek budek,0
bera i makan bareng orang yahudi ya sih singgah makan bawa alat makan sepe inya tau orang yahudi,0
teman makan teman janji sontek uji pas gilir uji pura pura budek reuni,0
dengar anak bas bicara tuhan tuhan orang islam tuhan orang kristen tuhan orang buddha tuhan orang hindu tuhan orang kejawen tuhan orang nit sensor suka hukum beda cerdas anak pikir,0
