Tweet,HS_Other
cowok usaha lacak perhati gue lantas remeh perhati gue kasih khusus basic cowok bego,1
ya bani taplak kawan kawan,1
gue jari gue ukur nyali bacot,1
aktor huru hara 98 prabowo si lengser perintah jokowi nyata,1
sih kerja delay mulu setan,1
nenek nenek heran cebong bohong,1
pegawai guardian training kayak mentang mentang gue kayak gembel kaos flat shoes dijutekin bangsat malas beli kabur gue matahari,1
anjir kali lihat orang bego debat pilih kepala daerah kerja serang karakter kecewa on empok silvy and agus debat final pilih kepala daerah jakarta,1
didik bodoh larang bawa agama biar orang islam bayar ahok sadar pilih ahok gila,1
ahok the best abai kaum kampret otak micin,1
sih otak tempurung laden lawan dungu makan hehe,1
pinokio umur 3 2019 ganti presiden,1
wkwk bani lowo,1
lengser jokowi bangsat,1
iya cocot,1
x bicara bangkai,1
proyek korupsi rezim susilo bambang yudhoyono uniform resource locator,1
kitab suci agama bilang om dadak kalap,1
eh kasar kampang,1
cebong bang,1
salah target ahok agenda utama lengser jokowi,1
kena tagar panas banget 2019 ganti presiden,1
prabowo kalah bantu jokowi citra ratap pilu,1
goblok bani cebong tukang tipu jilat kuasa gera bayar pakai nasi bungkus propaganda nasi bungkus gagal,1
cebong sewot,1
gubernur djarot mayoritas ai politik dewan wakil rakyat daerah dukung ahok djarot payah ya uniform resource locator,1
daftar calon presiden pilih presiden 2019 buka agustus 2018 normatif politikus partai demokrasi indonesia juang paham 2019 ganti presiden,1
2019 ganti presiden konstitusional hak rakyat woiii nih plonga plongo laku otoriter,1
kejar setor bangsat rupiah turun,1
bangkai hajar,1
onta mati minum,1
uniform resource locator ahok tng was was hidup,1
sul teng ekses akibat sandera hutang cina 2019 ganti presiden 2019 presiden 2019 jokowi ganti,1
be aji nya komisi berantas korupsi era era komitmen berantas korupsi surat pemberitahuan era susilo bambang yudhoyono,1
admin tolol ai tolol ai tolol orang tolol,1
jokowi mundur tutup uniform resource locator,1
amin racist nada nada ratna sih paiiit nada sih onta nada sih lobang anus takut oi oi habis obat tenang ya,1
kabinet beranta pecah belah rezim,1
partai demokrasi indonesia juang menang tekan usaha tambang target proyek impossible lelang murah antek cina ntb contoh partai demokrasi indonesia juang menang dasar bajing,1
percaya mulut buaya mu bawang,1
umuh persib persib kunyuk,1
film muslim pilih ahok mati salat jamin laris,1
berita saracen diframing katak tim prabowo anies sandi media tumpah sakit hati katak cebong ehe,1
cebong bilang kemarin eyel situ paksa cebong,1
lemah gerindra orang prabowo turun elektabilitasnya congor fadli zon surat pemberitahuan durno,1
nasihat kali ugal ugalan nih rezim eh negeri keburu hancur ekonomi moral meni kacaoooooo,1
2019 rakyat makan aspal beton solusi jitu miskin ahli cebong 1 tukang tipu cebong goblok ketulungan plonga plongo akibat optimisme 2019 ganti presiden,1
kemarin hujat harap dasar bani kampret,1
monyet koloe bilang saudara ogah hidup ya hati comberan,1
becak warga binjai sita tenda be uliskan 2019 ganti presiden partai adil sejahtera radang bukti perintah panik takut,1
jokowi mundur,1
sih tai doang belaganya langit karma idol flop gue tertawa keras,1
maju maki mama bolot,1
saracen akun kritis anggap saracen aneh jokowi,1
bego teman gue najis kesal gue,1
onta yaman nih gue depo asi,1
anak cocot ya,1
udah hoaks ya fahri ambil berita tuyg tong sampah ambil screenshoot tau berita,1
indonesia mundur bentuk,1
haha blunder cebong protein energy malnutrition pusat alas ham rakyat aceh ya kali coba perintah bilang suruh hukum islam kaffah aceh dewan wakil rakyat a,1
cebong kacung teman gue dungu tulang sumsum buang buang energi debat,1
ai korupsi sapi goblok,1
nikita mirzani pakai hijab bicara cebang cebong fantasi uh ah cokorers,1
laku bodoh masuk kategori senang laku sontoloyo menganggu bangsa laku naif langsung bentuk intimidasi hadap ulama laku,1
kotor bahagia warga cebong nge i,1
buka busuk kubu anies sandi menang berkah uniform resource locator prabowo usaha cuci tangan,1
kayak orang bego bro b ego,1
orang orang bego minum amp makan kotor onta otak nya somplak,1
kuak strategi kampanye tim menang anies sandi uniform resource locator,1
lembaga lembaga anti korupsi bubar sentuh kuasa gilir komisi berantas korupsi partai demokrasi indonesia juang ai politik kuasa pulang otot bubar komisi berantas korupsi,1
brahahahaaa cebong nya ahoker cebong cebok,1
presiden tuduh rezim anti islam negeri umat uniform resource locator,1
manusia bangsat,1
prabowo partai adil sejahtera bib asyik anggap antek prabowo antek partai adil sejahtera hidup dramatis,1
maaf kunyuk bro enak banget rasan sebar hoaks maaf sebar hoaks maaf mesti sapu biar jera nih orang uniform resource locator,1
sedia berengsek,1
dungu orang ganti presiden tau mikiiiir,1
kampret complain raga tanggap fuck,1
ha lengkap orang bukti goblok sih,1
nek lihat match chelsea sih menang mudah manchester united iya embuh sih chelsea kacrut ki prediksi,1
,1
haha kalah nih iya orang jahat kalah,1
cinta orde meng idola prabowo amp hary tanoe,1
belah duren ya dungu ya cebong maaf ya,1
rencana seret adil ham pbb uniform resource locator,1
survei metro televisi jokowi menang presiden hitung ya 45 kalah 46 salah judul maksud jokowi menang sumber zie bajrie,1
duduk istana negara lengser jokowi salam,1
hebat sibuk citra baca nih,1
jongos nista agama ahok sok sok ngong sara majikan nya tebar sara astagfirullah tobat,1
wibisono citra jokowi sebar up media massa pro asing kes jokowi hasil,1
adi gaya kayak beruk supir tembak metromini masuk dewan wakil rakyat kampung,1
km mainstream mengaa ikan pintar pintar relatif gantung bawa penge iannya surat pemberitahuan pintar meng undeeestimate orang gue pintar komen rejim now pintar mangkrakan janji janji doang sok making,1
gue pukau 2019 ganti presiden,1
ah asa hibur cebong bahagia presiden cebong tol cebong germo,1
resah presiden hidup penuh drama citra main film televisi joko judul uniform resource locator,1
papa ketua fraksi rakyat nya setya novanto dewan wakil rakyat pecat ketua dewan wakil rakyat pecat dewan wakil rakyat,1
ribut komunis bla bla emoh baca baca niat agitasi serang perintah pakai cari simpatisan,1
vital inter bek kanan beda ya era maicon ambrosio cancelo bagus nhmmmm bera i simpul geblek ausilio,1
43 contoh tuding duga korupsi susilo bambang yudhoyono dorong jaksa usut himbau komisi berantas korupsi usut duga korupsi jokowi,1
caci maki nista agama nyata poligami umpet sih ogah,1
bubar negara republik indonesia harga mati,1
laku bani cebong,1
cebong panas ngawur,1
partai komunis indonesia alias ai korupsi indonesia ganyang,1
ganti rezim kacung cebong,1
solusi 2019 ganti presiden dampak signifikan nya obat cegah sakit be ambah parah,1
culun mending kampung jess,1
ha bangkai nih truk,1
cebong kampret onta singgung laut,1
coba kaca introspeksi keluarga pakai hijab komunis otak pakai prope iya orang,1
copot darmin nasution menteri ekonomi ekonomi bodoh turun daya beli jabat,1
hasil penjara ahok alumni 212 dukung rizieq lengser jokowi lebaran,1
sabar doa usaha ikhtiar mudah mudah bentar 2019 ganti presiden pakai sontek pakai plonga plongo,1
celeng nya bang acon susah banget xa,1
cari musuh dasar ana cebong kampret,1
juara tipu junjung bani kampret 212,1
amin rais bikin kacau suruh reformasi pilih kepala daerah salah hasil,1
fahri hamzah presiden komisi berantas korupsi bubar uniform resource locator,1
native speaker ya mother language nya english komen jaga bangsat,1
salah tulis salah bu maksud nya cebong muda kampung,1
kiai staquf suku ras biar mudah paham nalar bahlul arab sembah sodor arab bani saud pro israel eh pura pura,1
bubar dewan wakil rakyat bubar save komisi berantas korupsi,1
gue diving mampus junedi,1
suciwati revolusi mental jokowi omong kosong bual tuju amp komen uniform resource locator,1
otak makelar jual aset negara maling aset negara pe amina jual isi tenaga kerja asing tiongkok 2019 ganti presiden nurl,1
akun siti fatimah amp komen laman ringkas parah amp bejat malu moga sehat sabar amp semangat suara,1
bawang putih kafir haram his hiks hiks,1
tuju ahoker lengser prabowo jokowi hancur penjara karuan uniform resource locator,1
presiden buruk sejarah bangsa bangsa cebong,1
ku padah eh even bodoh bulak curang ompu ya nya still segal sayang eh bodoh sikpande harga,1
biadab oknum aparat keparat,1
wkwk mampus salah gue blok jaman jokowi ahok calon gubernur gaya intip intip anies sandi uniform resource locator,1
kocak kalabong dungu,1
ehhhhh bandot kritik jokowi mencret darah is oke hina fitnah ambil tindak jokowi presiden pimpin negara pimpin agama salah kaprah luuuu,1
astagfirullah mata gue noda kutuk nge bokep,1
pergi bangkai,1
amin ya rabi tolong indonesia ya alah lebiiihhhh,1
bela pancasila daulat negara dukung lengser ancam nyata,1
proyek saracen ganjal lantik anies temu saracen foto tokoh ai politik,1
sih ahok kutil babi,1
jokowi kasihan goreng pbb,1
kepala polisi republik indonesia mundur jabat,1
ya bentar utang susilo bambang yudhoyono njiiieng,1
negara kayak tipu bocah sekolah dasar dokumen hilang huh,1
ogah prabowo gatot oke,1
najis kirim pesan direct message gue balas bodoh gue doa pentas menang,1
cowok bacot sih anjing gue gampar,1
indonesia lawyers club boediono century intens lupa kunci butuh 2019 ganti presiden,1
maju gubernur sengsara rawan,1
copras calon presiden pikir mikirrrr pikir sih kowi 1 periode babak bur uniform resource locator,1
tau jokowi panggung jilat jilat prabowo dasar lintah uniform resource locator,1
barusan dongok dongok motor klakson be ubi2 lampu merah oi dongok berisik norak pas tengok tau teman chain menang ganti lu darah puteeeh,1
dengar ulama otot kriminalisasi ulama ya lengser jokowi,1
dukung calon presiden suka atur jokowi prabowo atur menang pilih presiden 2019,1
hebat ahok maaf bini salam 7 surat pemberitahuan ono kabur malu ulama laku bejat,1
hidup prabowo anak soemitro penghianat bangsa,1
pilih presiden orang tua nya penghianat negara,1
sih ahok bilang nista agama kayak politikus koruptor panggil urus hukum ngeles pakai sakit hati hati mati,1
cebong kasih fakta bilang dusta cebong kasih dusta bilang realita cebonger si bikin gemas,1
rakyat kaum bani cebong,1
gue menang anjir cupu fik,1
orang orang maha nan suci sih hina presiden lepas umur keluh tahan cina tahan keluh perintah orde su,1
salah amp bilang antek asing adik prabowo bilang prabowo pro amerika uniform resource locator,1
eh wa awan selandia kampret berita kampret sebar kasih konferensi pers laku,1
citra ah prabowo tidur,1
bro ciri ciri cebong adu domba sok lugu nama cebong buzzer receh,1
prabowo tua generasi muda blusuk jokowi muda blusuk pulau,1
dah shopee kampang,1
baca banding modal hasil dasar antek asing,1
cebong senang lihat jaya anis sirik parah junjung puji habis habis laku buruk,1
luhut bajing,1
tuhan iblis iblis tuhan agama onta,1
tertawa baris cebong sakit hati pakai isu saracen serang anies sandi gagal lantik,1
prabowo si mulut busuk rizieq anies fadli zon fahri kumpul sampah negara laku kayak sampah,1
manusia otak dungu teriak teriak bubar partai komunis indonesia buku baca bodoh otak kosong mulut iya iya,1
cebong jago bikin sebar hoaks,1
bicara remeh temeh surat pemberitahuan kalajengking beliau tau oposisi surat pemberitahuan nyinyir stres strok dosen laku bacot gede hasil karya anak asuh mayor dungu,1
hehe tipikal bani bodoh bantah danga dungu,1
improvisasi lagu al qur an tafsir masak susah pikir murottal tingkat tilawatil qur an tingkat raut muka tafsir kentut tafsir ngentot tafsir kawin tafsir aji,1
panik ganti presiden tau calon ups pimpin koruptor te angkap ganti presiden tau negosiasi,1
thread tenaga kerja indonesia malaysia jam kerja enam belas jam kilang jahanam,1
ekonomi hancur subsidi cabut bahan bakar minyak mahal listrik karuan sembako jangkau rakyat politik kisruh agama nista bijak pro rakyat ham bengkalai leadership lemah periode,1
indonesia hormat as kemarin bicara nwahhh roman roman antek asing,1
cipta hoaks ya presiden wakil,1
gilir ambruk plonga plongo kayak ayam kena tetelo putin prabowo indonesia 2019 ganti presiden,1
sindir deh 2019 ganti presiden,1
bicara sains tonton youtube laku eksperimen tonton youtube modifikasi aduh geblek,1
jokowi serah ganti jokowi lengser jokowi kisas jokowi uniform resource locator,1
nasional demokrat bahan te awa anak indonesia omong kader kader bunyi calon wakil presiden jokowi khayal kader kader ai rakyat peduli kecuali 2019 ganti presiden,1
direct message sis zon bilang kampang kesal bangsat,1
bubar komisi berantas korupsi biar leluasa koruptor kaya negeri,1
susah bang jawa pegang jokowi antek sedih sih,1
rezim orang kayak berani tampil layar kaca mohon ambil tindak,1
otoriter bukti ott ai politik ya tangkap,1
heran budaya indonesia orang sepe i a eria fahri fadli jual teater narasumber berita kamera cari teater sengaja insentif monyet,1
asa kemarin kemarin pakai axis aman aman deh rumah 2 minggu kacrut kali sih jaring,1
otak taruh taruh congor,1
najis sok banget jutek iyuuuh gue yanyk,1
bubar dewan wakil rakyat komisi berantas korupsi bodoh nya,1
atur presiden jokowi atur presiden susilo bambang yudhoyono buka mata lihat bacot bodoh bodoh,1
tolak atur presiden tenaga kerja asing tolak atur presiden tenaga kerja asing 2019 ganti presiden 2019 presiden hai mahasiswa indonesia nih hadiah lipstik kolor orang kakek tukang becak,1
hina keluarga jokowi langsung ciduk gilir hina prabowo susilo bambang yudhoyono biar,1
bani kocak nih dukung siwanbango bego,1
haha silvy oh silvy cacing ah wkwk debat final pilih kepala daerah jakarta,1
bagus pakai petisi lengser jokowi ya ahok cipinang,1
laku raja salman citra,1
edukasi manusia manusia udik sepe i,1
tolol hubung rumah tangga urus kerja cakap menteri pecat gubernur jaka a karuan sebentar hancur jaka a,1
bubar dewan wakil rakyat butuh,1
tertawa gue tai gampar,1
cocot cocot cocot 2019 bubar gerindra,1
wkwk trigger bani onta,1
berengsek ya mantan gue one thing bout her gue suka mulut filter sok gue jujur,1
ya gue demo jokowi tendang palkjihun dunia,1
jelek udik,1
muak fitnah prabowo,1
iklan ahok jahat rezim jokowi kampret setan iblis dajjal bangkit kubur gembira pesta pora belenggu,1
kayak tai,1
sih joko populer pro nas jakarta sih ahok mw kalah proyek proyek jakarta 1 bangun selesai bangun ruas ruas utama cebong goblok salah ani,1
anak anjing kampang,1
bani kampret bani kecebong pilih bani adam manusia,1
hai kunyuk paham ya prabowo subianto calon presiden salah presiden play station mem,1
rezim sales rezim tipu citra palsu,1
nih sih nyinyir hijrah tutup koreng,1
pakai paksa paksa jokowi duduk rakhine prabowo anggur politikus anggur omong ngawur,1
jokowi ahok te unda penjara ya uniform resource locator,1
tim sukses anies sandi mentwit kacau sok jago,1
kicau lihat tolol goblok tolol pilih,1
bong dungu video 31 detik langsung ambil simpul heran dungu kolam,1
generasi tinja bahagia pimpin nya koar koar anti asing jaman pilih kepala daerah selesai pilih kepala daerah bela tinja nya asing enak,1
haha babi migrain plak twit caring babi iya hg reply twit lepas brim nih good timing,1
bikin puyeng kepala prabowo amin rais om nada nada bicara mutu,1
ahok si mulut jamban tokoh nilai bahasa indonesia norma etika 0 tai kucing,1
jir dahak wkwk tolol,1
ahok tai fitnah tukang caci maki perempuannn anjing ahok tumbang debat final pilih kepala daerah jakarta,1
lihat main lengser jokowi hasil ganti presiden sepe i o ganti habibie,1
media sosial presiden soeha o lengser jokowi,1
sih anjing lebay geblek,1
ambisi kuasa sah sah bilang otoriter sih uniform resource locator,1
hem kayak turun pakde nih akal sehat jalan,1
aset negara jual ya ruhut hebat impor pangan rajalela bahan bakar minyak babi buta puluh juta lowong kerja asing hebat joko widodo bikin rakyat negara sengsara hancur,1
ekonomi pegang gerindra hancur negara masak saran cetak uang bayar hutang hutang utang negara bilang biaya produksi cetak uang murah ekonomi comberan kecoa,1
98 dolar 12 000 koar koar rezim lengser tembus 15 000 jilat kuasa kasihan rakyat korban propaganda politikus busuk,1
pagu ajak gelut onta,1
prof jeffrey musim dingin jokowi presiden lemah sejarah indonesia anisa bahas prof jeffrey musim dingin bagus analisis 2015 bahas 2019 ganti presiden,1
ya allah daniel beli micin bego lurah,1
prabowo layak calon presiden layak presiden,1
jokowi era bangun duit utang,1
klop prabowo berontak koruptor,1
udik darah daging,1
baju muslim be uliskan 2019 ganti presiden 2019 prabowo presiden,1
mobile legend babi anjing xnk kasih rank kimakkk tim noob babi bocah setan,1
dukung koruptor bubar komisi berantas korupsi situ isu isu partai komunis indonesia dasar koruptor,1
orang bodoh opini partai komunis indonesia bangkit presiden pintar akting citra intelijen tentara nasional indonesia bicara partai komunis indonesia bangkit,1
ngapain komen tolol,1
mamat masuk van celah kereta lai rusak setan dasarrrr,1
manis butut goblok soler out herjos out,1
hina malu fasilitas perintah bikin bani daster tau malu harga makan gaji negara hina haram,1
anak pepo tampang doang bawa bangsa foto model cebong urus biar rewel x9,1
besok prabowo calon presiden teriak teriak timpang percaya maki wa awan gaji,1
maksud kelas diam bicara ya nama otoriter,1
freepo kontrak habis istimewa aneh dolar tembus 15 000 diam jilat kuasa dungu ya tum lihat bobrok kerja rezim,1
aduh tolol ya dukung rezim ya kayak,1
diktator jokowi jongos organisasi jagal manusia nu atur siasat kampanye,1
ngawur sembarang panitia khusus hambat komisi berantas korupsi lidi teman teman koruptor bubar dewan wakil rakyat sarang koruptor,1
kirim bantu citra,1
eh anjing bacot gue tantang duel bangsat,1
dasar kunyuk nih cari duit modal tipu bangsat abu,1
ngoaaahahaaa saking kejang kejang nya sih bani kuda prabowo bin onta baca tulis gue selingkuh kuda prabowo ngoaaahahaaaa xa,1
cari simpati umat muslim jabar pilih presiden 2019 mudah an ulama amp umat islam jabar kesima amp pengaruh trik gaya munafik sih mukidi,1
tebar benci ahok mbak mbak tau sih dakwa,1
mampus gue mampus yugi mampus onta arab,1
dongok bong kampret kalabong marah marah suruh laden tetas bong bong,1
dukung prabowo surat pemberitahuan arb sda orang orang bejat tabiat kasar masuk orang,1
susilo bambang yudhoyono objektif mumpuni politis indonesia hebat kayak jokowi presiden uniform resource locator,1
bacot album album gue beli pakai duit gue rugi emak akibat dicerahami beli album,1
nama jonru ginting status lapor benci duga dukung anies sandi,1
bicara geblek,1
bubar ikat alumni universitas indonesia oi,1
kampret,1
gubernur tabrak etika jabat lantik gubernur dukun ya calon presiden senang presiden jabat ya lantik beliau calon gubernur dukung presiden calon gubernur,1
lt strong dasar cebong dungu 7 turun lt strong,1
serius nih berita polisi politik berani tukang becak doang pakai takut ya power sindrom landa istana lawan tukang becak,1
prabowo subianto restu ketua gerindra jawa maju pilih gubernur alas uniform resource locator,1
serah nasib bangsa orang orang abdi meng kacung cukong cukong asing penghianat negara republik indonesia modal dana kampanye 2019 ganti presiden,1
aimu partai demokrasi indonesia juang bajing,1
jokowi mundur pas,1
binatang kutuk,1
bilang anti asing asing asong kafir kafir kampretttt nyata manusia munafik suka rupa asing impo bawang puti,1
dasar tolol,1
ganti presiden celeng langsung kelojot salah rocky gerung bilang celeng dungu stabil,1
bangkai,1
gilir sodor fakta cebong diam cebong sengsara dukung dil otak kontaminasi gerak cepat pikir waras,1
amp hukum sih bangkai turun babi keparat derita alami rakyat indonesia nusantara bahasa adat istiadat budaya ras agama suku pimpin a,1
bak sampah jerman anis resmi toilet keliling gunting pita ya nomor induk siswa,1
sanggup tangkap presiden tugas ai jujungan mangkrak ya jinjing,1
lawan politik tebar fitnah upaya jegal prabowo maju pilih presiden 2019 uniform resource locator,1
tau junjung cebong licik ya hamba tukang tipu,1
bikin film bakar bakar sekolah citra uniform resource locator,1
fubu an ajar calon nernya langsung hajar pakai analisa swot ajar kuat lemah oppo unity kayak amp threat bahaya logika gara gara disyerpik ketemu langsung sikat psiko mampus l,1
2019 ganti presiden anggur tingkat,1
kecoak bicara juntrung ya gue tinggal mutu bicara orang dungu kayak,1
bodoh bangsa gue uji semester uniform resource locator,1
dasar celeng,1
maling teriak maling kafir teriak kafir orang orang kayak lahir campur tai,1
sih anak kampang muncul twitter,1
sih kakak cocot sitohang,1
unik jokowi,1
kkkkkkkkkkkkkk cebong iq ratus sp i junjung dungu plonga plongo 2019 ganti presiden,1
isu manusia rohingya bukti ketidakcermatan tim kelola buah isu,1
sesal bangsat v sakit tunggu sehat ya lihat laku bangsat,1
eh serius muntah tai hyung,1
aki amien rais bilang prabowo karno karno suku agama ras pulau negara republik indonesia prabowo pecah belah dasar mabuk aki,1
salah ajar lihat kacamata acara televisi salah laku positif banget dasar tolol kembang,1
anti bineka cebong tuduh umat islam,1
oke point cebong dungu intelligence quotient kolam eyel ujung ujung kolam pokok ganti ya,1
pikir arah riskan hantam posisi imbang condong habis hitam hitam 2019 ganti presiden,1
september perang partai komunis indonesia desember perang topi santa prabowo menteri peran wanita,1
dewan wakil rakyat majelis musyawarat rakyat ambil tindak pecat hormat setya novanto sudi wakil manusia hina tanda rakyat indonesia,1
iya huhu orang udik lihat langsung peru kompilasi bilang waaah,1
dongok super er promosi film wkwk politik wkwk persib politik,1
provokasi lengser jokowi gue lengser jusuf kalla biar adil biar ramai tamak,1
rezim sensasional tindak peristiwa nalar dominan doa moga deklarasi islam cebong nusantara,1
ahok bebas ulama komando revolusi lengser jokowi sumber uniform resource locator,1
selamat derita orang ih uniform resource locator,1
goblok twit sih apes omong sih prabowo arah kesitu,1
kakak kredit pinjam negara,1
paham perintah pusat kes surat pemberitahuan biar anjing program program bego progresif tau ya biar masyarakat nilai program program hancur hancur ya nama anjing pose elang ngepet uniform resource locator,1
kaum cebong dungu saham ambil putus mayoritas untung gaji kerja alat freepo,1
pakai jilbab komunis megawati sri mulyani puan maharani mentwit pintar ya tong,1
bacot,1
jokowi staf ahli khusus mempe ahankan aset nasional diktator jomlo lokal,1
asli bego kelar kelar nih ai kualitas kayak ai allah wkwk bego bani micin setia dukung bos calon presiden dumb ception,1
ahok tamat penjara ahok penjara ahok,1
tolong ajak buzzer pintar anggar jago hina orang suka pakai lapor polisi aduh,1
sinting kah km bos bubar komisi berantas korupsi km orang orang,1
sampean sarap ya impor pesawat papa impor garam bayang indonesia isi garam garam impor dasar otak ampu kaki,1
nya muara nya tanggung presiden solusi solusi turun jokowi,1
milik kampret bodoh otak kampret,1
ayo dukung penuh 1 000 2019 ganti presiden,1
gue mimpi sentil biji babi ahok cetar cetar langsung kejang kejang adu jokowi jokowi sunat bicara al maidah,1
wkwk mampus,1
promosi bani kampret,1
nya gerombol hina presiden mesti proses,1
lengser jokowi frop parah frop,1
baca judul monyet biar domba idiot,1
bebas adil ustaz alfian tanjung langsung tangkap adil uniform resource locator uniform resource locator,1
fitnah makan nih akun sampah,1
anak monyet bawa bawa agama bicara politik tau wawas wkwk dangkal media sosial bicara sektarianisme pecah belah umat agam suku ras agama bicara kecebong makar orang panglima gatot kait,1
zaman susilo bambang yudhoyono antek antek partai komunis indonesia rajalela ganas sepe i,1
csis bohong harp menang 2019 cih uniform resource locator,1
mundur gatot amp saing sehat jokowi,1
pe kakak es lagiiiii lo ai kampret sejati uniform resource locator,1
nama cari nafkah bangsat,1
tuju pakai banget sekretariat jenderal pcn ai cocot nusantara,1
keparat orang mantan gue,1
sekretariat jenderal pbb saracen,1
suka video uniform resource locator ahok bebas anies puruk amp ancam gagal gubernur sandi resmi,1
kampret rusak nusantara jaman majapahit langsung wadah hati rekan ide khilafah,1
rakyat suruh pilih spa bubar nya dewan wakil rakyat bubar sesuai konstitusi uniform resource locator,1
balas gue balas mulu dasar onta cebong,1
orang saksi anjing babi tolol uniform resource locator,1
anjing goblok setan bangsat,1
ahoker 11 12 jokower surup rakus 2 periode 2019 ganti presiden gerak,1
20 3 kb si koneksi bangsat,1
dasar bajing percaya omong,1
malas gue baca onta,1
anak berontak layak negeri,1
detik bukti lelaki bajing,1
bandung butuh acara acara pekan tanggal merah macet bangsat,1
bro lupa jenguk gara gara asma dewi menang,1
orang edan koe,1
kritik jokowi anggap nyinyir bani kolam kritik ujung dukung 2 periode lo kritik dukung a inya nyinyir haram definisi kritik ala cebi nalar rusak parah,1
onta,1
anies sandi berani,1
kutuk bro,1
nyata rakyat susah menteri perek daya beli hancur setan iblis tukang tipu,1
surat pemberitahuan ahok nasional demokrat susul rekan nya dukung pasang calon nista agama tukang caci maki tai tai,1
sih anjing banget paypal,1
ahok calon gubernur demo,1
ayo serbuuu persekusi hina presiden hina ulama tuan guru bajang kiai said quraish shihab hina rizieq persekusi rizieq nabi,1
sumpah subjek nih gila babi,1
mari bubar dewan wakil rakyat uniform resource locator,1
orang mancam peluk negeri gedong gede dongok ngawur,1
bajing indosat,1
bisnis biar 2019 ganti presiden presiden amanah siswi janji omong impor serba impor tani negeri gigit jari ampun deh,1
cepat setan,1
presiden hina kepala polisi republik indonesia menteri hukum hak asasi manusia menteri didik budaya menhan abu janda ansar baris serba diam ajaib,1
biar perintah provinsi daerah khusus ibukota kerja mari dukung bantu perintah provinsi lawan cukong asing asing koruptor teguh perintah provinsi daerah khusus ibukota warga daerah khusus ibukota jaka a lawan cukong asing asing k,1
kampung banget sih omong bahas sorry level debat dungu otak,1
