Tweet,HS_Race
a is kampung gmnin udik kampung handphone anak gue cemplung gue beli pakai keringat halal hasil kangkang laki orang,1
19 khilafah tempuh bikin ai tii bahaya ideologi komunis,1
bambang muka kontol hina ulama gue hajar dasar antek komunis,1
etnis asli singapura kuasa melayu cina jajah rebut,1
indonesia cina,1
tuju usir cina negeri,1
cina usaha kuasa politik hukum indonesia,1
ratus massa organisasi masyarakat islam gerebek jaka a ganyang partai komunis indonesia uniform resource locator uniform resource locator,1
usir buddha myanmar bumi indonesia uniform resource locator,1
jokowi ratu adil turun darah biru darah kotor cina babi uniform resource locator,1
ai bangkit paham komunis bangkit tanam rezim,1
fahri hamzah bela prabowo pe olongan perintah jokowi rohingya bubar partai komunis indonesia bubar partai komunis indonesia,1
islam nusantara 1 wacana islam arab partai komunis indonesia tumpang partai demokrasi indonesia juang 2015 jokowi menang pilih presiden 2014 sadar sih manfaat sadar,1
menteri dagang cina tumpang cari makan hidup indonesia cari perkara pribumi usir negara republik indonesia,1
cewek cakap bego laku sih ahok cina bau tai makan bubur encer ahok paham komunis nista islam kristen,1
tolak sweeping kerja cina komunis antek komunis bro legal buka pintu masuk,1
matanajwadebatjaka a lucu banget ahok sambung kena sekak mat pe anyaan isu agama dasar cina tolol haha,1
rakyat cina rakyat indonesia anak turun partai komunis indonesia paham uniform resource locator,1
gue penasaran sih haha cari kambing hitam asing rusia misterius diam tanggap ya cepat bikin hancur drag us all haha perintah,1
iklan ahok jahat teroris nyata indonesia wahabi onta babi babi milik cina tebar teror sungguh,1
cina kenal trik tipu daya mending usir suruh habitat asli,1
jokowi tes dna tes dna bukti nya turun partai komunis indonesia,1
partai demokrasi indonesia komunis ya,1
ahok kafir umat islam anti ahok ahok kafir ahok cina suka makan babi bir,1
bangsat bintaro komunis ubah,1
nyata ciri khas orang nusantara benci ras tionghoa,1
nampaknya paket sokong cina babi sokong lgbt,1
ya fakta partai komunis indonesia uniform resource locator,1
nyata antek asing cina laku jokowi nyata uno impor cina kampret diam hening,1
ganyang partai komunis indonesia khianat partai komunis indonesia 1948 uniform resource locator,1
gila efek utang cina badan narkotika nasional 80 sabu masuk indonesia produksi cina uniform resource locator,1
mari rapat baris target nya lengser jokowi isu partai komunis indonesia bela kafir pria non pria,1
haha te ipu onta arab,1
ganyang partai komunis indonesia uniform resource locator gedung jaka a uniform resource locator uniform resource locator,1
bikin reklamasi kunjung duit cukong junjung setop eh bilang sipit songong,1
sih heran antek antek partai komunis indonesia muncul rintik rintik hujan,1
komunis partai komunis indonesia umat islam ribut senang perintah anti islam gaya adu domba main,1
usir cina harga,1
bela partai komunis indonesia muncul bela rezim bela ahok komunis cina peran waspada darurat partai komunis indonesia,1
bajar timor leste pribumi milik daulat timor leste etnis cina penghianat perompak ahok,1
sadar rezim neo komunis bangkit,1
hukum surat pemberitahuan negeri mata remaja labil mata sipit hina presiden simbol negara nyata sepi berita indikasi anggap bebas ekspres anggap lucu lucu pikir dah gue mah,1
moga panglima tentara nasional indonesia selamat negara republik indonesia jual aset negara antek antek komunis,1
cina senang indonesia susah canda sih encek csis harry tjan silalahi 80 an,1
expect lepas tangan kerja lecturer ape lancau sial cina nih,1
ahok bebas syarat hidup markas komando nyaman nyaman rejim kacung sifat cina penghianat,1
akun anak partai komunis indonesia,1
cina anjing uniform resource locator,1
ganyang partai komunis indonesia tentara nasional indonesia uniform resource locator,1
media antek komunis waspada partai komunis indonesia uniform resource locator,1
mantap bravo pasang ideal cocok 2019 tumbang kaum antek cina,1
wajar kivlan zein benci partai komunis indonesia wajar partai komunis indonesia benci simpatisan darurat partai komunis indonesia uniform resource locator,1
indonesia bangun hambalang teror reklamasi cina meika a lancar aman,1
nomor koruptor negeri korup asuh cina babi uniform resource locator,1
usir cina bala mongondow juragan ng,1
bubar partai komunis indonesia orde orde pas berantas partai komunis indonesia,1
minoritas muslim rohingya sekian zalim,1
kerja cina proyek jalan tol lempar bendera merah putih hukum hormat bendera amp depo asi,1
iklan ahok jahat ahok cipta bara api rakyat pribumi tionghoa balut fobia ahok kafir racist,1
melayu hidang daging lembu tetamu hindu sensitivitas,1
haha tulang orang batak tulang manusia orang batak kali luhut binsar panjaitan orang batak orang tionghoa sesat batak mu,1
usir rohingya indonesia rohingya nista gadis buddha myanmar,1
penjara cina kafir ateis masuk ahok pimpin babi tukang korupsi,1
jokowi pimpin buruk sih raja utang ahli citra maling kampung jago bohong opresif anak partai komunis indonesia jongos cina komunis,1
koordinasi kuat massa muslim kepung duta myanmar usir duta orang buddha biadab indonesia,1
antek asing komunis kapitalis,1
bukti nyata cina indonesia antek jajah,1
negara republik indonesia eks bebas serbu tenaga kerja asing cina mari umat islam indonesia ganti presiden 2019 ganti presiden yuk 2019 presiden,1
jokowi komunis kapitalis uniform resource locator,1
blok cina rusia syarat korban galau berat indonesia kerja hebat uniform resource locator,1
pakai licik akun palsu sebar membully akun palsu bunuh karakter orang salah partai komunis indonesia orang ateis anti allah agama jenderal nasution waspada komunis,1
usir duta myanmar kumpul orang buddha indonesia lapang buka adakan orasi uniform resource locator,1
usir turun cina pe ahankan pribumi arab usir turun ya,1
cina usir zaman belanda tukang penghianat,1
nih partai demokrasi indonesia juang nasional demokrat bicara ganyang partai komunis indonesia memble,1
larang ajar komunisme sisi perintah buka pintu masuk nya wisatawan komunis negeri,1
iya cebong cina komunis cinta sih jamban,1
ganyang partai komunis indonesia waspada bahaya laten,1
usir bakar lilin aksi bineka aksi teroris cina bukti mata sipit pegang lilin,1
sipit sipit bantat kayak seungmin,1
monyet komunis tolol,1
neo komunis antek cina sebentar musnah negeri,1
kurikulum cinta indonesia hapus ganti kurikulum cinta cina,1
ganyang partai komunis indonesia hapus lambang partai komunis indonesia film intimidasi komunis antek partai komunis indonesia sepe i hantu,1
blokir cina telegram blokir jokowi tuduh teroris sabu cina cina usir sesuai pikir rezim,1
fitnah jenderal fitnah prabowo sudut umat islam situ partai komunis indonesia ya uniform resource locator,1
janji deh puluh juta lapang kerja rakyat tenaga kerja asing cina,1
pribumi tolak etnis cina pimpin indonesia adu pancasila bineka,1
selamat minggu partai komunis indonesia tamat hancur awas gera hati komplot makhluk kaki larang muka bumi indonesia,1
lengser jokowi kuasa cina komunis,1
edan edan pokok 2019 ganti presiden usir cina cina keparat tau malu,1
muncul partai komunis indonesia bulu monyet uniform resource locator,1
gue rakyat indonesia sukarela berantas cebong komunis,1
usir duta myanmar lindung teroris buddha save rohingya,1
ganti presiden tenaga kerja asing cina pulang datar cina pakai getek,1
cina perikemanusiaan suka cina indonesia,1
nyata sangkut paut ya teriak cina nyata turun cina teriak partai komunis indonesia nyata berontak,1
rezim diktaktor ekonomi cina sumpah setia undang undang dasar penghianat turun jokowi,1
akun akun antek komunis liar darurat partai komunis indonesia,1
gebuk komunis partai komunis indonesia selamat negara republik indonesia kasih kendor bantai ulama kiai nu ulang,1
umat hindu permak tentara buddha radikal teroris muslim rohingya,1
marah tah bang bilang etnis cina kasih pimpin indonesia watak asli jajah,1
sih cina kafir ahok kriminalisasi polisi rekayasa hukum nya,1
usir depak cina amerika komunisme sekuler liberalisme demokrasi ganti hukum allah rasul gus syams,1
usir cina partai komunis indonesia negara republik indonesia,1
awas provokasi jokowi antek cina anti islam,1
umat islam toleran umat kristiani buddha rindu cina usir uniform resource locator,1
indonesia musibah umat islam berkah orang cina amp kristen,1
munafik golput panas dingin bela sih kuli cina kejang kejang lihat orang kagum pimpin karismatik plonga plongo,1
biadab ahok cina kafir anak anak rakyat pribumi islam gusur rumah a hidup,1
eh cina setan tumpang makan indonesia enak nya,1
orang indonesia dongok nya lihat banget jalan kasih jalan madam bakar manfaat ambil jalur madam asli goblok,1
komunis bangsat uniform resource locator,1
tenang panik a khawatir jok ribu lapang kerja ribu tenaga kerja asing republik rakyat cina selamat ber antre ria ya wkwk,1
benci muslim antek komunis puluh bantai muslim,1
partai komunis indonesia gaya partai komunis indonesia jambret mati kota padang jambret mati partai komunis indonesia tolol fitnah nya jambret mati minimal rumah sakit,1
om makar om ya makar megawati biar cina cina korup bantu likuiditas bank indonesia partai demokrasi indonesia juang lengser jokowi,1
ganyang partai komunis indonesia ganyang partai komunis indonesia ganyang partai komunis indonesia uniform resource locator,1
siti goblok hidup indon sedekah bising malaysia makmur kayak raya,1
sumpah gue bohong ya gue kerja pabrik feronikel milik rusia kerja orang cina gue jijik jorok bab siram makan babi ular kadal bikin gue jengkel bau badan masya allah taha,1
garuda sengaja bangkrut biar asai asing asing cina laknat lengser garuda bangkrut,1
tangkap laku polisi lengser jokowi rezim partai komunis indonesia,1
cina usir indonesia lihat miskin,1
catet cebong kader komunis indonesia,1
bangga politik indonesia masuk hitung amerika cina sayang hitung jajah,1
ganyang partai komunis indonesia antek uniform resource locator,1
kantor kepung massa takut kuak pokok ganyang partai komunis indonesia,1
alah istana kuasa cina hancur rakyat indonesia,1
usir cina ganyang cina,1
antek komunis biadab jongos cina,1
iya sih kayak komunis banget wkwk,1
indonesia boikot bank iran negara islam terima uang cina uniform resource locator,1
tau bicara tumpas partai komunis indonesia komunis antek serang ya serang partai komunis indonesia partai komunis indonesia lindung partai komunis indonesia,1
sikap keras hadap cina kafir uniform resource locator,1
malu indonesia gubernur cina,1
orang tionghoa ijazah palsu tokoh masyarakat tionghoa sungguh sampah tg pinang agama kristen wihara nama nya munafik muslim,1
komunis anjing wkwk,1
fuck teroris buddha myanmar,1
bentar partai komunis indonesia indonesia bubar partai demokrasi indonesia juang,1
usir cina negeri kecuali cina patriotik kayak gue,1
kuli cina nya usir tenaga kerja indonesia anggur uniform resource locator,1
bukti masuk investor cina buruh cina indonesia bukti,1
waspada lini susup kader partai komunis indonesia antek cina komunis,1
stigma partai komunis indonesia komunis kafir munafik babi ya dewan wakil rakyat teriak gantung bunuh usir warga negara indonesia etnis cina,1
partai demokrasi indonesia p komunis,1
lawan partai adil sejahtera konsisten lawan investasi cina grup lippo donatur anies sandi meika a partai adil sejahtera,1
suka teriak pancasila indonesia komunis cina antek antek,1
pro perintah langsung cap kafir komunis pro asing melek mata rien,1
etnis cina indonesia imigran gelap,1
tolong bubar acara partai komunis indonesia uniform resource locator,1
bela cina keparat ubah anjing buduk marah enyah cina keparat bumi negara republik indonesia sumpah cina hidup indonesia setia tanah air sum,1
waaah sih perek gerwani gangbang babi sipit bentuk adik ya choong hancur hasil entot kuda babi sipit ngooaaahahaaa,1
nya gampang presiden mu hina cina bangsat diam sih munafik bisu 2019 ganti presiden,1
keji biadab ganyang partai komunis indonesia paham komunis negara republik indonesia uniform resource locator,1
anggota nyata cina manusia kampret kampret teroris keji indonesia pilih the,1
media indonesia cina komunis,1
partai komunis indonesia ilusi ancam nyata negara republik indonesia antek antek neo orde plus front bela islam huh kelompok khilafah puja isis waspada,1
indonesia tindak nyata usir duta myanmar indonesia biksu buddha militer bunuh masal genosida etnis rohingya,1
komunisme nya cina kapitalisme nya us pancasila indonesia bro,1
cina maju komunisme,1
tuju turun jokowi bela pro partai komunis indonesia,1
anak berontak jaman menandatangani kontrak pt freepo jaman turun tionghoa masuk islam mantu presiden jaman,1
usir cina jokowi radikal usir cina generasi bangsa mental rusak tumbang jokowi uniform resource locator,1
usir teroris buddha bunuh muslim rohingya usir duta myanmar,1
mantap usir kaum cina karawang,1
ayo polisi tangkap usir sih raja kodok komunis istana cebong cina komunis hancur negara republik indonesia,1
dosa fitnah umpama bunuh tau dar cina buku islam fitnah lantak nih konon islam nih cerita,1
rezim rezim komunis biadab rezim komunis budaya catet partai komunis indonesia korban,1
antek komunis kejang kejang,1
usir cina tiongkok uniform resource locator,1
banding lurus bijak rezim mesra cina produsen narkotika masuk indonesia uniform resource locator,1
mumpung september ganyang partai komunis indonesia,1
tenaga kerja cina leceh lambang negara indonesia uniform resource locator,1
teriak teriak pancasila koar koar negara republik indonesia harga mati tolak film 30 si partai komunis indonesia putar ulang situ bunglon antek komunis,1
partai komunis indonesia kali susup acara min massa teriak ganyang partai komunis indonesia,1
ajak dialog tolak wajar rakyat tuduh antek komunis,1
pribumi tolak etnis cina pimpin indonesia adu pancasila bineka,1
ganyang partai komunis indonesia antek antek nya jaka a,1
mulut mu bauk tai anti korupsi bubar komisi berantas korupsi partai adil sejahtera partai adil sejahtera sahabat komunis uniform resource locator,1
pribumi kaya alam indonesia milik kuasa etnis cina bantu aparat tegak hukum jongos cina,1
hati hati jajah cina pakai belanda adu domba pribumi lambat usir cina bangsat negara republik indonesia,1
jahat islam usir cina buddha indonesia,1
70 indonesia salah kuasa cina bang,1
arab saudi komunis antek partai komunis indonesia kriminalisasi ulama,1
ganyang partai komunis indonesia akar akar uniform resource locator,1
bodoh abu tours anjing tai tai luwes asuuuu cina puluh triliun bajing tai anjing maling sejati kerja indonesia rusak,1
usaha transpo asi online biadab undang undang no 22 2009dan tolak permen nomor 108th2017 usaha komunis dana komunis cina,1
kayak indonesia orang indonesia cina aneh ayo pribumi usir negeri,1
stop tutup iklan meike a meike a proyek bodong pribumi sampah jongos cina be obat,1
ganyang partai komunis indonesia antek antek orang orang ai dukung uniform resource locator,1
jokowi jongos cina,1
sikap diktator ai jilat duit cina tangkap tangkap uniform resource locator,1
usir nasionalis bidang ekonomi ekonomi monopoli cina total surat pemberitahuan hancur ri,1
ketemu klien orang batak marah gue marah berengsek malu kantor,1
suruh tenaga kerja asing cina tonton stadion lupa bawa 2 bendera merah putih bendera cina,1
goblok kakak kecebong pancasila negara republik indonesia otak hati komunis rezim anti korupsi 1 minggu 7 kali ott komisi berantas korupsi,1
meme nak cilok indonesia dasar malingsia berengsek,1
lini panas ganyang partai komunis indonesia,1
awas proyek partai komunis indonesia cina komunis,1
pribumi iseng aparat wajah garang cina racist aparat alay,1
ganyang partai komunis indonesia uniform resource locator,1
apel malang impor apel cina amerika nama bangga produk indonesia,1
penjara ahok lengser jokowi komunis cina nista alquran an nista agama kriminalisasi ulama kriminalisasi organisasi masyarakat islam,1
rezim anti islam pro komunis insyaallah saksi hancur,1
perintah marah bera i 100 rezim komunis,1
orang tegak khilafah tuduh radikal orang sebar paham komunis,1
cina indonesia po an tui gabung kompeni bunuh pribumi,1
bera i pribumi ya ayo bahan pribumi usir indonesia turun cina pribumi,1
orang suka prabowo bera i partai komunis indonesia uniform resource locator,1
mesir komunis kafir ekonomi asai dajjal poros beijing,1
pribumi iseng aparat sangarrrr puluh cina racist aparat alay jongos,1
sudi rakyat presiden jongos kacung cina presiden cebong cebong cina,1
usir buddha indonesia notabene mayoritas cina,1
heran perintah jokowi budak kuli cina cina ahok kafir 9 naga,1
selamat rezim komunis anti islam,1
cowok usaha lacak perhati gue lantas remeh perhati gue kasih khusus basic cowok bego,0
telat tau edan sarap gue gaul cigax jifla cal licew,0
41 kadang pikir percaya tuhan jatuh kali kali kadang tuhan tinggal orang tua rencana pisah kakak pilih kristen anak ter,0
ku tau mata sipit lihat,0
kaum cebong kafir lihat dongok dungu haha,0
ya bani taplak kawan kawan,0
deklarasi pilih kepala daerah 2018 aman anti hoaks warga dukuh sari jabon,0
gue selesai re watch aldnoah zero kampret 2 karakter utama cowok kena friendzone bro xd uniform resource locator,0
admin belanja po nak makan ais kepal milo ais kepal horlicks cendol toping kau kau doket gerai rozak me uaku taipan 2 kembar baby amp romantika bank islam senawang,0
enak ngewe,0
gue jari gue ukur nyali bacot,0
banci kaleng malu pe anyaan 2 nyungsep koe uniform resource locator,0
ajar ekonomi mesti jago privatisasi hati orang aduh ironi,0
aktor huru hara 98 prabowo si lengser perintah jokowi nyata,0
bu guru enak jablay guru sekolah dasar sih kayak nikmat pecun guru,0
lawan bicara gue intelek kayak otak kencing onta gue hadis nabi sahih kafir kayak tolak ahlun nar,0
pikir ampas banget ya,0
ari bek rapi monyet,0
cowok gantle gantle nama banci,0
alga mnr bom,0
anjing ya gue jarang ambek takut wkwk gue budak cinta,0
noob peluang sakit nya gede sih,0
joko widodo nilai presiden lemah sejarah indonesia jokowi milik modal dukung politik ketidakmampuan perintah hadap situasi ekonomi,0
ajar camat bilah hilir deklarasi anti hoaks amp pilih kepala daerah 2018 damai,0
bandara udara internasional ajati bangun gubernur ahmad heryawan anggar belanja negara perintah pusat insya allah operasi,0
gubernur presiden rakyat ya,0
sih kerja delay mulu setan,0
pintu sorga pintu sorga asli pintu hati modus banget,0
nenek nenek heran cebong bohong,0
islam nusantara produk jil pasar gencar antek jil jil anti arab pro asing almarhum kh hasyim muzadi,0
habis sahur jam 10 si bayi nete kali lemas,0
kak emak suka sipit wkwk,0
laku homo jaman now ngentot live blued gay video gvid lokal hangat uniform resource locator,0
kak gue orang jawa maaf ya gue orang palembang kakak deh ajar aksara jawa kelak ajar budaya palembang,0
pegawai guardian training kayak mentang mentang gue kayak gembel kaos flat shoes dijutekin bangsat malas beli kabur gue matahari,0
para bajing luka lady terima ganjar ratus kali lipat sanji selamat ulang laut jkt48,0
aja tolak berita hoaks sukses pilih kepala daerah wilayah kota,0
presiden ri jokowi kerja nya tulus ikhlas rakyat jokowi,0
edan tuju fabiano,0
al alquran ya bang mulut kayak orang kafir bejat hina farhat abbas law,0
lihat beda wibawa wibawa gubernur indonesia masya allah,0
anjir kali lihat orang bego debat pilih kepala daerah kerja serang karakter kecewa on empok silvy and agus debat final pilih kepala daerah jakarta,0
gubernur zaman now gus ipul puti 2 ganjar yasin 1 djarot sihar 2 hasan anton 2 koster ace 1 nurdin sudirman 3 karolin gidot 2 keanekaragaman budaya suku agama sungguh kaya djarot hadap pese a rakercabsu,0
iya islam lokalisasi kristen mas nusantara mas lihat gereja bandung pakai gamelan khotbah pakai bahas sunda jawa huria kristen batak protestan nusantara,0
cipta situasi aman tertib masyarakat jelang pilih kepala daerah 2018 kepala polisi sektor konang silaturahmi tokoh masyarakat,0
positif nse positif respon masyarakat hadap cangkul impor garam impor beras impor jagung impor tenaga kerja impor esemka impor nurl,0
sembahyang adopsi tradisi lokal kerja hindu istilah sembahyang pun lahir tradisi ritus menyembahhyang tunggal shalat sembah all,0
didik bodoh larang bawa agama biar orang islam bayar ahok sadar pilih ahok gila,0
ahok the best abai kaum kampret otak micin,0
sih otak tempurung laden lawan dungu makan hehe,0
awaasss berita saudara gerung susah cari kosakata bocor picing mata bibir monyong samping suara ky nhn kentut politik kotor zaman b pulang ky nhn ngeden dungu,0
pinokio umur 3 2019 ganti presiden,0
cerita silat lae kho merah muda oh indonesia liang ie shen tulis cina,0
benci umat islam,0
gue nete,0
wkwk bani lowo,0
takabur lahir kuasa rakyat ulama cendikia iblis makhluk alim amp ibadah atus ratus laknat hasud takabur orang ahli ilmu filsafat failosof mari demo sendi,0
a orang suka konser konser boros,0
makan racun ulama hukum rokok mubah,0
susilo bambang yudhoyono presiden ri 6 khofifah emil masyarakat no 1 bagus khofifah emil nomor,0
kali gue gemar korea pop omong teman teman gue idol gue banci homo,0
suka video uniform resource locator kisah seteru haji bolot amp malih tongtong,0
budaya kafir sungguh islam indah,0
hem hem diam bisu coba rumput goyang,0
setan bisik was was lindung allah qs al a raf 200 fussilat 36,0
ateis sibuk agama orang,0
lengser jokowi bangsat,0
selamat kakak 2019 ganti presiden 2019 presiden,0
bajing homo hati hati hadap anak anak utama kamar mandi laki laki biar uniform resource locator,0
iya cocot,0
budaya indonesia,0
ajar salat a orang asing pecah belah islam,0
x bicara bangkai,0
percaya negara jajah ranah bubar sistem sistem beraja negara negara republik komunis negara negara jaja,0
bunda ngentot yuk,0
karno anti asing beliau jawa coba deh adakan konsensus jawa anti asing pro asing kebo ohannya keliru tutup akun,0
proyek korupsi rezim susilo bambang yudhoyono uniform resource locator,0
wajar lihat tingkah petinggi negeri suka campur bahas indonesia bahas asing kali bicara,0
ab pribadi senang kompetisi positif,0
kitab suci agama bilang om dadak kalap,0
suka tutup mata tutup lihat te utup gara gara sipit,0
muslim nista kitab suci alquran an alquran an suku detik makna faktual umat islam makna sirat fiksi,0
eh kasar kampang,0
bentar gue rilis album the onta si wkwk,0
cebong bang,0
najis banget gue mentwit barusan he,0
transgender anjing uniform resource locator,0
awas bintit intip titit kucing,0
bawel bawa asa bolot bodor wkwk ya deh,0
gue saran bacot maling ayat langsung to the point orang paham riak kafir sesat liberal puja dukun bla blaaa hati puas deh,0
salah target ahok agenda utama lengser jokowi,0
kena tagar panas banget 2019 ganti presiden,0
maju duit goyang kaki pape duit nak maju kat bodoh uniform resource locator,0
huria kristen batak protestan pecah kristen katolik zaman jajah belanda nama kristen protestan kristen katolik pecah huria kristen batak protestan p kali tarutung k,0
baca biar pintar jepang amerika cina utang tau,0
prabowo kalah bantu jokowi citra ratap pilu,0
takut azan iblis,0
goblok bani cebong tukang tipu jilat kuasa gera bayar pakai nasi bungkus propaganda nasi bungkus gagal,0
cebong sewot,0
2 gera tekan kerja keras total tingkat potensi bangsa,0
gubernur djarot mayoritas ai politik dewan wakil rakyat daerah dukung ahok djarot payah ya uniform resource locator,0
rezim rusak sistem sibuk cari cari salah ketemu komisi berantas korupsi alat besok perintah ganti ulang engah selesai organisasi orang,0
orang orang tuding antek asing asing sungguh be epuk tangan,0
anti asing,0
selamat moga kiprah tingkat nasional,0
asyik menang sih ulama,0
ketapang tenaga kerja asing asing kerja usaha masuk pt who tambang bauksit viral pilih presiden kerja era gubernur cornelis wakil,0
anak pecun hobi zina haha,0
bom surat harga syariah negara,0
istirahat presiden momentum saksi telinga mata rapat bentuk pacitan 2003,0
1979 house select committee on assassination hsca temu cacat investigasi laku fbi warren commission hsca simpul tembak laku konspirasi,0
asa genap 1 17 april 2018 gelar hajat pilih presiden acara negara indonesia pilih presiden moga senantiasa jalan aman lancar amin,0
ian pantat,0
orang pintar agama agama nista hujat orang orang bodoh orang maaf lahir idiot harga cipta tuhan iblis pintar licik,0
daftar calon presiden pilih presiden 2019 buka agustus 2018 normatif politikus partai demokrasi indonesia juang paham 2019 ganti presiden,0
gue mantan mantan gue sedih pikir tidur lo gue anak berengsek laki laki,0
2019 ganti presiden konstitusional hak rakyat woiii nih plonga plongo laku otoriter,0
mari wujud pilih kepala daerah kota bengkulu 2018 aman damai cok adem86 98heru,0
serius presiden jokowi islam nusantara kristen nusantara buddha hindu kong hucu nusantara,0
nyata moeldoko bukti istana takut bangkit umat islam,0
cowok jago drasex ngentot adik luvian,0
kroasia kafir tau ajar kafir lupa kapling sorga,0
nya menteri suha o homo,0
gue tau culun takut orang ubah perlahan lahan buruk,0
perang salib raja afrika babilonia peluk kristen tobaco peluk islam,0
kejar setor bangsat rupiah turun,0
moga tindak lapor hadap nista agama adek armando laku langsung ketua front bela islam kh shobri lubis badan reserse kriminal markas polisi republik indonesia gambir jaka a pusat selasa 10 4 13 00 indonesia barat perhaps,0
bangkai hajar,0
onta mati minum,0
uniform resource locator ahok tng was was hidup,0
sul teng ekses akibat sandera hutang cina 2019 ganti presiden 2019 presiden 2019 jokowi ganti,0
6 pride yunani hyper phania angkuh harga sombong kenal hubris vanity harga ubah manusia sombong sombong manusia kutuk mata tuhan manusia cinta,0
be anya tuju hati logika hati tenang be anya logika hati sedih ku cari wasiat beliau tinggal asing asing mata manusia duhai,0
be aji nya komisi berantas korupsi era era komitmen berantas korupsi surat pemberitahuan era susilo bambang yudhoyono,0
admin tolol ai tolol ai tolol orang tolol,0
ayu ting ting goyang hot raffi ahmad nagita slavina kampung norak uniform resource locator,0
