Tweet,HS_Race
amin moga istikamah khawatir cibir orang anggap uji orang orang dulunya suram kafir taubat tokoh juang agama islam,0
video call gubernur dinas istanbul turki video call lapor pe hibur malam karaoke sense amp diskotik eksotik tutup hormat keras bantu ole,0
bela pancasila daulat negara dukung lengser ancam nyata,0
proyek saracen ganjal lantik anies temu saracen foto tokoh ai politik,0
sih ahok kutil babi,0
soekarno konotasi rejim anti demokrasi ndg embel embel presiden umur hidup,0
bangkai kg tidur siang,0
jokowi kasihan goreng pbb,0
amin moga jokowi presiden,0
meni simpang lgbt nikah hidup berkah dunia rusak zina gera stop kawin,0
kepala polisi republik indonesia mundur jabat,0
daya ekonomi pesantren ulama jawa barat dukung jokowi pilih presiden 2019 jokowi 2019,0
semangat kantor staf presiden publikasi giat presiden rakyat tau presiden kerja keras bangun bangsa kerja kerja kerja,0
cocot,0
tuju dukung presiden upaya kuasa asing ekspor mentah ganti kontrak rugi indonesia,0
kristen nusantara contoh huria kristen batak protestan huria kristen batak protestan gereja kristen jawa gereja kristen jawa gereja pasundan gereja manado gereja malu gereja papua ciri khas sesuai tradisi suku,0
ya bentar utang susilo bambang yudhoyono njiiieng,0
freepo diam negosiasi kalah,0
negara kayak tipu bocah sekolah dasar dokumen hilang huh,0
allah subhanahu wa taala sembah dungu biadab ya,0
ogah prabowo gatot oke,0
baca cerdas biar cap goblok v just kidding maaf balas orang intelligence quotient menge i tulis v,0
calon gubernur jawa nomor urut 1 mempe anyak program unggul rival kait buka lapang kerja 5 juta 5 ganjar situasi ekonomi buka lapang,0
burik iya burik panuan kutu jamur ha rang ajar,0
we jancuk ajar,0
amin rais himbau masyarakat salah pilih pimpin,0
jaman gue negeri kamis pakai baju kotak kotak kayak seragam sekolah kristen jumat nya wajib pakai celana doang pakai baju koko ya,0
najis kirim pesan direct message gue balas bodoh gue doa pentas menang,0
cowok bacot sih anjing gue gampar,0
rizal ramli mayoritas masyarakat jokowi klik rmol calon presiden rakyat,0
indonesia lawyers club boediono century intens lupa kunci butuh 2019 ganti presiden,0
maju gubernur sengsara rawan,0
orang anggap munafik pura,0
kristen prinsip enkulturasi agama katolik indonesia kristen indonesia asing islam kental arab,0
copras calon presiden pikir mikirrrr pikir sih kowi 1 periode babak bur uniform resource locator,0
tau jokowi panggung jilat jilat prabowo dasar lintah uniform resource locator,0
barusan dongok dongok motor klakson be ubi2 lampu merah oi dongok berisik norak pas tengok tau teman chain menang ganti lu darah puteeeh,0
prabowo suka kampanye negatif kampung geli,0
presiden jokowi gubernur anton program selaras jalan hasan,0
the lie tju siswi kelas 1b katolik santo petrus 1984 istri ronaldo pardede siswa kelas 1a katolik santo petrus 1984,0
dengar ulama otot kriminalisasi ulama ya lengser jokowi,0
bencong bacot cewek kayak banci amen kasih duit bacot mending cakap jelek kayak suram mentioned gue langsung kutip twit,0
tolong lihat bok ya panggil pas papas buta budek tunggu,0
enak banget ya om bom susilo bambang yudhoyono debat sangka tinggal,0
kafir alquran situ sehat,0
dukung calon presiden suka atur jokowi prabowo atur menang pilih presiden 2019,0
hebat ahok maaf bini salam 7 surat pemberitahuan ono kabur malu ulama laku bejat,0
dungu islam alquran ajar amoral ansor agama islam posisi moral,0
owner seo tai adminnya hiring sayang 3 s,0
oke sip otak bolot gue bingung,0
hidup prabowo anak soemitro penghianat bangsa,0
perek sih doll ya,0
pilih presiden orang tua nya penghianat negara,0
sih ahok bilang nista agama kayak politikus koruptor panggil urus hukum ngeles pakai sakit hati hati mati,0
tolol aji agama islam sp i orang aji orang,0
new post festival pesona tambora angkat eksotisme alam budaya dompu bima,0
bang laku kristen istri muslim strategi te entu,0
presiden joko widodo jokowi buka kongres 29 himpun mahasiswa katolik republik indonesia himpun mahasiswa katolik republik indonesia pesan konteks politik 2018 jaga kondisi kontestasi politik isi adu program gagas ra,0
cebong kasih fakta bilang dusta cebong kasih dusta bilang realita cebonger si bikin gemas,0
rakyat kaum bani cebong,0
gue menang anjir cupu fik,0
kangen edan,0
oh mami kontol jari pusat 3 ngentot mami mami capai,0
kuliah maroko bilang anies super gubernur jaga asa enak bilang layak presiden,0
orang orang maha nan suci sih hina presiden lepas umur keluh tahan cina tahan keluh perintah orde su,0
salah amp bilang antek asing adik prabowo bilang prabowo pro amerika uniform resource locator,0
jodoh presiden pengantin wanita tajikistan sedih,0
resmi berkat gereja katolik hati kudus yesus batu gantung ambon,0
