Tweet,HS_Race
partai komunis indonesia muncul jelang pilih kepala daerah pilih presiden goreng gosong,1
provokasi mayat politisasi agama kalah pilih kepala daerah daerah khusus ibukota cebong deskripsi kalah junjung for your information ahok pilih camat wakil etnis mayoritas,1
nikmat bijak usul partai komunis indonesia iya,1
umpama orang cina usir paksa indonesia,1
cina babi cina maling usir cina hypertext transfer protocol over secure socket layer t co 9y4hiwhjp2,1
sih tolol tau perintah rezim komunis bobrok koruptor pimpin sidang dewan wakil rakyat paya cebong uniform resource locator,1
cina usak bangsa usir tuju,1
rezim kendali negara cina komunis patron tunggal rezim anti islam jokowi,1
tau bau bau cir sipit buluk,1
dukung calon presiden gagal pindah on sibuk urus asing bawa kabur uang rupiah 35 t sadar asing kabur bawa uang dukung pribumi anjing mustahil asing pribumi diam sogok mental kacung uniform resource locator,1
a inya pribumi sadar lihat kecuali cina komunis misionaris abai twit usir cina indonesia,1
ya cina kenal wisata haram indonesia haha,1
pakai buruh cina rakyat anggur dasar rejim kodok,1
jajah bumi indonesia hapus jajah ekonomi budaya hasil bumi cina basmi negara republik indonesia usir,1
baby kafir buddha teroris myanmar,1
indonesia merdeka indonesia jajah orang cina takbir allahu akbar uniform resource locator,1
yahudi bangkai jerman ibadah,1
hoaks kodok biawak roket sekop bangsat karbitan munafik 2019 ganti presiden 2019 presiden 2019 tenggelam jokowi sungai siak,1
sih royson jokowi kacung gue alas fundamental rezim sepe i sengaja masuk debt trap komunis cina north sumatera offshore wajib 2019 ganti presiden,1
waspada cina komunis indonesia,1
cina hak larang,1
komunis abad partai komunis indonesia kecoak makan kecoak,1
hajar ganyang partai komunis indonesia uniform resource locator,1
masyarakat tionghoa pancasialis orang jawa ekspos contoh nyata kwik ekonom ustaz felix siauw,1
cina cina usir ya rusak sih kerja,1
ayo bangsa indonesia sih etnis cina ahok,1
cina kafir bangsat dasar komunis,1
jenderal propaganda perang propaganda jual utama partai komunis indonesia cina,1
partai komunis indonesia ramai ramai antek komunis opini nyata abur bangkit partai komunis indonesia,1
usir pasang asing cina selamat hutan,1
muncul antek antek partai komunis indonesia berani muncul terang terang mudah mudah perintah tinggal diam uniform resource locator,1
cebong badut nya cina kipas uang receh galak main x,1
cina non muslim bantai sih cina usir,1
moga etnis cina indonesia duduk perintah kayak singapura,1
indonesia jajah cina,1
marak orang sipit masuk indonesia alih hati lah syiah ah rafidhah biang kerok ronta kudeta negara muslim ahlusunah dunia,1
jago bakar isu partai komunis indonesia komunis,1
anak anak partai komunis indonesia muncul jejak,1
ganyang partai komunis indonesia mari dukung prabowo 2019,1
etnis cina juang khianat antek belanda,1
jongos cina merdeka indonesia cina kasih,1
tenaga kerja asing cina manja,1
indonesia ambil alih cina boikot produk cina,1
monyet komunis tolol,1
jend suha o 1965 nasib bangsa indonesia negara komunis ateis,1
hati hati orang orang kader gus dur pribumi antek cina pasang rezim keprek,1
bijak indonesia be entangan cina,1
usir buddha myanmar kacau sepe i myanmar,1
masif cina antek komunis uniform resource locator,1
isu partai komunis indonesia hembus grup grup dukung prabowo,1
ya waspada antek komunis pintar kamuflase,1
monyet komunis piara cina loleng,1
antek partai komunis indonesia simpatisan proxy cina komunis benci tentara nasional indonesia panglima wajar merek,1
bising cina cina nih,1
pahlawan juang susah payah korban jiwa raga usir jajah eh biar negeri jajah cina mudah,1
hebat nya teriak antek cina,1
panas partai komunis indonesia,1
palestina antek asing,1
sumbu pendek jokowi koalisi negara partai komunis indonesia jokowi partai komunis indonesia lengser jokowi pusing hamba,1
laku batak kafir ya sepe i sih suka pecah belah umat,1
ganyang partai komunis indonesia bese a antek antek,1
10 orang kaya indonesia 1 5 orang indonesia orang cina keri indonesia kayak singapura pribumi usir,1
guru aji bilang main sepak bola sepak bola olah raga partai komunis indonesia ejek antek komunis,1
usir jajah cina bumi indonesia,1
anak sih napi cina kafir usir,1
ha dasar cina hitung,1
butuh presiden ganyang partai komunis indonesia anti partai komunis indonesia,1
akibat makan gaji duit korupsi bantu likuiditas bank indonesia laku tokek tokek cina otak cebong dungu tenaga kerja asing cina fiksi fakta anggap isu fiktif hancur negara jual,1
modus sindikat cina tipu uang rakyat indonesia usir cina indonesia,1
aksi dukung pilih presiden suara nada pribumi rakyat indonesia buzzer 2 bayar cina,1
antek antek zionis komunis,1
usir cina negara republik indonesia,1
orang cina bebas sih mukidi ahli cebong 1 tukang tipu cebong goblok ketulungan plonga plongo akibat optimisme 2019 ganti presiden plonga plongo dunning kruger effect,1
antek komunis nya teriak huuuu taufik ismail hafizhahullah uniform resource locator,1
bawang putih orang kafir cina paham komunis awas bawang putih tar bikin negara indonesia,1
korban rezim komunis angka tanggung tanggung 100 juta darah manusia cecer paham halal,1
tionghoa kayak putus sekolah dugem,1
negara jual hebat lek jokowi negara keteng kuasa perintah negara calon pegawai negeri sipil khusus sinamata sipit perkosa negara khianat dasar partai komunis indonesia,1
khianat negara republik indonesia komplot putus rugi negara tenggelam komplot moncong babi antek partai komunis indonesia,1
ganyang partai komunis indonesia kuat tenaga,1
owo hidup nafsu presiden muncul isu partai komunis indonesia komunis anti islam antek cina puter puter situ,1
janji deh janji puluh juta lapang kerja rakyat tenaga kerja asing cina miris,1
kafir partai komunis indonesia samar islam jelek jokowi kafir partai komunis indonesia,1
bicara era habibie susilo bambang yudhoyono hidup tenang percaya isu rasial era khawatir tenaga kerja asing republik rakyat cina masuk masif isu rasial percaya,1
uhuk partai adil sejahtera antek komunis uhuk,1
indonesia beijing usir cina,1
turun langsung lapang sungguh jongos cina duh,1
partai demokrasi indonesia p mega bangkit komunis,1
kampret bilang jokowi antek cina kasih medali emas cina,1
teriak teriak partai komunis indonesia ganyang salat aji tuhan partai komunis indonesia uniform resource locator,1
partai komunis indonesia ya angkat darat gerak massa anti jokowi isu isu anti agama komunis,1
tuju musuh teroris buddha myanmar biksu amp militer nya borobudur waris leluhur uniform resource locator,1
akun komunis,1
partai komunis indonesia partai demokrasi indonesia p bubar partai demokrasi indonesia p,1
ms kakak ban tanah jaka a 87 persen asai cina,1
partai komunis indonesia biadab agama candu masyarakat agama lawan feodalisme amp kapitalisme agama hai bajing rendah anggap orang agama ala,1
jaman daerah khusus ibukota main isu cina kafir cina kafir keluarga sih ono silit eh sulit,1
tenaga kerja asing cina berani leceh bendera merah putih diam tenaga kerja asing cina arogan kuat dukung rezim kuasa mudah tenaga kerja asing cina masuk negara republik indonesia jajah,1
badminton putri indonesia kalah jepang cina main lepas gampang serah komunis enak,1
kerja cornelis tionghoa stres gila,1
1 oktober sakti pancasila pancasila versi arah komunis rezim diktator anti islam,1
matanajwadebatjaka a lucu banget ahok sambung kena sekak mat pe anyaan isu agama dasar cina tolol haha,1
harga pribumi minimal laku sopan tamu sejati ampas hak pribumi stop tenaga kerja asing cina 2019 ganti presiden,1
ayo gelora 2019 ganti presiden insya allah sejahtera komunis lenyap,1
takut ganyang partai komunis indonesia bahaya embrio iblis kembang biak,1
haha antek komunis kelojot jelang 30 september kecebong anak partai komunis indonesia,1
usir nih cina ki gila pamungkas bui gara gara anti cina cina tumpang negeri uniform resource locator,1
tuju partai adil sejahtera partai komunis indonesia partai komunis indonesia persis sepe i partai adil sejahtera gaet golong akar rumput isu isu agama partai adil sejahtera ai komunis syariat,1
ganyang partai komunis indonesia kumpul keripik indonesia uniform resource locator,1
cina negara komunis anti islam sesal rezim hutang negara komunis,1
negeri om kerja jongos cina doang kerja subuh malam gaji pas pas kayak cina,1
bawa nama islam partai komunis indonesia ai komunis syariat,1
hubung ai komunis cina rezim antek antek asing,1
monyet komunis tolol,1
teroris kafir buddha myanmar,1
imigran tinggal myanmar 1948 imigran cina usir indonesia atur main,1
antek komunis film gera 30 september partai komunis indonesia isi bohong uniform resource locator,1
teroris buddha myanmar tembak perahu tumpang anak anak,1
cina masuk salah ras indonesia beda singapura,1
nama perintah revolusioner republik indonesia susah gampang partai komunis indonesia,1
laku psi laku indonesia rakyat psi agen komunis,1
ganyang partai komunis indonesia anjing uniform resource locator,1
sejarah partai komunis indonesia antek komunis sok siksa uniform resource locator,1
perintah negara komunis pancasila be uhan peduli amanat derita rakyat,1
perilaku cina sp penghianat bangsa yoyakarta warga cina kelas pinggir sertifikat hak milik dasar cina keparat,1
pilih cebong liberal tengik sekularisme gelintir antek,1
takbir ganyang partai komunis indonesia,1
indonesia damai usir cina indonesia,1
lawan usir duta myanmar boikot urus buddha,1
cina babi komunis anti agama utama islam bikin ribut indonesia,1
biadab ahok cina kafir rakyat asong asong gusur gusur aniaya surat pemberitahuan teroris ahok kafir biadab,1
buku jokowi undercover susilo bambang yudhoyono dukung jokowi pilih presiden 2014 rahasia kotor korupsi pegang cukong cina,1
kalah suha o prabowo lawan opini 1998 libat konspirasi global as cina sekutu dukung rencana csis elite katolik radikal konglomerat tionghoa jatuh suha o,1
siloam cina usir andai ku mati anak anak ku paham filosofi hidup harga kaki jajah,1
ngeri bangsa sih partai komunis indonesia biadab bangkit tolak bubar,1
i tulis kad raya cina ellooo,1
antek kaki tangan komunis hati perut uniform resource locator,1
khianat partai komunis indonesia bunuh jenderal partai komunis indonesia keblinger karno bubar partai komunis indonesia turun harga harga bubar kabinet tritura,1
cina kuasa ekonomi media massa ayo usir indonesia,1
usir cina indonesia,1
jaga jaga muncul partai komunis indonesia juang alias partai komunis indonesia plus,1
kupas tuntas gebuk habis antek antek komunis,1
coba usir cina 100 rakyat negara republik indonesia gembel negara republik indonesia kayak asing asing triliun uras negara republik indonesia stop tolol,1
betapa biadab teroris buddha myanmar uniform resource locator,1
tragedi 98 nyata salah upaya komunis prabowo,1
ngawur nih rezim indonesia cina nih negara,1
partai demokrasi indonesia juang mega bangkit komunis,1
beda paham kulit tangkap sih cina,1
anjing komunis tolol,1
orang mang salah pilih kalah menang rezim sengsara rakyat komunis,1
orang kiri komunis sosialis marxis mental khianat ajar anti agama buang banding nya 1 99,1
bangga anak partai komunis indonesia gebuk partai komunis indonesia wkwk,1
rezim sekretariat jenderal komunis vietnam gelar karpet merah istana,1
demo teroris botak myanmar arah nya turun jokowi,1
indonesia terjemah cina,1
banteng ngeri sarang komunis,1
usir cina negara republik indonesia warga negara indonesia turun cina skrining,1
myanmar kafir buddha teroris,1
ganyang partai komunis indonesia,1
media milik cina ya usir biang pecah,1
memble up jokowi media media televisi koran milik orang orang cina notabene kafir coba cek lapang,1
gila ya rezim jongos cina,1
dungu bong bangsa cabik cabik tinggal pungut sampah kayak dasar mata sipit,1
ai partai komunis indonesia indonesia pe nama ajar cina rusia partai komunis indonesia penghianat pancasila,1
logis ya pesan ahoker maaf on warga daerah khusus ibukota bego,1
nih ai nyata percaya isi jongos cina komunis,1
tonton bareng film gera 30 september partai komunis indonesia bubar rekam simpan partai komunis indonesia,1
janji jokowi 10 juta lapang kerja nyata tenaga kerja asing cina,1
kaum sipit kuasa tambang indonesia tertawa dasar nasionalisme indonesia pilih dukung 2 periode hasil tambang indonesia asai sipit,1
mari awas keliling jelang 30 si aktivitas antek komunis lapor ulama tentara nasional indonesia ganyang partai komunis indonesia,1
when tumblr tiktok telegram are blokir by the government salah orang blokir aplikasi menteri komunikasi informasi goblok when a zionis kills one palestinian dasar yahudi amp boikot israel beli produk kafir,1
mari rebut posisi kerja lokal tenaga kerja asing cina kendali mayday 2018 buruh 2018 2019 ganti presiden ganti presiden 2019,1
komunis zionis yahudi,1
malam ganyang bakar bunuh partai komunis indonesia,1
anjing komunis nista islam,1
cina babi bikin rusak indonesia bantai,1
monyet komunis dungu sekebun,1
selamat pagi antek antek komunis,1
inti dukung prabowo partai komunis indonesia,1
komunis anti agama,1
kivlan rekan jerit jerit komunis hidup,1
rezim rezim komunis tanda tanda nya sepe i arah kesana ya,1
ya inti dukung prabowo cap partai komunis indonesia,1
presiden indonesia jongos cina komunis kaya antek antek cina gerombol buddha teroris sokong cina racist,1
isu isu partai komunis indonesia muncul hubung pilih presiden bentuk kampanye murah,1
anti cina komunis antek asing kapitalis rakus zionis suara enak enak ngentot ya,1
te arik lihat koruptor bantu likuiditas bank indonesia laku laku taipan bina komunis cina mitra nya megawati sp,1
monyet komunis,1
partai komunis indonesia kali susup acara min massa teriak ganyang partai komunis indonesia,1
ganyang partai komunis indonesia rakyat indonesia dukung uniform resource locator,1
partai demokrasi indonesia juang menang kaum sipit kuasa tambang indonesia tertawa dasar nasionalisme indonesia pilih dukung 2 periode hasil tambang indonesia asai sipit,1
suka teriak pancasila indonesia komunis cina antek antek,1
fakta cina cina parasit otot bela sih nista agama,1
maksud indonesia mayoritas muslim suruh pilih pimpin cina non muslim ya,1
haha pilih kepala daerah dasar polisi made in cina lindung nista agama,1
ganti demokrasi pancasila demokrasi partai komunis indonesia be uhan bebas zina minum keras lgbt partai komunis indonesia indonesia,1
cina bicara cina orang islam rohingya usir buddha myanmar kampret,1
partai komunis indonesia now partai adil sejahtera front bela islam hati huh saracen bayar demo demo fitnah provokasi sara jokowi ahok bayar o susilo bambang yudhoyono prabowo hati thread starter isu istana pro cina partai komunis indonesia anti islam,1
malu malu sok orang kaya nihil prestasi kena denda malu banget dasar cina ky,1
tuduh cina bawa flakka indonesia rusak generasi muda indonesia,1
coba larang ateis republik nista noda leceh perkosa ajar agama haha sanggup adu argumen generasi sains canggi dunia tuhan dasar melayu goblok,1
ya jongos nya sipit,1
biar jokowi semangat gebuk partai komunis indonesia muncul,1
ki gila p titis jayabaya ri undang undang dasar 1945 usir cina,1
ganyang partai komunis indonesia ber intelligence quotient 200 uniform resource locator,1
indeks demokrasi turun indeks komunis partai komunis indonesia otoritarianisme,1
bilang komunis bilang antek amerika anut bumi datar kayak tonton televisi baca korea utara musuh us,1
bunuh partai komunis indonesia anak balas dendam usir komunis cina reklamasi,1
kaum fasis agama main lagu suka ganyang partai komunis indonesia,1
usir duta myanmar negeri kasih umat buddha tawar imbau henti siksa umat islam,1
perintah jalan hubung mesra negara cina komunis,1
diskusi bilang bangkit partai komunis indonesia bela partai komunis indonesia paksa tuduh antek komunis,1
haha ru kacamata cina kafir bro merek ahok hoook,1
pro komunis indonesia komunis uniform resource locator,1
bagus partai komunis indonesia partai komunis indonesia bubar organisasi larang,1
kenyataanya juta rakyat asli pribumi miskin miskin ahok cina kafir,1
fuck orang myanmar noob sial main ml fuck,1
bagus bang usir negara republik indonesia myanmar juluk negara buddha,1
bang hancur bang musnah cina babi bumi pe iwi indonesia kedok reklamasi ahok,1
buddha radikal lindung usir duta myanmar save rohingya pray for rohingya,1
gangbang babi sipit nya mangkal cung hihi,1
perintah anti kritik perintah anti islam perintah antek partai komunis indonesia perintah antek yahudi alas bikin aksi tai banget,1
habis habis bang usir kafir cina nusantara racun akidah tukang sogok kristen lacur minum keras kafir anjing,1
cina gelontor dana filipina perang marawi uniform resource locator uniform resource locator,1
nomor koruptor negeri korup asuh cina babi uniform resource locator,1
hidup cina komunis hypertext transfer protocol over secure socket layer t co b1rhevkrxl,1
serbu tenaga kerja asing cina polisi selundup senjata api hmmm ya uniform resource locator,1
eh proyek nya cina garap putra putri indonesia uniform resource locator,1
kabinet jongos cina,1
ganyang partai komunis indonesia darurat partai komunis indonesia,1
minoritas te indas indonesia cina bahagia,1
usir cina jongos jongos indonesia damai,1
44 gerombol rizieq front bela islam main isu perintah jokowi pro partai komunis indonesia,1
peluk agama buddha indonesia 90 etnis tionghoa cina nya taipan taipan jajah indonesia,1
partai komunis indonesia gaya jokowi antek komunis,1
2 analisa kait 1 susup komunis 2 antek jenderal tua kuasa negara,1
voting malingsia cok jancuk partai komunis indonesia,1
kampret kasar bandit negara republik indonesia orang cina usir rakyat indonesia biar tau,1
a inya kecebong antek komunis,1
data negara gara komunis rezim komunis nyawa rakyat gratis,1
sadis postingan victor bodoh jokowi ahok social media volunteer kecebong kecebong istana jongos cina jamur polisi,1
iklan ahok jahat teroris nyata indonesia wahabi onta babi babi milik cina tebar teror sungguh,1
10 susilo bambang yudhoyono isu partai komunis indonesia cari 3 jokowi simpatisan partai komunis indonesia sp i emas uniform resource locator,1
dukung jokowi 3 pribumi bera i jongos cina penghianat bangsa 4 komunis,1
usir duta myanmar indonesia tanah air negeri haram saudara umat buddha uniform resource locator,1
kacung kacung bela majikan cina keparat proses hukum kacung cari muka,1
suu kyi antek komunis sindir suu kyi dute e menang nobel damai,1
agama islam hidup enak cina hidup gelimang a uniform resource locator,1
karno khianat partai komunis indonesia partai komunis indonesia mayoritas orang jawa partai komunis indonesia bantai o jawa jokowi wakil suara mayoritas jawa pro asing,1
sih kapitalisme haha dasar antek antek komunis,1
gubernur pribumi ya 2019 ganti presiden,1
ragu ganyang partai komunis indonesia,1
sih ahok cina anjing kafir nista agama islam,1
cina anjing hypertext transfer protocol over secure socket layer t co zm1bsjaiha,1
oh antek nya komunis,1
orang turun cina gubernur indonesia bicara orang padang presiden singapura,1
tau malu nih cina angkat kaki istana,1
anak partai komunis indonesia pro syiah antek asing diktator komunis bijak neoliberal,1
bunuh orang ahmadiyah syiah partai komunis indonesia ya,1
antek komunis teriak komunis,1
si babi cina biadab laku kaum pribumi surat pemberitahuan baris serba nu nusantara dukung timpang biadab,1
antek cina percaya komunis sp orang musuh bantai muslim uniform resource locator,1
katak ge er isu jatuh rezim isu kerja intelijen konter gera komunis,1
partai komunis indonesia bangkit,1
partai komunis indonesia rusak islam bahaya,1
antek komunis yayasan lembaga bantu hukum indonesia main main korban,1
matanajwadebatjaka a sih cina babi ahok banget sok pintar banget ahok,1
asing bajing surat pemberitahuan ahok bese a kroni nya anti,1
putar film nya deklarator ai komunis indonesia nama ketua nya komunis cina soviet,1
buah negara coba asai komunis,1
tokoh gus dur presiden warga cina warga negara indonesia nya indonesia mw kuasa cina,1
jajah cina jajah arab atur jual negara as biar bacot langsung tebas sok suci munafik orang koar koar dank,1
warganet jokowi diktator jokowi pro cina jokowi pro rakyat,1
mayoritas etnis cina daerah khusus ibukota solid dukung nista agama islam dendam nasionalis,1
kayak komunis harga jasad manusia cebong komunis,1
rejim partai komunis indonesia lengser jokowi pimpin tukang kriminalisasi ulama,1
ayo bangsa indonesia sih etnis cina perompak aset negara,1
kejar setor cina djarot lengser rezim jongos cina bahaya bangsa negara hukum undang undang konstitusi labrak,1
cina benalu negara republik indonesia,1
ingattt cina komunis antek asing rezim,1
warga negara asing asing indonesia coblos cina 2019 ganti presiden 2019 ganti presiden 2019 ganti presiden,1
ayo pancing antek komunis negara republik indonesia selenggara tonton bareng film khianat 30 si partai komunis indonesia,1
partai komunis indonesia soeha o singkir soekarno tiru prabowo menantu,1
cashier indon haha mesti gelak padan makan babi berengsek,1
situ antek komunis uniform resource locator,1
lihat tumpang penuh tenaga kerja asing cina bahas indonesia inggris cc uniform resource locator,1
haha teriak teriak cina kaca iya junjung turun etnis,1
terima putus presiden partai komunis indonesia muncul gebuk,1
presiden jongos tunggu aba tuan cina nya bantai muslim cina kafir,1
salah jokowi rezim jahat diktator otoriter komunis kafir zalim organisasi papua merdeka uniform resource locator,1
rezim plonga plongo kacung cina plonga plongo dungu haha,1
tuju usir turun arab india cina masuk zul uniform resource locator,1
partai adil sejahtera antek komunis,1
ganyang partai komunis indonesia wajib jaga negara republik indonesia pancasila uniform resource locator,1
dasar cina goblok bayar kucing gembrot model,1
matanajwadebatjaka a sih cina babi ahok banget sok pintar banget ahok,1
ganyang partai komunis indonesia perang buka generasi partai komunis indonesia umat islam,1
wadaauuuwwww oi kalem oi sabar sabar tunggu gara gara sih sipit keparat kebal hukum emosi rakyat kendali jejangan strategi,1
usir cina cina indonesia indonesia kuasa bebas jajah,1
biadab teroris buddha myanmar bakar al alquran,1
sih hidup nebeng cina cina milik jongos cina sih paloh bewok,1
usir cina indonesia rusak bangsa uniform resource locator,1
suruh pakai mata uang cina suruh pakai produk produk tiru cina suruh ajar bahasa cina suruh bantu cina pribumi negara tumpah darah pribumi woiiii mimpi 2019 ganti presiden 2019 ganti presiden,1
alex untung tuduh antek cina partai komunis indonesia haha,1
anjing komunis gonggong sahut,1
tanu usir cina,1
waspada upaya ahoker antek komunis media laku pecah belah umat islam aksi 299 aksi 299,1
situ nge i undang undang kriminal anak anak hina presiden umur 16 penjara 1 5 anak cina ancam bunuh presiden lucu super tolol waras otak,1
sih ahok cina anjing kafir nista agama islam,1
perang cina usir cina bumi indonesia,1
cina racist biar cina kuasa dominasi ri lihat cina singapura usir melayu kampung,1
percaya cina heran jabat indonesia jongos cina kristen tegak hukum islam usir cina,1
narkoba cina dosen cina hutang cina tenaga kerja asing cina periode kurikulum cina salam 2019 ganti presiden,1
ganyang partai komunis indonesia uniform resource locator,1
cina ri negara 75 tanah asai usir pribumi dewa perang,1
ai koalisi dukung perintah jalin kerja politik ai komunis cina,1
tolak versi akal akal rezim edit sesuai selera partai komunis indonesia korban dasar komunis,1
cina babi cina maling usir cina uniform resource locator,1
turun cina racist paham sejarah indonesia paham,1
mari lawan hancur rezim kocak jongos cina komunis,1
diam lu cina keparat,1
usir duta myanmar,1
hubung ai komunis cina rezim antek antek asing,1
era komunis biar kembang,1
ganyang partai komunis indonesia musnah,1
nyata jokowi komunis lengser uniform resource locator,1
partai demokrasi indonesia juang ainya preman komunis maling racist koruptor tipu partai demokrasi indonesia juang kumpul nya orang orang amoral,1
partai komunis indonesia bunuh orang islam anti agama orang islam bantai partai komunis indonesia jihad bela partai komunis indonesia,1
slogan tipu teriak pancasila indonesia hati komunis,1
monyet komunis,1
tai kucing cina intervensi wilayah kalimantan hati hati gara gara ahok si mulut jamban,1
partai komunis indonesia zombi ancam negara republik indonesia umat islam ganyang partai komunis indonesia uniform resource locator,1
biadab kerja cina buang bendera indonesia tanah asing asing tiongkok uniform resource locator,1
komunis sadah bankrut bro iring perestroika cecep gorbachev,1
iklan ahok jahat ahok cipta bara api rakyat pribumi tionghoa balut fobia ahok kafir racist,1
responden institute of southeast asi studies orang indonesia turun cina milik loyalitas hadap republik rakyat cina,1
masjid tua candi candi milik raja hindu buddha nusantara usir cina,1
komunis sederhana paksa atur contoh paksa pakai e uang komunis banget rezim komunis,1
hem sampah tengok live facebook khair din habis habis pusing pasal manifesto ph agama golong dap cina kristiani he nama dap pas eh geram lepas dok motif nak sel,1
bubar acara partai komunis indonesia,1
insya allah kuasa jahat jongos budak cina kafir komunis nafsu jajah rampok indonesia hancur allah subhanahu wa taala,1
orang cina indonesia,1
i hasil emak emak jual puki asli partai komunis indonesia sih ahok anak cina anjing kafir a negara republik indonesia,1
acara dungu biadab bangsa aji budaya muhammad arab buta huruf nabi ganti budaya baca,1
gerombol bela partai komunis indonesia nyata kolam dukung nista aduh,1
cina ahoker berani bayar pribumi aparat aparat korup legal aktivitas cina bangsa suku indonesia usir cina,1
tulis twit kafirun munafik bau bau partai komunis indonesia pancasila indonesia mental mental kacung,1
cina angkat kaki istana,1
tenaga kerja asing cina masuk indonesia masuk om curiga cina cina ahoker,1
nyata indonesia anggota negara makmur cina iya makmur cina,1
ganyang partai demokrasi indonesia p partai demokrasi indonesia p ubah nama partai komunis indonesia,1
