Tweet,HS_Strong
lembaga lembaga anti korupsi bubar sentuh kuasa gilir komisi berantas korupsi partai demokrasi indonesia juang ai politik kuasa pulang otot bubar komisi berantas korupsi,0
mas sudut salah agama t entu bahaya rocky cerdik susun kalimat amp inti kasih tau pnge ian fiksi ayo mas nya i,0
dukung calon presiden gagal pindah on sibuk urus asing bawa kabur uang rupiah 35 t sadar asing kabur bawa uang dukung pribumi anjing mustahil asing pribumi diam sogok mental kacung uniform resource locator,0
rabun budek gue tulis bicara,0
bismillah tahan sepo kutuk,0
brahahahaaa cebong nya ahoker cebong cebok,0
update status bikin tugas tugas selesai ya jancuk jembut,0
muslim jabat negara be indak bangsa negara,0
12 ikan sembuh sakit selamat bagus laik jual pisah seleksi ikan cacat permanen pelihara sehat ikan ncc,0
presiden tuduh rezim anti islam negeri umat uniform resource locator,0
manusia bangsat,0
ya cina kenal wisata haram indonesia haha,0
prabowo partai adil sejahtera bib asyik anggap antek prabowo antek partai adil sejahtera hidup dramatis,0
sahabat salah lovren bukti beda suku agama ras halang bina hubung umat manusia beda warna jalin pe emanan terima kasih lovren salah favorit best friend forever bro,0
lae turun turun ideologi partai komunis indonesia lekat jiwa,0
kesal rokok motor iya kadang pengap tutup macet,0
maaf kunyuk bro enak banget rasan sebar hoaks maaf sebar hoaks maaf mesti sapu biar jera nih orang uniform resource locator,0
halo warga jaka a wakil kepala dinas tanam modal layan padu pintu provinsi daerah khusus ibukota jaka a denny wahyu haryanto wakil wakil gubernur provinsi daerah khusus ibukota jaka a buka acara 2018 junior chamber international jci indonesia nasional event setiamelayanijaka a,0
2 kuat jaring gubernur tekan kuasa state of the a knowledge a bahasa rantau indonesia,0
pandang tuan guru bajang hadap agama politik,0
sedia berengsek,0
susilo bambang yudhoyono presiden ri 6 khofifah emil masyarakat no 1 bagus,0
dungu orang ganti presiden tau mikiiiir,0
bokep cewek bispak bandung ngentot crot unduh full uniform resource locator uniform resource locator,0
kampret complain raga tanggap fuck,0
kayak jablay grand theft auto jemput pakai mobil,0
lihat memek tante,0
ha lengkap orang bukti goblok sih,0
tidak salah orang khalifah rasyidin kami rang orang kafir kalau orang orang munafik tidak orang munafik,0
suka nete uji nasional maklum,0
nek lihat match chelsea sih menang mudah manchester united iya embuh sih chelsea kacrut ki prediksi,0
ya kali tentara nasional indonesia suruh urus sampah plastik,0
khawatir manuver politik bijak laku rezim moga negara republik indonesia cinta amin,0
madi arya lapor rocky gerung polisi serius kitab suci fiksi rocky nyata salah hina tunggu anut agama a anggap kitab suci,0
bajing tengik,0
pakai buruh cina rakyat anggur dasar rejim kodok,0
,0
rupiah haneul cute pacar perek on retweet,0
bilang anti asing asing tau wkwk,0
suriah sekolah radikal rakit bom pulang indonesia ya aman,0
kadang hidup kayak tai kadang berak orang beres tainya tangan iya,0
ih banci selotipan,0
haha kalah nih iya orang jahat kalah,0
gubernur zaman now gus ipul puti 2 ganjar yasin 1 djarot sihar 2 hasan anton 2 koster ace 1 nurdin sudirman 3 karolin gidot 2 keanekaragaman budaya suku agama sungguh kaya djarot hadap pese a rakercabsu,0
cinta orde meng idola prabowo amp hary tanoe,0
tantang buka dada eh setan habis kamus lawan kenegarawanan joko widodo presiden ri 7 stresssssss nih hati hati kena strok serang jantung rakyat indonesia hilang badut badut politik merdeka,0
belah duren ya dungu ya cebong maaf ya,0
2 orang orang yahudi nasrani al kitab taurat injil kenal muhammad,0
ahok verbal keras lampias lari lelaki lunak,0
teman teman kantor langgan cadar langsung bilang awas bom hela nafas,0
pantat nih tusuk tusuk open bo wa 08157686707 gay berondong massage boy gayjaka a gay yogyakarta gay tangger,0
ancam bunuh presiden republik indonesia mas mesti lapor tegak hukum be indak ancam bunuh kepala negara,0
kayak orang nyosor nete,0
ngewe,0
jebur cebur,0
partai adil sejahtera ulang balai kota rr bicara calon presiden balai kota ganti nama balai politik,0
rencana seret adil ham pbb uniform resource locator,0
bijak barang konsumen laku barang rusak cacat produksi konsumen puas produk hitung 7 tanggal beli haus mini quiz hazid kunyuk,0
kisah hidup muhammad lengkap unduh,0
we pipis onta cecer mari bau pesing,0
teriak lantang pm h pro asing pas tawar bantu asing bikin posko inti kompor keluarga korban pm h bilang 15 3,0
mari juang jokowi lantik 2019 gentar takut mata benang leher ujung tombak perut surut langkah bisu suara,0
kayak monyet,0
survei metro televisi jokowi menang presiden hitung ya 45 kalah 46 salah judul maksud jokowi menang sumber zie bajrie,0
,0
cuba tegak anime nih karakai jozu no takagi san nak feeling feeling cinta monyet zaman sekolah throwback habis 9 10 uniform resource locator,0
seru pesta budaya derau kuta kakak anegara,0
kontak retweet ya banget kenal tante jilboobs sange nini nama tante dea o,0
debat publik ajang bukti pintar ruang akademik pamer indah orang kuat lemah egosentris nama kuat tahan l,0
hebat sibuk citra baca nih,0
muslim hina iblis betina nista syariat,0
baby kafir buddha teroris myanmar,0
indonesia merdeka indonesia jajah orang cina takbir allahu akbar uniform resource locator,0
politik hanta yudha pasang calon no 2 nya jawa jawa gayeng 2019 jokowi,0
jongos nista agama ahok sok sok ngong sara majikan nya tebar sara astagfirullah tobat,0
follow beli katolik akun prof wawas bangsa terima kasih,0
sih bejat cabul kecut sih onta iya,0
wibisono citra jokowi sebar up media massa pro asing kes jokowi hasil,0
adi gaya kayak beruk supir tembak metromini masuk dewan wakil rakyat kampung,0
km mainstream mengaa ikan pintar pintar relatif gantung bawa penge iannya surat pemberitahuan pintar meng undeeestimate orang gue pintar komen rejim now pintar mangkrakan janji janji doang sok making,0
gue dongok,0
ih masak sampah,0
gue pukau 2019 ganti presiden,0
aspirasi lina sumedang calon gubernur jabar berantas rebut laki orang resah hidup warga desa,0
yaelah chat urus lihat mesum anggota dewan wakil rakyat diam nyata selingkuh tujuh pura pura budek cebong iq ratus otak,0
takut cina i dap bimbang paham bawa,0
cermin pecah kaca,0
langsung tag ainya berani ya bera i banci,0
awwww comel nya asing warna,0
islam manusia idealis realistis hidup lupa ajak kerja keras ajak istirahat,0
kristus anjing anjing jembut keparat picek tai pejuh siwuk kutang siwuk idiot keparat picek tai pejuh siwuk kutang siwuk idiot keparat picek tai pejuh siwuk kutang siwuk idiot keparat picek tai pejuh siwuk kutang siwuk idiot keparat picek tai pejuh siwuk k,0
agama katolik katolik nusantara agama kristen protestan kristen protestan nusantara agama hindu hindu nusantara agama buddha buddha nusantara,0
3 bas teknologi digital presiden sistem jalan langsung ramah ratas,0
ah asa hibur cebong bahagia presiden cebong tol cebong germo,0
resah presiden hidup penuh drama citra main film televisi joko judul uniform resource locator,0
agama kristen golong darah b nasal san fernando valley,0
buddha bunuh muslim myanmar,0
yahudi bangkai jerman ibadah,0
papa ketua fraksi rakyat nya setya novanto dewan wakil rakyat pecat ketua dewan wakil rakyat pecat dewan wakil rakyat,0
cina,0
hoaks kodok biawak roket sekop bangsat karbitan munafik 2019 ganti presiden 2019 presiden 2019 tenggelam jokowi sungai siak,0
ribut komunis bla bla emoh baca baca niat agitasi serang perintah pakai cari simpatisan,0
10 presiden jokowi harap skema kerja laku bangun bangun,0
pilih langsung biar pilih presiden dewan wakil rakyat calon presiden biar kayak kucing karung bikin mekanisme oke calon presiden gubernur prestasi maju calon presiden gubernur,0
vital inter bek kanan beda ya era maicon ambrosio cancelo bagus nhmmmm bera i simpul geblek ausilio,0
nama agama munafik,0
43 contoh tuding duga korupsi susilo bambang yudhoyono dorong jaksa usut himbau komisi berantas korupsi usut duga korupsi jokowi,0
cium bau bau pecun uniform resource locator,0
henti konsumen wisata haji rumah tipu produsen wisata jiarah indonesia,0
buru nazi simon wiesenthal pegang foto foto gambar mantan kepala gestapo laki laki rauf buah van kamar gas gerak eksekusi orang orang yahudi,0
caci maki nista agama nyata poligami umpet sih ogah,0
sih royson jokowi kacung gue alas fundamental rezim sepe i sengaja masuk debt trap komunis cina north sumatera offshore wajib 2019 ganti presiden,0
wkwk mampus pepet uji ah,0
gubernur jaman now ya anti hoaks sebar isu ganjar yasin menang ganjar yasin 1 ganjar yasin,0
laku bani cebong,0
baju yahudi top 4 bas geng jubah putih kopiah minyak atar janggut dahi belekok bak ahli syurga nih out of place mohon rajam,0
gue ge marah auto daftar hitam hidup gue sampah daur ulang,0
anjir bekas silit,0
cebong panas ngawur,0
amin moga be iga tampil sumbang medali sumatra selatan,0
,0
gubernur zaman now gus ipul puti 2 ganjar yasin 1 djarot sihar 2 hasan anton 2 koster ace 1 nurdin sudirman 3 karolin gidot 2 keanekaragaman budaya suku agama sungguh kaya djarot hadap pese a rakercabsu,0
bingkai bangkai ajar hidup,0
edan menang lihat ya ampun kakak r gue banget,0
partai komunis indonesia alias ai korupsi indonesia ganyang,0
perempuan kayak mending mati deh jelek sok make up a ist,0
jual gue kayak jablay,0
bijak tugas jajar kereta listrik doang tumpang doang suruh orang menge i menge i butuh orang bangkai,0
titit nya sambung pakai accessoris,0
mata gue pas sipit aneh banget,0
banci gigih natural killer uniform resource locator,0
waspada cina komunis indonesia,0
banci kampung heeee,0
gembel ganteng kasihan cinta asyik asyik hebat,0
deklarasi pilih kepala daerah 2018 aman anti hoaks toga jemirahan jabon,0
setia usaha agung pas datuk takiyuddin hasan sahkan cuba pinda lembaga i sepe i presiden i,0
najis,0
sastra e karl mark pentol komunis rusia,0
otak kayak bool deh mes makan silit,0
ganti rezim kacung cebong,0
cina hak larang,0
hebat bicara cinta pegang alquran pegang hidup alquran bicara cinta perang bunuh penggal,0
jomlo jablay,0
perjaka jual sok sok an booking tante idiot anjir,0
rev 1 pilih ulama kafir munafik,0
jaga bersih lingkung orang orang melek wajib buang sampah bicara tugas bersih,0
sejuk gila kantor kulit buaya,0
ooo kena imbang nakal kucing anjing abang dark side bright side chill sosial kalai lengkap haha k bang selamat maju jaya terima kasih,0
solusi 2019 ganti presiden dampak signifikan nya obat cegah sakit be ambah parah,0
gampang kak buka handphone buka browser ketik budaya palembang sila nikmat ajar gratis,0
gerombol onta bela umat mata politik praktis tuan guru bajang demokratis umat pikir modern salut tuan guru bajang,0
culun mending kampung jess,0
goyang jilboobs mantap nih hyper kontol squi tonton live nya besok,0
islam indonesia islam nusantara islam modifikasi rupa masuk budaya indonesia agam islam nusantara islam toleran,0
presiden aspek indonesia mbak anti investasi asing ubah invasi asing wajib warga negara lawan,0
09 15 indonesia barat kepala unit bina masyarakat inspektur polisi mt hutasoit laksana sambang pesan pesan aman tertib masyarakat pilih gubernur pilih kepala daerah 2018 karyawan bank rakyat indonesia ranting muara damenra silit kawan kawan desa hutanagodang camat muara kabupaten tap utara,0
kalimantan tuju batu bara nya keruk listrik megap megap,0
fardu kifayah hukum wajib ajar islam pilih presiden utus kalang santri sokong ulama maju pimpin negeri,0
ha bangkai nih truk,0
nahdliyin setop hina hadap maruf amin,0
cebong kampret onta singgung laut,0
risa pulang latih khusus iris hazel milik tangkap siluet orang gadis gadis asing risa temu gadis radio tinggal kerja r,0
haha orang gila bicara cak micin biar otak encer cong omong ngawur muslim muslim silit tau babi,0
coba kaca introspeksi keluarga pakai hijab komunis otak pakai prope iya orang,0
muhammadiyah inggris jalin kerja kendali ekstrem,0
neraka kena bom surga orang muka bumi masuk goku,0
bot ih liebe ih a inya bot kasih ipad barusan cemplung jamban kuda,0
copot darmin nasution menteri ekonomi ekonomi bodoh turun daya beli jabat,0
bodoh anjir bodoh tertawa gue tertawa astagfirullah humor banget uniform resource locator,0
mata picek cuk norak lihat prestasi jokowi nguoblokkk tolol,0
coba dedengkot jin terang ulama saudi rilis publik akidah jin contoh jin anggap kafir peluk kristen hindu buddha peluang masuk surga fatwa saudi jin adal,0
sepe i hujan lebat langit gelap gelita guruh a kilat sumbat jari telinga dengar suara petir ranah takut mati masakan lepas allah me,0
cerdas konseptual,0
nama yoon gi putus iring sergap mata asa antuk gigit bibir ragu gapai gelas minum wine tinggal,0
bismillah melayu raya tanah melayu nama dengar kaji jajah tanah melayu thread kupas serba bani jawi,0
nak kawin nih kena simpan duit ilmu agama kena benda kena senang cerita,0
aduh lucu banget adik kelas gue pas lapor bang field trip taman safari heran 1 nama teman arisan keluarga bawa 1 sekolah tai arisan,0
main anjing,0
hebat arif suku badui hutan jaga budaya nafas hidup hidup jaga imbang alam,0
ya iya gilir ramai bela pas idol mati sedih doang serbu gila gila sarap ya maaf,0
sabar doa usaha ikhtiar mudah mudah bentar 2019 ganti presiden pakai sontek pakai plonga plongo,0
umat islam maksud front bela islam hati muslim nista islam bajing muslim onar kecut lari mesum islam islam gilir mesum islam onar islam,0
warga semarang prihatin kontroversi puisi gus mus,0
celeng nya bang acon susah banget xa,0
cari musuh dasar ana cebong kampret,0
tuju dewan wakil rakyat menteri jabat negara wajib potong 50 masuk presiden pegawai negeri sipil potong pegawai swasta potong,0
nih akun hasil bodoh kaum 212 bikin kaum kaum biar jokowi anti islam wkwk,0
juara tipu junjung bani kampret 212,0
turun cina sipit,0
amin rais bikin kacau suruh reformasi pilih kepala daerah salah hasil,0
takut banci uniform resource locator,0
lindung masyarakat wilayah tawangsari bulu amp lihat terima bekal pam pilih kepala daerah serentak,0
bolot,0
native speaker ya mother language nya english komen jaga bangsat,0
nyata bangkai,0
salah tulis salah bu maksud nya cebong muda kampung,0
nama absurd first impression bikin enak imajinasi ganteng etik pas coba ngewe direct message enak banget harap direct message nyata,0
admin presiden pm,0
stw singaraja suka kontol uniform resource locator,0
kafir haram pimpin monyet,0
shio baekhyun monyet,0
ceruk pasar pasar pasar butuh contoh asuransi pensiun tentara us orang pensiun tentara pensiun tentara asuransi alat butuh orang cacat orang cacat ta,0
kiai staquf suku ras biar mudah paham nalar bahlul arab sembah sodor arab bani saud pro israel eh pura pura,0
laku dosa ya anis sandi bully rendah orang jahat licik bully rendah dunia kejam kawan,0
om om ajar agama buddha hindu coba ajar ya buka mulut,0
alam kerja time cina best kerja melayu haha,0
kuat jijik ku cepat asa kejar kejar ya napas sungkan wkwk,0
hehe nyata pasar global batas lokal asing asing jujur,0
gue diving mampus junedi,0
suciwati revolusi mental jokowi omong kosong bual tuju amp komen uniform resource locator,0
marah orang rupiah panggil sipit hoshi suka mata sepele ah fisik pakai definisi hoshi milik mata sipit deh,0
otak makelar jual aset negara maling aset negara pe amina jual isi tenaga kerja asing tiongkok 2019 ganti presiden nurl,0
akun siti fatimah amp komen laman ringkas parah amp bejat malu moga sehat sabar amp semangat suara,0
bawang putih kafir haram his hiks hiks,0
rawan join buah gera arus rindu pimpin nasional nasionalis islam moderat cak imin the next wakil presiden join 2019,0
onta nsd,0
umpan pakai biar mancing buaya,0
komunis abad partai komunis indonesia kecoak makan kecoak,0
retweeted ikko pribumi tiru horas horas horas kapal feri presiden unjung pulau samosir rangkai kunjung kerja presiden sambut upacara adat samosir pekik horas horas horas,0
mata lu picek ya janji jokowi tagih susilo bambang yudhoyono mata picek blok,0
indonesia be ahan kuat ekonomi politik hun pilih kerja simpan beda agama,0
50 freepo kuasa asing perintah jokowi a jonan menteri energi sumber daya mineral freepo ambil alih saham jonan jos,0
as clara anak pintar dongok kocak cantik idot tau malu urat malu putus butt muka nya imut banget,0
menteri agama riset guru agama islam negeri orientasi publikasi a ikel scopus jenis tantang umat islam guru agama islam negeri pangkal data rujuk bangun database ulama nusantara,0
presiden buruk sejarah bangsa bangsa cebong,0
me nusantara a i nasionalisasi aset asai asing laku pimpin sungguh nasionalis patriotik nusantara versi proxy be uju lemah tahan nusantara nasional bangsa,0
foto profil nya pesawat bilang cinta produk asing sederhana ukur parah tingkat munafik mu langsung terjun pesawat biar sesuai,0
remuk rengginang cocot ah,0
ku padah eh even bodoh bulak curang ompu ya nya still segal sayang eh bodoh sikpande harga,0
,0
