Tweet,HS_Strong
lengser jokowi bangsat,1
cina babi cina maling usir cina hypertext transfer protocol over secure socket layer t co 9y4hiwhjp2,1
salah target ahok agenda utama lengser jokowi,1
cina usak bangsa usir tuju,1
bangkai hajar,1
onta yaman nih gue depo asi,1
mahfud md allah subhanahu wa taala berang bangsa ajak buang islam,1
a inya pribumi sadar lihat kecuali cina komunis misionaris abai twit usir cina indonesia,1
kerja musuh dakwah islam bubar hati rakyat hak lengser jokowi kodok tukang citra,1
bubar hati amp front bela islam uniform resource locator,1
jajah bumi indonesia hapus jajah ekonomi budaya hasil bumi cina basmi negara republik indonesia usir,1
duduk istana negara lengser jokowi salam,1
bubar negara republik indonesia harga mati,1
azan televisi panggil manggil allah subhanahu wa taala dungu biadab henti acara catut nama tuhan,1
hasil penjara ahok alumni 212 dukung rizieq lengser jokowi lebaran,1
fahri hamzah presiden komisi berantas korupsi bubar uniform resource locator,1
bubar dewan wakil rakyat bubar save komisi berantas korupsi,1
tuju ahoker lengser prabowo jokowi hancur penjara karuan uniform resource locator,1
balas usir buddha ajar etnis muslim rohingya singkir data sensus duduk myanmar,1
bela pancasila daulat negara dukung lengser ancam nyata,1
dengar ulama otot kriminalisasi ulama ya lengser jokowi,1
cina cina usir ya rusak sih kerja,1
ayo bangsa indonesia sih etnis cina ahok,1
jokowi serah ganti jokowi lengser jokowi kisas jokowi uniform resource locator,1
bubar komisi berantas korupsi biar leluasa koruptor kaya negeri,1
rezim orang kayak berani tampil layar kaca mohon ambil tindak,1
cina non muslim bantai sih cina usir,1
bubar dewan wakil rakyat komisi berantas korupsi bodoh nya,1
bubar dewan wakil rakyat butuh,1
ganyang partai komunis indonesia mari dukung prabowo 2019,1
buang islam sakit laku manusia,1
dukung koruptor bubar komisi berantas korupsi situ isu isu partai komunis indonesia dasar koruptor,1
ngawur sembarang panitia khusus hambat komisi berantas korupsi lidi teman teman koruptor bubar dewan wakil rakyat sarang koruptor,1
bubar ikat alumni universitas indonesia oi,1
ahok tamat penjara ahok penjara ahok,1
nya muara nya tanggung presiden solusi solusi turun jokowi,1
lengser jokowi frop parah frop,1
mari bubar dewan wakil rakyat uniform resource locator,1
blokir jokowi mantap nyata dunia maya gambar tinggal realisasi dunia nyata lengser jokowi,1
sumbu pendek jokowi koalisi negara partai komunis indonesia jokowi partai komunis indonesia lengser jokowi pusing hamba,1
ganyang partai komunis indonesia bese a antek antek,1
bubar komisi berantas korupsi fud orang sangka kalah nih,1
usir jajah cina bumi indonesia,1
butuh presiden ganyang partai komunis indonesia anti partai komunis indonesia,1
modus sindikat cina tipu uang rakyat indonesia usir cina indonesia,1
usir cina negara republik indonesia,1
indonesia negara hukum jokowi ubah indonesia negara kuasa makar jokowi lengser jokowi,1
coba prabowo level office boy peran jokowi klaim turun uniform resource locator,1
burung dara terbang hulu burung nuri sayap biru suara pilih pilih presiden mancing ikan malam ikan makan campur ketan ayo menang ai islam hancur ai setan allahu akbar,1
tuntut golkar pecat setya novanto dewan wakil rakyat bela mundur pimpin malu,1
ayo buang alquran kitab sampah,1
barakallah dukung 2019 ganti presiden 2019 ganti rezim hancurkanpa aisetan,1
ahok korban rezim turun jokowi,1
khianat negara republik indonesia komplot putus rugi negara tenggelam komplot moncong babi antek partai komunis indonesia,1
ganyang partai komunis indonesia kuat tenaga,1
bubar komisi berantas korupsi sop sadap sesuai putus mk,1
partai politik cari ayo tenggelam partai demokrasi indonesia juang level kepala perintah rugi negara rugi bangsa 2019 ganti presiden 2019 presiden,1
anggota dewan wakil rakyat grup bubar uniform resource locator,1
indonesia beijing usir cina,1
tagar ganti lengser jokowi,1
hancur partai adil sejahtera hancur partai adil sejahtera hancur partai adil sejahtera hancur partai adil sejahtera hancur partai adil sejahtera hancur partai adil sejahtera hancur partai adil sejahtera hanc,1
adab tuju adab buang islam buang islam biadab rang,1
tangkap setya novanto sanggup bubar komisi berantas korupsi,1
tuju bangsa indonesia butuh orang pahlawan nasionalis ajar cinta negara republik indonesia kaum radikal cinta kencing onta biadab singkir kerja rad,1
partai komunis indonesia partai demokrasi indonesia p bubar partai demokrasi indonesia p,1
ulang reformasi 98 jilid 2 turun jokowi,1
tipikal bani 212 bin onta kampret cepat puji orang hormat cepat caci nya salam tuan guru bajang haha bubar partai adil sejahtera,1
serang perintah jokowi bentar henti kuasa lengser pilih presiden,1
presidential threshold langgar konstitusi rezim otoriter habis habis tabrak tubruk undang undang kali undang undang dasar jebol mk lengser jokowi,1
lengser jokowi rejim anti subsidi rejim anti rakyat,1
ahok cari cari celah serang saksi drama ahok kriminalisasi penjara ahok,1
jokowi lengser ganti ahmad heryawan cebong solot contoh,1
grafik posisi papa saham bubar komisi berantas korupsi uniform resource locator,1
takut ganyang partai komunis indonesia bahaya embrio iblis kembang biak,1
lengser lengser jokowi,1
usir nih cina ki gila pamungkas bui gara gara anti cina cina tumpang negeri uniform resource locator,1
biar jokowi lindung ahok 2019 lengser jokowi mantap,1
usir buddha tanah jawa,1
ayo jaga utuh negara republik indonesia tangkap nista agama stop kriminalisasi ulama uniform resource locator,1
ganyang partai komunis indonesia kumpul keripik indonesia uniform resource locator,1
usir duta negara kristen putus hubung diplomatik,1
ayo muslim hantam lgbt rakyat paham buang islam parmusi dorong rancang undang undang anti paham lgbt,1
penjara nista agama turun uniform resource locator,1
bubar dewan wakil rakyat dewan wakil rakyat daerah bentuk panitia khusus hak angket rakyat beku dewan wakil rakyat dewan wakil rakyat daerah,1
imigran tinggal myanmar 1948 imigran cina usir indonesia atur main,1
ancam bunuh lucu ancam presiden banget sih tuntut pidana berat berat,1
bubar dewan wakil rakyat,1
biar hancur rezim uniform resource locator,1
ganyang partai komunis indonesia anjing uniform resource locator,1
pensiun kepala polisi republik indonesia uniform resource locator,1
bubar dewan wakil rakyat diam uniform resource locator,1
takbir ganyang partai komunis indonesia,1
indonesia damai usir cina indonesia,1
kemarin siantar copot spanduk mu curi curi kampanye demo panitia awas milu nih sih djarot main curang kampanye demo buruh tindak pasang calon curang no 2 keren register 40 pilih gubernur sumatera utara 2018 pilih kepala daerah sumatra utara,1
lawan usir duta myanmar boikot urus buddha,1
dana haji embat jokowi lengser negara gadai asing defisit anggar belanja negara amblas turun jokowi,1
blokir jokowi harap lengser jokowi,1
19 pimpin masjid pimpin ajak jalan syariat islam sungguh sungguh jatuh pimpin non muslim,1
siloam cina usir andai ku mati anak anak ku paham filosofi hidup harga kaki jajah,1
ngeri bangsa sih partai komunis indonesia biadab bangkit tolak bubar,1
bubar panitia khusus komisi berantas korupsi polling rakyat parlemen biar bubar panitia khusus komisi berantas korupsi uniform resource locator,1
khianat partai komunis indonesia bunuh jenderal partai komunis indonesia keblinger karno bubar partai komunis indonesia turun harga harga bubar kabinet tritura,1
cina kuasa ekonomi media massa ayo usir indonesia,1
usir cina indonesia,1
kupas tuntas gebuk habis antek antek komunis,1
coba usir cina 100 rakyat negara republik indonesia gembel negara republik indonesia kayak asing asing triliun uras negara republik indonesia stop tolol,1
bubar komisi berantas korupsi kuat lembaga negara sistem politik,1
nyata tol utang jepang 3 jokowi layak makzul turun jokowi,1
nama sandirawa cundang bubar urus ecek ecek berani urus bantu likuiditas bank indonesia rumah sakit sumber waras,1
tolak atur perintah ganti undang undang tolak rezim otoriter atur perintah ganti undang undang pintu masuk lengser jokowi,1
bubar amp usir yordania,1
jokowi mundur jenderal bantai 2019 pilih presiden,1
turun jokowi rezim korban ahok,1
beda paham kulit tangkap sih cina,1
komisi berantas korupsi semrawut goblok bubar c ambang haha haram uniform resource locator,1
tangkap ahok tuju,1
lengser jokowi repo presiden bantu sanggup sejahtera rakyat,1
lengser jokowi,1
henti komisi berantas korupsi bubar dewan wakil rakyat rakus rakyat,1
ahok pilih pimpin dasar agama langgar konstitusi babi bungkus congor pecah belah umat agama,1
bangun kabinet tingkat daya beli lengser,1
usir cina negara republik indonesia warga negara indonesia turun cina skrining,1
ganyang partai komunis indonesia,1
media milik cina ya usir biang pecah,1
lihat rezim jual aset bangsa lengser jokowi garuda bangkrut,1
dukung 200 nyata najwa komisi berantas korupsi dewan wakil rakyat bubar,1
ahoker goblok tuntut lengser jokowi uniform resource locator,1
detik sih be ahan nyata nya kitab suci fiksi fiktif aidit tantang umat islam 240 juta orang negeri orang,1
bubar komisi berantas korupsi nyata lemah kuat adil tata usaha negara batal a inya bohong ott,1
ai partai komunis indonesia indonesia pe nama ajar cina rusia partai komunis indonesia penghianat pancasila,1
tolak bangkit partai komunis indonesia tolak atur perintah ganti undang undang anti islam jokowi diktator lengser jokowi rakyat tentara nasional indonesia uniform resource locator,1
salah propaganda kaum komunis gaya jokowi gerombol lengser jokowi,1
mari awas keliling jelang 30 si aktivitas antek komunis lapor ulama tentara nasional indonesia ganyang partai komunis indonesia,1
4 ai pergi ai banteng nyungsep kunci tang rakyat tunggu sekolah 2019 langsung lengser jokowi revolusi,1
when tumblr tiktok telegram are blokir by the government salah orang blokir aplikasi menteri komunikasi informasi goblok when a zionis kills one palestinian dasar yahudi amp boikot israel beli produk kafir,1
kepung istana mari lengser orang no 1 ina jokowi orang daftar calon pegawai negeri sipil enak daftar calon pegawai negeri sipil mudah buka,1
hukum jokowi turun konstitusional langgar undang undang lengser jokowi,1
bubar hati tolak paham khilafah,1
malam ganyang bakar bunuh partai komunis indonesia,1
kuasa coba adil amanah tolak atur perintah ganti undang undang otoriter tolak atur perintah ganti undang undang anti islam lengser jokowi,1
cina babi bikin rusak indonesia bantai,1
bingung euy profesor doktor bicara sing turun jokowi,1
bohong mimpi delusi nyata nya buruk hukum carut marut larut indonesia bangkrut turun jokowi,1
ganyang partai komunis indonesia rakyat indonesia dukung uniform resource locator,1
ahok jatuh mudah jokowi lengser,1
ayo lengser 2019 kasih ampun,1
cina bicara cina orang islam rohingya usir buddha myanmar kampret,1
perintah ulama ganyang partai komunis indonesia uniform resource locator,1
front bela islam dukung ahok kalah izin allah gusur gubernur koruptor nista agama uniform resource locator,1
komisi berantas korupsi nya bubar gaji uang rakyat main dagel lenong bocah,1
ki gila p titis jayabaya ri undang undang dasar 1945 usir cina,1
ganyang partai komunis indonesia ber intelligence quotient 200 uniform resource locator,1
dewan wakil rakyat bubar bangsa pe ahankan komisi berantas korupsi,1
oke banget usir minoritas umat buddha indonesia ba er umat islam nya,1
bunuh partai komunis indonesia anak balas dendam usir komunis cina reklamasi,1
berani muhammad nabi gadungan dorong komisi lindung anak indonesia larang anak aji,1
kepung yayasan lembaga bantu hukum indonesia bubar hati ikat alumni universitas indonesia oi uniform resource locator,1
bubar komisi berantas korupsi ikan wenang komisi berantas korupsi polisi jaksa,1
kaum fasis agama main lagu suka ganyang partai komunis indonesia,1
kudeta revolusi lengser rezim jokowi panglima kepala polisi republik indonesia ganti tentara nasional indonesia polisi republik indonesia pimpin nasakom bahaya,1
usir duta myanmar negeri kasih umat buddha tawar imbau henti siksa umat islam,1
komisi berantas korupsi bubar rakyat wajib bubar wakil rakyat dewan wakil rakyat,1
tunggu habis aset negara lengser jokowi,1
ayo lengser jokowi dewan wakil rakyat majelis musyawarat rakyat cari aman rakyat kadal doang,1
tangung blokir jokowi yuk ah tingkat lengser jokowi biar hidup bangsa negara negara republik indonesia tenang damai,1
ganti kepala polisi republik indonesia ganti presiden lengser jokowi harga mati,1
lengser jokowi sepe i main,1
hati organisasi paham larang bumi pancasila bubar,1
buddha radikal lindung usir duta myanmar save rohingya pray for rohingya,1
agenda demo turun jokowi penjara ahok partai komunis indonesia besok demo suruh angkat prabowo presiden aksi 299 aksi maksa,1
habis habis bang usir kafir cina nusantara racun akidah tukang sogok kristen lacur minum keras kafir anjing,1
hati bubar,1
ayo adakan referendum bubar dewan wakil rakyat ri komisi berantas korupsi,1
ayo jaga utuh negara republik indonesia tangkap nista agama stop kriminalisasi ulama hypertext transfer protocol over secure socket layer t co dxidq4zqhv,1
ayo lengser jokowi bugis,1
tuju jokowi berani lengser gatot jokowi,1
tangkap ahok kelompok nya laku palsu e kartu tanda duduk rupa khianat bangsa negara,1
mari lengser presiden biar gila ahoker wkwk,1
cocok komisi berantas korupsi bubar caci maki surat pemberitahuan anak,1
ganyang partai komunis indonesia darurat partai komunis indonesia,1
usir cina jongos jongos indonesia damai,1
biar habis nih aset negara lengser jokowi uniform resource locator,1
tangkap jenderal banci kayak prabowo bodoh,1
ayo cepat revolusi lengser jokowi negeri azab allah subhanahu wa taala tegak hukum presiden batas,1
ya demo bawa ria lengser jokowi istana blokir jokowi,1
ganti rezim ganti presiden pilih pasang calon usung partai demokrasi indonesia juang pilih kepala daerah 27 juni 2018 2019 ganti presiden,1
ky fungsi makan gaji buta habis anggar belanja negara hakim nakal rajalela bubar uniform resource locator,1
tuju bubar komisi berantas korupsi angkat ketua badan berantas korupsi uniform resource locator,1
usir duta myanmar indonesia tanah air negeri haram saudara umat buddha uniform resource locator,1
turun tirani kalah tirani ahok tumbang tinggal tugas,1
ragu ganyang partai komunis indonesia,1
2017 ahok lengser misi 2018 lengser jokowi jaka akece,1
lengser otot reklamasi,1
bubar panitia khusus dewan wakil rakyat nya rakyat rugi bayar pajak gaji kerja nya sibuk,1
on the way jakarta wusssstt turun jokowi,1
rezim dablek utang pakai dana haji lengser jokowi,1
lengser jokowi rekan gagal perintah,1
organisasi masyarakat radikal front bela islam huh hati bubar radikal anti bineka anti cina kristen sadar usir suriah suruh gabung isis,1
lengser jokowi langgar undang undang becus kelola negara,1
menteri capai target ganti presiden janji lengser,1
duta myanmar berani usir besok habis salat gerebek duta buddha indonesia gagu,1
bubar hati presiden jokowi nilai diktator uniform resource locator,1
lengser indonesia,1
setya novanto bebas sok dukung bubar bentuk lembaga bersih,1
turun jokowi makan nya minum nya teh botol nya muara nya turun jokowi,1
presiden tolong serah daftar 100 orang merana 2019 ganti presiden,1
rejim partai komunis indonesia lengser jokowi pimpin tukang kriminalisasi ulama,1
ayo bangsa indonesia sih etnis cina perompak aset negara,1
putus hubung diplomatik myanmar jokowi turun uniform resource locator,1
hakim bubar komisi berantas korupsi,1
tugas umat islam indonesia berat tegak hukum lengser jokowi,1
yusril halang halang i bubar hati lengser jokowi,1
bubar dewan wakil rakyat,1
bubar komisi berantas korupsi komisi berantas korupsi pakai alat politik perintah,1
dewan wakil rakyat bubar fungsi habis anggar ladang korupsi uang mahar,1
negeri selamat 1 syarat lengser jokowi jaga negara republik indonesia selamat negeri,1
usir buddha indonesia diam lihat bantai uniform resource locator,1
lengser jokowi biar lihat goblok,1
iya negara pimpin orang paham kelola negara lengser jokowi,1
layak bubar mari referendum rakyat bubar dewan wakil rakyat,1
seriawan hamid marah nilai presiden amp jajar potensi penghianat bangsa kutuk kelak petaka negeri,1
allah subhanahu wa taala paham toleransi buang ajar toleransi indonesia gabung sabang merauke 2016,1
tuju usir turun arab india cina masuk zul uniform resource locator,1
ganyang partai komunis indonesia wajib jaga negara republik indonesia pancasila uniform resource locator,1
siapppp tunggu 2019 cepat jokowi lengser negeri kacau balau,1
hancur partai demokrasi indonesia juang bese a antek 2nya kumpul kafirun munafik,1
ganyang partai komunis indonesia perang buka generasi partai komunis indonesia umat islam,1
usir cina cina indonesia indonesia kuasa bebas jajah,1
usir cina indonesia rusak bangsa uniform resource locator,1
kepung kantor jaka a,1
iya ahok pimpin nista agama penjara hypertext transfer protocol over secure socket layer t co yhho40qwxs,1
hati hati kali usir ahmadiyah kristen susul buddha hindu sunni usir,1
perintah bastian lengser jokowi halang halang aksi bela islam,1
tanu usir cina,1
perang cina usir cina bumi indonesia,1
fahri hamzah usir dewan wakil rakyat,1
komisi berantas korupsi bubar,1
percaya cina heran jabat indonesia jongos cina kristen tegak hukum islam usir cina,1
ganyang partai komunis indonesia uniform resource locator,1
lengser rezim jokowi cepat negara hancur amburadul,1
menga ikan ijab kabul janji nikah langkah rangka buang islam,1
ahok jeruji demo rumah tahan demo jokowi amnesti grasi kasih lengser jokowi salam,1
mari lawan hancur rezim kocak jongos cina komunis,1
nakal polisi kuat animo umat islam lengser jokowi 2019,1
usir duta myanmar,1
tangkap ustaz bajing uniform resource locator,1
save komisi berantas korupsi tolak rekomendasi amp bubar panitia khusus angket komisi berantas korupsi tanda tangan petisi uniform resource locator via,1
tangkap sih gerung nista kitab suci agama,1
komisi berantas korupsi tangkap koruptor komisi berantas korupsi gagal bubar serah polisi jaksa,1
ganyang partai komunis indonesia musnah,1
nyata jokowi komunis lengser uniform resource locator,1
hati wahabi mugkin layak bubar,1
hajar jokowi,1
berat wakil setya novanto dewan wakil rakyat ri pecat setya novanto dewan wakil rakyat ri,1
partai komunis indonesia zombi ancam negara republik indonesia umat islam ganyang partai komunis indonesia uniform resource locator,1
istana asai komunis rakyat lengser jokowi jokowi diktator rakyat tentara nasional indonesia uniform resource locator,1
massa provokasi be eriak ganyang partai komunis indonesia,1
rezim anti islam tumbang 2019,1
negara demokrasi ya bubar komisi berantas korupsi,1
bubar acara partai komunis indonesia,1
organisasi masyarakat hancur negara republik indonesia wajib bubar partai komunis indonesia,1
tumbang jokowi radikal lengser jokowi,1
cina ahoker berani bayar pribumi aparat aparat korup legal aktivitas cina bangsa suku indonesia usir cina,1
cina angkat kaki istana,1
lengser gebuk bukti dukung radikalisme,1
sesuai tap majelis musyawarat rakyat pecat jokowi diam jokowi langgar tap majelis musyawarat rakyat layak lengser majelis musyawarat rakyat takut 98 ulang,1
ganyang partai demokrasi indonesia p partai demokrasi indonesia p ubah nama partai komunis indonesia,1
2019 ganti presiden suka umbar janji lengser,1
tuju usir cina negeri,1
ajak desak perintah atur islam larang indonesia salam,1
lengser jokowi bukti cinta jamban wkwk,1
ratus massa organisasi masyarakat islam gerebek jaka a ganyang partai komunis indonesia uniform resource locator uniform resource locator,1
usir buddha myanmar bumi indonesia uniform resource locator,1
fahri hamzah bela prabowo pe olongan perintah jokowi rohingya bubar partai komunis indonesia bubar partai komunis indonesia,1
rezim jokowi lengser adil kuasa jalan lengser jokowi,1
bubar dewan wakil rakyat nya stop korupsi,1
partai komunis indonesia khilafah anti pancasila bubar tangkap dewan wakil rakyat dukung,1
menteri dagang cina tumpang cari makan hidup indonesia cari perkara pribumi usir negara republik indonesia,1
umat islam butuh pas pilih injak ayo daftar hitam ai politik rezim anti islam,1
busuk sih lihat salah orang salah lihat bubar panitia khusus angket komisi berantas korupsi,1
tangkap ahok kelompok nya laku palsu e kartu tanda duduk rupa khianat bangsa negara,1
tangkap ahok rakyat front bela islam indonesia hancur ulama,1
lihat negara republik indonesia sepe i korea utara rezim jokowi blokir jokowi lengser jokowi,1
selamat indonesia ayo penjara ahok lengser jokowi,1
bubar komisi berantas korupsi,1
dekrit bubar dewan wakil rakyat,1
usaha cina reklamasi pulau batal jokowi lengser uniform resource locator,1
usir bantai orang hindu buddha indonesia biar tau uniform resource locator,1
cina kenal trik tipu daya mending usir suruh habitat asli,1
lengser presiden lemah,1
bubar dewan wakil rakyat,1
pers program sambung buang islam indonesia manfaat,1
usut sandiaga korupsi anies pamer buku jerman batal angkat anies sandi,1
polisi adil tegak hukum dukung rakyat jokowi bikin rakyat resah lengser,1
turun jokowi ayo mahasiswa nongkrong televisi tonton acara alay leluhur panggil,1
turun jokowi jokowi kader partai komunis indonesia selubung boneka sekretariat jenderal partai komunis cina wacana aneh bahaya daulat negara rezim,1
bayak tangkap korupsi komisi berantas korupsi gagal bubar serah polisi jaksa,1
bubar dewan wakil rakyat sarang miskin rakyat,1
ganyang partai komunis indonesia khianat partai komunis indonesia 1948 uniform resource locator,1
mari rapat baris target nya lengser jokowi isu partai komunis indonesia bela kafir pria non pria,1
ganyang partai komunis indonesia uniform resource locator gedung jaka a uniform resource locator uniform resource locator,1
perempuan indonesia ber burka cadar harap musnah indonesia,1
usir orang orang buddha kristen indonesia bakar rumah rumah orang orang kristen buddha,1
usir cina harga,1
alhamdulillah gera sp i mas oknum oknum jahat tunggu moga golput lengser jokowi,1
gebuk pasu congor rusuh sikat habis kasih kendor makhluk makhluk sontoloyo,1
indonesia republik berisik presiden lengser jokowi,1
intelligence quotient 200 lihat langgar ham myanmar 1 usir duta myanmar 2 usir orang agama buddha indonesia,1
rakyat demo bubar dewan wakil rakyat sih jago korupsi,1
kuat islam roboh rezim dukung anti islam,1
keren bang ulas mantap juang bela rakyat lemah nan lengser jokowi,1
2019 ganti presiden pilih kepala daerah daerah khusus ibukota 2017 singkir ahok insya allah 2019 ganti presiden,1
lengser jokowi main hukum,1
saudara cinta agama negara umat islam bangkit gerak 2019 ganti presiden gerak 2019 presiden,1
ganyang partai komunis indonesia tentara nasional indonesia uniform resource locator,1
usir cina bala mongondow juragan ng,1
bubar partai komunis indonesia orde orde pas berantas partai komunis indonesia,1
nih panggil hormat mulia kerja bikin kacau negara ayo ramai ramai golput dewan wakil rakyat bubar dewan wakil rakyat,1
komisi berantas korupsi tangkap ott komisi berantas korupsi gagal bubar serah polisi jaksa,1
lengser penghianat tusuk a antek antek,1
tangkap unggah obrol mesum rekayasa rekayasa kelompok kiri pesan sih kiri tuju kuasa sih kiri lengser jokowi,1
kunyuk nih orang kasih kendor nih ciduk,1
ya tunggu jalur nya lengser jokowi jokowi end,1
penjara nista agama turun hypertext transfer protocol over secure socket layer t co vqh0tnxarz,1
lengser jokowi megawati lengser ahok lengser ahok padam lilin nusantara,1
bantu lengser jokowi,1
unjuk indonesia tuntut lengser jokowi,1
bantah iman allah subhanahu wa taala iman biadab wajib lopor buang islam,1
usir rohingya indonesia rohingya nista gadis buddha myanmar,1
surat pemberitahuan tunggu 2019 lengser hancur negeri presiden,1
penjara cina kafir ateis masuk ahok pimpin babi tukang korupsi,1
tentara nasional indonesia gerak partai komunis indonesia bangkit rajalela lengser jokowi gagal total pimpin indonesia uniform resource locator,1
solusi 2 1 lengser jokowi 2 khilafah,1
koordinasi kuat massa muslim kepung duta myanmar usir duta orang buddha biadab indonesia,1
tuju bahagia senang majelis musyawarat rakyat dewan wakil rakyat bubar gaji negara korupsi rugi,1
ajak negara oki buang islam lukman jalan damai timur,1
lengser om dewan wakil rakyat kuasa rakyat berani kawal lengser,1
usir duta myanmar kumpul orang buddha indonesia lapang buka adakan orasi uniform resource locator,1
potong tangan bajing pimpin munafik daerah munafik persa syariat cambuk orang pacar doang,1
usir turun cina pe ahankan pribumi arab usir turun ya,1
nih partai demokrasi indonesia juang nasional demokrat bicara ganyang partai komunis indonesia memble,1
mending bubar bikin lembaga anti korupsi paradigma bebas,1
jokowi tunggu 2019 2017 lengser konstitusi hehe,1
ganyang partai komunis indonesia waspada bahaya laten,1
usir bakar lilin aksi bineka aksi teroris cina bukti mata sipit pegang lilin,1
bubar dewan wakil rakyat asli negara jalan,1
ayo lengser sih joko,1
dewan wakil rakyat butuh dukung kayak nya nih hak nyata lengser jokowi daulat tangan rakyat serah rakyat,1
kang lengser jokowi kerja nya pikir infrastruktur pikir rakyat nyaman ekonomi stabil,1
ganyang partai komunis indonesia hapus lambang partai komunis indonesia film intimidasi komunis antek partai komunis indonesia sepe i hantu,1
percaya mulut orang xg kenal orang info biar sumbat mulut pakai petas biar modar anjing bohong,1
menteri negeri indonesia janji hancur kuat anti cina jokowi anti pribumi turun jokowi tiru turki,1
lengkap juluk komisi berantas korupsi antek yahudi komunis haha bubar semen padang fc,1
bubar ai gaduh ai burung pipit ai sapi jual agama,1
bubar dewan wakil rakyat,1
bubar komisi berantas korupsi busuk,1
pribumi tolak etnis cina pimpin indonesia adu pancasila bineka,1
lengser jokowi kuasa cina komunis,1
gue rakyat indonesia sukarela berantas cebong komunis,1
usir duta myanmar lindung teroris buddha save rohingya,1
