Tweet,HS_Strong
ganti presiden tenaga kerja asing cina pulang datar cina pakai getek,1
rezim diktaktor ekonomi cina sumpah setia undang undang dasar penghianat turun jokowi,1
mari lengser jokowi habis ramadan,1
gebuk komunis partai komunis indonesia selamat negara republik indonesia kasih kendor bantai ulama kiai nu ulang,1
usaha cina reklamasi pulau batal jokowi lengser,1
usir depak cina amerika komunisme sekuler liberalisme demokrasi ganti hukum allah rasul gus syams,1
usir cina partai komunis indonesia negara republik indonesia,1
khianat undang undang dasar 45 angket nya kesini kena lengser jokowi,1
umat islam toleran umat kristiani buddha rindu cina usir uniform resource locator,1
komisi berantas korupsi kalah layak bubar,1
jokowi kalah demo jokowi kalah rizieq jokowi kalah front bela islam lengser mending rusak negara bangsat,1
usul bagus lengser uniform resource locator,1
ayo nu lengser jokowi gue bantu doa,1
1 kacau hukum politik sosial 2 tanggung presiden 3 jokowi biar 4 lengser jokowi ayo penjara ahok,1
sektor kacau fakta bunuh bela waras orang orang negeri lengser jokowi gas mpr2017,1
om makar om ya makar megawati biar cina cina korup bantu likuiditas bank indonesia partai demokrasi indonesia juang lengser jokowi,1
ganyang partai komunis indonesia ganyang partai komunis indonesia ganyang partai komunis indonesia uniform resource locator,1
garuda sengaja bangkrut biar asai asing asing cina laknat lengser garuda bangkrut,1
tangkap laku polisi lengser jokowi rezim partai komunis indonesia,1
lengser jokowi,1
subhanallah ahok vonis salah naudzubillahimindzalik tanda wajib lengser jokowi,1
cina usir indonesia lihat miskin,1
ganyang partai komunis indonesia antek uniform resource locator,1
allah subhanahu wa taala tuhan gadungan buang jamban jorok,1
lebaran presiden 1 massa 2 wibawa 3 strategi sidang istimewa lengser jokowi lebaran,1
kantor kepung massa takut kuak pokok ganyang partai komunis indonesia,1
lengser tito beres kepala polisi republik indonesia masak sp i lawan ahok dek jokowi kriminalisasi,1
usir cina ganyang cina,1
umat buddha usir indonesia uniform resource locator,1
amin ya rabi lengser jokowi,1
dasar muka tai babi tenar agama bawa bawa berani media sosial umat agama nya hina hina marah mudah nya langsung maaf ayo front bela islam buruh cari o,1
bubar dewan wakil rakyat manfaat hambat maju tega hukum negara republik indonesia,1
bentar partai komunis indonesia indonesia bubar partai demokrasi indonesia juang,1
usir cina negeri kecuali cina patriotik kayak gue,1
kuli cina nya usir tenaga kerja indonesia anggur uniform resource locator,1
besok bubar tentara nasional indonesia,1
bubar dewan wakil rakyat kerja santai antuk gaji wakil wakil rakyat becus susah rakyat,1
bubar komisi berantas korupsi komisi berantas korupsi rusak nalar demokrasi,1
tuju langkah lengser jokowi haha,1
bagus reklamasi gagal batal ahok jokowi lengser enak,1
stigma partai komunis indonesia komunis kafir munafik babi ya dewan wakil rakyat teriak gantung bunuh usir warga negara indonesia etnis cina,1
bubar panitia khusus bubar dewan wakil rakyat,1
1 usir duta myanmar 2 putus hubung diplomatik 3 unjuk nasional 4 tarik nobel suu kyi 5 tuntut maaf umat buddha 6 utus pasu selamat,1
tolong bubar acara partai komunis indonesia uniform resource locator,1
bela cina keparat ubah anjing buduk marah enyah cina keparat bumi negara republik indonesia sumpah cina hidup indonesia setia tanah air sum,1
keji biadab ganyang partai komunis indonesia paham komunis negara republik indonesia uniform resource locator,1
oi warga bawa bocah emak ya oke turun jokowi,1
allahu akbar rakyat front bela islam bubar gera masyarakat indonesia copot kepala polisi daerah jawa barat selamat ulama gaduh ahok,1
1 gusur ahok 2 lengser jokowi,1
jabat negara putus presiden rancang undang undang islam larang indonesia,1
coba kordinir demo dewan wakil rakyat suara rakyat bubar dewan wakil rakyat save komisi berantas korupsi,1
juang kalah ahok pindah lengser jokowi,1
bera i dewan wakil rakyat percaya bubar,1
bubar komisi berantas korupsi ecek ecek urus,1
om makar om adil sosial sosial taipan korup makar makar rezim lengser jokowi,1
indonesia tindak nyata usir duta myanmar indonesia biksu buddha militer bunuh masal genosida etnis rohingya,1
kunyuk dewan wakil rakyat bubar komisi berantas korupsi,1
tebang pilih pilih tebang bubar bentuk lembaga independent,1
ya atuh usir hindu buddha biar monoteis deh tau a i esa sih,1
tuju turun jokowi bela pro partai komunis indonesia,1
rezim paranoid bukti perintah rapuh rindu ria lengser istana ribu rakyat kepal tangan,1
usir cina jokowi radikal usir cina generasi bangsa mental rusak tumbang jokowi uniform resource locator,1
usir teroris buddha bunuh muslim rohingya usir duta myanmar,1
mantap usir kaum cina karawang,1
benam 2018 2019 rezim anti islam,1
mari ganyang partai komunis indonesia negara republik indonesia,1
ayo polisi tangkap usir sih raja kodok komunis istana cebong cina komunis hancur negara republik indonesia,1
usir cina tiongkok uniform resource locator,1
mumpung september ganyang partai komunis indonesia,1
umat muslim indonesia keras jokowi megawati rezim masuk kepala polisi republik indonesia kepala polisi daerah lengser jokowi,1
bubar ai politik,1
bubar panitia khusus buang uang cari gara gara tok uniform resource locator,1
rezim represif anti islam lengser jokowi,1
rakyat lengser jokowi,1
paham eksistensi komisi berantas korupsi logika korupsi lembaga anti maling berantas maling bubar komisi berantas korupsi,1
tumbang jokowi radikal tumbang rezim tirani lengser jokowi,1
mantan nyanyi cilik gembrot jelek banget ya salah eh nyata gede cebong kasihan deh pilih calon sombong orang sujud tenggelam,1
bubar komisi berantas korupsi tanggung polisi republik indonesia jaksa,1
bubar komisi berantas korupsi pilih kasih lolos,1
ganyang partai komunis indonesia antek antek nya jaka a,1
hati hati jajah cina pakai belanda adu domba pribumi lambat usir cina bangsat negara republik indonesia,1
usut korupsi sandiaga anies batal angkat anies sandi,1
presiden bohong blokir jokowi lengser jokowi,1
gue tuju dewan wakil rakyat bubar,1
hati organisasi paham larang bumi pancasila bubar,1
aneh dewan wakil rakyat bau busuk tusuk mafia anggar main proyek bolos bubar,1
ganyang partai komunis indonesia akar akar uniform resource locator,1
makar no lengser jokowi iya faizal assegaf ketua progres 98 juta rakyat demo damai,1
kayak indonesia orang indonesia cina aneh ayo pribumi usir negeri,1
stop tutup iklan meike a meike a proyek bodong pribumi sampah jongos cina be obat,1
ganyang partai komunis indonesia antek antek orang orang ai dukung uniform resource locator,1
bubar hati korupsi mulu,1
usir fahri maling maling dewan wakil rakyat,1
lini panas ganyang partai komunis indonesia,1
kepala otak presiden curiga rakyat buruk sangka takut tagih janji laku rakyat presiden tuduh rakyat intoleransi rakyat radikal teroris tenggelam partai demokrasi indonesia juang ting,1
anies menang tahap lengser jokowi,1
amin lengser jokowi bikin ribet rakyat aksi 313 jokowi takut lengser,1
medali ujung ujung ajak teriak kafir lengser,1
ganyang partai komunis indonesia uniform resource locator,1
lengser jokowi,1
penjara ahok lengser jokowi komunis cina nista alquran an nista agama kriminalisasi ulama kriminalisasi organisasi masyarakat islam,1
pilih kepala daerah daerah khusus ibukota penuh intimidasi hasil sah anies sandi kampanye janji janji palsu batal angkat anies sandi,1
sakti jubah kuasa tunggu rakyat marah pecat setya novanto pecat ketua dewan wakil rakyat,1
allahu akbar gaduh ahok rakyat front bela islam bubar gera masyarakat indonesia copot kepala polisi daerah jabar penjara ahok,1
bera i pribumi ya ayo bahan pribumi usir indonesia turun cina pribumi,1
benci jokowi bawel koreksi beliau lengser,1
komisi berantas korupsi bubar manfaat buang uang rakyat urus korupsi polisi impoten lembaga lebur era presiden rakyat indonesia percaya institusi in,1
usir buddha indonesia notabene mayoritas cina,1
bubar hati tangkap komisi berantas korupsi,1
turun jokowi deh,1
ajar cinta henti nabi muhammad bejat sembah nyembah allah subhanahu wa taala dungu biadab indonesia merdeka 100,1
bubar dewan wakil rakyat bubar dewan wakil rakyat bubar dewan wakil rakyat bubar dewan wakil rakyat bubar dewan wakil rakyat bubar dewan wakil rakyat bubar dewan wakil rakyat bubar dewan wakil rakyat,1
rizieq shihab front bela islam jancuk anjing kontol tempek anjing babi bajing bangsat lonte balon banci bencong tai cabul kecut cok teroris bubar organisasi masyarakat front bela islam hizbut tahrir indonesia makar,1
cowok usaha lacak perhati gue lantas remeh perhati gue kasih khusus basic cowok bego,0
telat tau edan sarap gue gaul cigax jifla cal licew,0
41 kadang pikir percaya tuhan jatuh kali kali kadang tuhan tinggal orang tua rencana pisah kakak pilih kristen anak ter,0
ku tau mata sipit lihat,0
kaum cebong kafir lihat dongok dungu haha,0
ya bani taplak kawan kawan,0
deklarasi pilih kepala daerah 2018 aman anti hoaks warga dukuh sari jabon,0
gue selesai re watch aldnoah zero kampret 2 karakter utama cowok kena friendzone bro xd uniform resource locator,0
admin belanja po nak makan ais kepal milo ais kepal horlicks cendol toping kau kau doket gerai rozak me uaku taipan 2 kembar baby amp romantika bank islam senawang,0
enak ngewe,0
gue jari gue ukur nyali bacot,0
banci kaleng malu pe anyaan 2 nyungsep koe uniform resource locator,0
ajar ekonomi mesti jago privatisasi hati orang aduh ironi,0
aktor huru hara 98 prabowo si lengser perintah jokowi nyata,0
bu guru enak jablay guru sekolah dasar sih kayak nikmat pecun guru,0
lawan bicara gue intelek kayak otak kencing onta gue hadis nabi sahih kafir kayak tolak ahlun nar,0
pikir ampas banget ya,0
ari bek rapi monyet,0
cowok gantle gantle nama banci,0
alga mnr bom,0
anjing ya gue jarang ambek takut wkwk gue budak cinta,0
noob peluang sakit nya gede sih,0
joko widodo nilai presiden lemah sejarah indonesia jokowi milik modal dukung politik ketidakmampuan perintah hadap situasi ekonomi,0
ajar camat bilah hilir deklarasi anti hoaks amp pilih kepala daerah 2018 damai,0
bandara udara internasional ajati bangun gubernur ahmad heryawan anggar belanja negara perintah pusat insya allah operasi,0
gubernur presiden rakyat ya,0
sih kerja delay mulu setan,0
pintu sorga pintu sorga asli pintu hati modus banget,0
partai komunis indonesia muncul jelang pilih kepala daerah pilih presiden goreng gosong,0
nenek nenek heran cebong bohong,0
islam nusantara produk jil pasar gencar antek jil jil anti arab pro asing almarhum kh hasyim muzadi,0
habis sahur jam 10 si bayi nete kali lemas,0
kak emak suka sipit wkwk,0
laku homo jaman now ngentot live blued gay video gvid lokal hangat uniform resource locator,0
kak gue orang jawa maaf ya gue orang palembang kakak deh ajar aksara jawa kelak ajar budaya palembang,0
pegawai guardian training kayak mentang mentang gue kayak gembel kaos flat shoes dijutekin bangsat malas beli kabur gue matahari,0
para bajing luka lady terima ganjar ratus kali lipat sanji selamat ulang laut jkt48,0
aja tolak berita hoaks sukses pilih kepala daerah wilayah kota,0
presiden ri jokowi kerja nya tulus ikhlas rakyat jokowi,0
edan tuju fabiano,0
al alquran ya bang mulut kayak orang kafir bejat hina farhat abbas law,0
lihat beda wibawa wibawa gubernur indonesia masya allah,0
anjir kali lihat orang bego debat pilih kepala daerah kerja serang karakter kecewa on empok silvy and agus debat final pilih kepala daerah jakarta,0
gubernur zaman now gus ipul puti 2 ganjar yasin 1 djarot sihar 2 hasan anton 2 koster ace 1 nurdin sudirman 3 karolin gidot 2 keanekaragaman budaya suku agama sungguh kaya djarot hadap pese a rakercabsu,0
iya islam lokalisasi kristen mas nusantara mas lihat gereja bandung pakai gamelan khotbah pakai bahas sunda jawa huria kristen batak protestan nusantara,0
cipta situasi aman tertib masyarakat jelang pilih kepala daerah 2018 kepala polisi sektor konang silaturahmi tokoh masyarakat,0
positif nse positif respon masyarakat hadap cangkul impor garam impor beras impor jagung impor tenaga kerja impor esemka impor nurl,0
sembahyang adopsi tradisi lokal kerja hindu istilah sembahyang pun lahir tradisi ritus menyembahhyang tunggal shalat sembah all,0
didik bodoh larang bawa agama biar orang islam bayar ahok sadar pilih ahok gila,0
ahok the best abai kaum kampret otak micin,0
sih otak tempurung laden lawan dungu makan hehe,0
awaasss berita saudara gerung susah cari kosakata bocor picing mata bibir monyong samping suara ky nhn kentut politik kotor zaman b pulang ky nhn ngeden dungu,0
pinokio umur 3 2019 ganti presiden,0
cerita silat lae kho merah muda oh indonesia liang ie shen tulis cina,0
benci umat islam,0
provokasi mayat politisasi agama kalah pilih kepala daerah daerah khusus ibukota cebong deskripsi kalah junjung for your information ahok pilih camat wakil etnis mayoritas,0
gue nete,0
wkwk bani lowo,0
takabur lahir kuasa rakyat ulama cendikia iblis makhluk alim amp ibadah atus ratus laknat hasud takabur orang ahli ilmu filsafat failosof mari demo sendi,0
a orang suka konser konser boros,0
makan racun ulama hukum rokok mubah,0
susilo bambang yudhoyono presiden ri 6 khofifah emil masyarakat no 1 bagus khofifah emil nomor,0
kali gue gemar korea pop omong teman teman gue idol gue banci homo,0
suka video uniform resource locator kisah seteru haji bolot amp malih tongtong,0
budaya kafir sungguh islam indah,0
hem hem diam bisu coba rumput goyang,0
setan bisik was was lindung allah qs al a raf 200 fussilat 36,0
ateis sibuk agama orang,0
selamat kakak 2019 ganti presiden 2019 presiden,0
bajing homo hati hati hadap anak anak utama kamar mandi laki laki biar uniform resource locator,0
iya cocot,0
budaya indonesia,0
ajar salat a orang asing pecah belah islam,0
x bicara bangkai,0
percaya negara jajah ranah bubar sistem sistem beraja negara negara republik komunis negara negara jaja,0
nikmat bijak usul partai komunis indonesia iya,0
umpama orang cina usir paksa indonesia,0
bunda ngentot yuk,0
karno anti asing beliau jawa coba deh adakan konsensus jawa anti asing pro asing kebo ohannya keliru tutup akun,0
proyek korupsi rezim susilo bambang yudhoyono uniform resource locator,0
wajar lihat tingkah petinggi negeri suka campur bahas indonesia bahas asing kali bicara,0
ab pribadi senang kompetisi positif,0
kitab suci agama bilang om dadak kalap,0
suka tutup mata tutup lihat te utup gara gara sipit,0
muslim nista kitab suci alquran an alquran an suku detik makna faktual umat islam makna sirat fiksi,0
eh kasar kampang,0
bentar gue rilis album the onta si wkwk,0
cebong bang,0
najis banget gue mentwit barusan he,0
transgender anjing uniform resource locator,0
awas bintit intip titit kucing,0
bawel bawa asa bolot bodor wkwk ya deh,0
gue saran bacot maling ayat langsung to the point orang paham riak kafir sesat liberal puja dukun bla blaaa hati puas deh,0
kena tagar panas banget 2019 ganti presiden,0
maju duit goyang kaki pape duit nak maju kat bodoh uniform resource locator,0
huria kristen batak protestan pecah kristen katolik zaman jajah belanda nama kristen protestan kristen katolik pecah huria kristen batak protestan p kali tarutung k,0
baca biar pintar jepang amerika cina utang tau,0
prabowo kalah bantu jokowi citra ratap pilu,0
takut azan iblis,0
goblok bani cebong tukang tipu jilat kuasa gera bayar pakai nasi bungkus propaganda nasi bungkus gagal,0
cebong sewot,0
2 gera tekan kerja keras total tingkat potensi bangsa,0
gubernur djarot mayoritas ai politik dewan wakil rakyat daerah dukung ahok djarot payah ya uniform resource locator,0
rezim rusak sistem sibuk cari cari salah ketemu komisi berantas korupsi alat besok perintah ganti ulang engah selesai organisasi orang,0
orang orang tuding antek asing asing sungguh be epuk tangan,0
anti asing,0
selamat moga kiprah tingkat nasional,0
asyik menang sih ulama,0
ketapang tenaga kerja asing asing kerja usaha masuk pt who tambang bauksit viral pilih presiden kerja era gubernur cornelis wakil,0
anak pecun hobi zina haha,0
bom surat harga syariah negara,0
istirahat presiden momentum saksi telinga mata rapat bentuk pacitan 2003,0
1979 house select committee on assassination hsca temu cacat investigasi laku fbi warren commission hsca simpul tembak laku konspirasi,0
asa genap 1 17 april 2018 gelar hajat pilih presiden acara negara indonesia pilih presiden moga senantiasa jalan aman lancar amin,0
ian pantat,0
orang pintar agama agama nista hujat orang orang bodoh orang maaf lahir idiot harga cipta tuhan iblis pintar licik,0
daftar calon presiden pilih presiden 2019 buka agustus 2018 normatif politikus partai demokrasi indonesia juang paham 2019 ganti presiden,0
sih tolol tau perintah rezim komunis bobrok koruptor pimpin sidang dewan wakil rakyat paya cebong uniform resource locator,0
gue mantan mantan gue sedih pikir tidur lo gue anak berengsek laki laki,0
2019 ganti presiden konstitusional hak rakyat woiii nih plonga plongo laku otoriter,0
mari wujud pilih kepala daerah kota bengkulu 2018 aman damai cok adem86 98heru,0
serius presiden jokowi islam nusantara kristen nusantara buddha hindu kong hucu nusantara,0
nyata moeldoko bukti istana takut bangkit umat islam,0
cowok jago drasex ngentot adik luvian,0
kroasia kafir tau ajar kafir lupa kapling sorga,0
nya menteri suha o homo,0
gue tau culun takut orang ubah perlahan lahan buruk,0
perang salib raja afrika babilonia peluk kristen tobaco peluk islam,0
kejar setor bangsat rupiah turun,0
moga tindak lapor hadap nista agama adek armando laku langsung ketua front bela islam kh shobri lubis badan reserse kriminal markas polisi republik indonesia gambir jaka a pusat selasa 10 4 13 00 indonesia barat perhaps,0
onta mati minum,0
uniform resource locator ahok tng was was hidup,0
sul teng ekses akibat sandera hutang cina 2019 ganti presiden 2019 presiden 2019 jokowi ganti,0
6 pride yunani hyper phania angkuh harga sombong kenal hubris vanity harga ubah manusia sombong sombong manusia kutuk mata tuhan manusia cinta,0
be anya tuju hati logika hati tenang be anya logika hati sedih ku cari wasiat beliau tinggal asing asing mata manusia duhai,0
be aji nya komisi berantas korupsi era era komitmen berantas korupsi surat pemberitahuan era susilo bambang yudhoyono,0
admin tolol ai tolol ai tolol orang tolol,0
ayu ting ting goyang hot raffi ahmad nagita slavina kampung norak uniform resource locator,0
video tenaga kerja asing malaysia kutip nyata,0
ppp buru buru tolak wacana pilih kepala daerah dewan wakil rakyat daerah,0
random pagi pagi samper meja kerja pakai bedak sih biar muka bersih istri butek ku pakai air wudhu ku kristen,0
gue kampret,0
memek lonte sodok kontol gede,0
jokowi mundur tutup uniform resource locator,0
bicara mulut sepe i banci beli kaca lihat bro,0
amin racist nada nada ratna sih paiiit nada sih onta nada sih lobang anus takut oi oi habis obat tenang ya,0
tunggu komando imam bejat cabul tai bir bawa ulama dasar banj sempak,0
kabinet beranta pecah belah rezim,0
ih pintar orang politik kaca oi tampang k k orang bego wkwk,0
partai demokrasi indonesia juang menang tekan usaha tambang target proyek impossible lelang murah antek cina ntb contoh partai demokrasi indonesia juang menang dasar bajing,0
percaya mulut buaya mu bawang,0
2019 susilo bambang yudhoyono prabowo lawan mega jokowi peristiwa 2004 ulang partai demokrasi indonesia juang incumbent kalah mutlak susilo bambang yudhoyono jokowi mega susilo bambang yudhoyono lawan prabowo mk pilih presiden selesai 3 poros pilih presiden mk salah lawan,0
kayak banci kaleng gatot gaduh gentleman mundur saing pilih presiden 2019 lawan jokowi,0
bebal,0
5 indonesia negara populasi muslim dunia islam rupa musuh barat amp komunis hambat agenda obviously,0
umuh persib persib kunyuk,0
film muslim pilih ahok mati salat jamin laris,0
banu banu yahudi beda banu banu kristen suriah salah beda banu yahudi pakai eloah elohim yahwe suriah pakai alah allah,0
eh muka merah merah cendol setan cuaca nih panas,0
berita saracen diframing katak tim prabowo anies sandi media tumpah sakit hati katak cebong ehe,0
giat bhayangkara bina aman tertib masyarakat brigadir polisi manajemen bas sekolah sihombing rabu 11 april 2018 laksana sambang desa tatap muka pantau aman tertib masyarakat tuju pilih kepala daerah 2018 desa lobusiregar i rumah rudi panjaitan helm siahaan hotman siahaan,0
sayang banget ya lihat perempuan kayak status tempel laki laki aduh nagita slavina blak blak ayu ting ting kampung viva uniform resource locator,0
lupa kang umat katolik minoritas perhati gubernur golong golong,0
cebong bilang kemarin eyel situ paksa cebong,0
lemah gerindra orang prabowo turun elektabilitasnya congor fadli zon surat pemberitahuan durno,0
selamat kakak kali raya makna kali,0
foto bisu milik a i susah ikan sepe i susah ikan putus,0
wkwk alam muncul grub wa a bani abdi had a k a mbah mek kenal orang,0
ayah pres badar nuqaba boekkk nih hebat bidang agama x takut natural killer tegur member lawak hambar lawak orang jom gerak gera badan chubby,0
orang anak pekan ilham dasar ekonomi deb gerak utama maju ekonomi bandar beliau allah ya rahman tun abdul razak ds malaysia pilih hogohundi,0
haha sialaaan nih sih nyata lapar presiden sikat,0
nasihat kali ugal ugalan nih rezim eh negeri keburu hancur ekonomi moral meni kacaoooooo,0
alah silit kebelet kasihan orang sayang media sosial gue sadar instansi kemarin gue cerita duuuhhh,0
iya cacat,0
2019 rakyat makan aspal beton solusi jitu miskin ahli cebong 1 tukang tipu cebong goblok ketulungan plonga plongo akibat optimisme 2019 ganti presiden,0
baca harun yahya belot kubu yahudi freemason nya kadang suka percaya,0
maju ulama gerak tokoh agama indonesia gus mus,0
,0
mukidi percaya pe anyaan mudah ya keras keras nama,0
kemarin hujat harap dasar bani kampret,0
fitnah sila ban apollinaris darmawan al alquran kitab sampah,0
monyet koloe bilang saudara ogah hidup ya hati comberan,0
body lufra scrub bahan dasar lidah buaya melembabkan kulit amp cahaya info 087812026394 body mass index,0
cacat,0
anut bumi datar teori bumi bulat orang asing notabene musuh,0
becak warga binjai sita tenda be uliskan 2019 ganti presiden partai adil sejahtera radang bukti perintah panik takut,0
jokowi mundur,0
musyawarah nasional alim ulama ppp semarang hasil rekomendasi syarat kriteria kriteria calon wakil presiden damping jokowi 2019 romahurmuziy,0
cerah nya gagal anak ekonomi wkwk,0
kafan budaya yahudi umat islam klaim,0
rezim kendali negara cina komunis patron tunggal rezim anti islam jokowi,0
tanda nya pilih kepala daerah pilih presiden,0
misi 4 bangun masyarakat gotong royong toleran harmoni selaras nilai budaya jawa barat luhur nomor jawa barat asyik asyik menang,0
tabah pasang taufik puan nurliyana wajar contoh jom sumbang ringan beban pasang come on twitter do your pikir badan standar nasional 0510541000096745 bank islam 05058020145124 nurliyana bosan abdul razif,0
sih tai doang belaganya langit karma idol flop gue tertawa keras,0
celeng kangen gue iya,0
rang negeri budaya yuk unjung purwoke o mumpung even rakyat purwoke o ekstra vaganza banyumas,0
presiden dana taktis rakyat program program perintah program bangun infrastruktur kip kartu indonesia sehat ifikat tanah hutan sosial bahan bakar minyak 1 harga padat karya,0
amin ya allah tim latih ular rawa rawa sungai gede musuh buaya wkwk,0
maju maki mama bolot,0
gerombol kadal jidat gosong suka ribut gerombol salah pura pura budek dasar gerombol cingkrang uniform resource locator,0
gentar takut hadap kafir,0
saracen akun kritis anggap saracen aneh jokowi,0
bego teman gue najis kesal gue,0
kafir kristen ulah,0
tau bau bau cir sipit buluk,0
kayak pegang mucikari,0
guru tk darma wanita desa plumbon porong deklarasi anti hoaks benci isu sarah dukung pilih kepala daerah damai,0
anjir seram main,0
kayak bank te entu bilang jual uang asing tukar rupiah,0
hati hati berita pilih kepala daerah bau hoaks madiun madiun today 100thmadiun kotak karismatik madiun tolak cukai ilegal kunjung,0
anak cocot ya,0
udah hoaks ya fahri ambil berita tuyg tong sampah ambil screenshoot tau berita,0
mantap direct message baris serba bang,0
nyata lebah suka bunga makan bangkai gue penasaran madu nya kayak,0
indonesia mundur bentuk,0
dongok bilang hacker haha,0
haha blunder cebong protein energy malnutrition pusat alas ham rakyat aceh ya kali coba perintah bilang suruh hukum islam kaffah aceh dewan wakil rakyat a,0
bangsat gue selam 1,0
pancing pancing urus nista bicara paham fiksi kitab suci,0
cebong kacung teman gue dungu tulang sumsum buang buang energi debat,0
ai korupsi sapi goblok,0
sinyal kontol pelihara niat sih login twitter doang susah open redtube setan,0
mata kafir wkwk,0
facebook anjir lupa,0
sih bilang alah kontol,0
nikita mirzani pakai hijab bicara cebang cebong fantasi uh ah cokorers,0
tatap alih arah enggan tatap pria curiga pe kali gaduh suasana angie temu orang pria asing tidur sofa sepe i,0
lahir kembang gera komunis indonesia pisah buah organisasi nama indische sociaal democratische vereeniging,0
shaheizy wajah baharu calpis,0
ya serah balas fokus kerja kerja tugas proyek seni budaya 2 langsung kumpul presentasi syukur nilai muas proyek,0
bro,0
laku bodoh masuk kategori senang laku sontoloyo menganggu bangsa laku naif langsung bentuk intimidasi hadap ulama laku,0
monyet turun mukim warga cibadak sukabumi uniform resource locator,0
kotor bahagia warga cebong nge i,0
giveaway taplak meja menang the rich chenle,0
buka busuk kubu anies sandi menang berkah uniform resource locator prabowo usaha cuci tangan,0
wkwk bodoh bang,0
kayak orang bego bro b ego,0
menteri lingkung hidup hutan upaya perata ekonomi tora kawasan hutan hutan sosial tribun medan,0
orang orang bego minum amp makan kotor onta otak nya somplak,0
kuak strategi kampanye tim menang anies sandi uniform resource locator,0
warga badui selesai tradisi seba pendopo perintah kabupaten lebak be emu gubernur banten wahidin halim sabtu 21 4 seba baduy 2018,0
